A1: Home | Event News | Gallery | Weather | Results <!-- HIDE FROM OLD BROWSERS function addDate() { monthNames = new Array("January", "February", "March", "April", "May", "June", "July", "August", "September", "October", "November", "December"); myDate = new Date(); var year = myDate.getYear(); if (year < 1000) year += 1900; document.write("<FONT SIZE='3' FACE='Arial, Sans-serif' COLOR='CC0000'><B>" + myDate.getDate() + ", " + " " + monthNames[myDate.getMonth()] + " " + year + "</B></FONT>"); } addDate() // END HIDING --> 14, October 2009 Results Saturday Amended 13/10/09

A1: Position | B1: Sail Number | C1: Time | D1: Title | E1: FirstName | F1: LastName | G1: CraftType | H1: Knots | I1: AgeStatus | J1: Novice | K1: Professional
A2: 1 | B2: 625 | C2: 40096.52118841435 | D2: Mr | E2: Jason | F2: McCaffrey | G2: Kite Board | H2: 24.483142474882481 | I2: Neither | J2: No | K2: Gold Fleet
A3: =A2+1 -> 2 | B3: 44 | C3: 40096.611183692126 | D3: Mr | E3: Dave | F3: Strudwick | G3: Sailboard | H3: 20.997426773182923 | I3: Master | J3: No | K3: Gold Fleet
A4: =A3+1 -> 3 | B4: 3 | C4: 40096.61402306713 | D4: Mr | E4: John | F4: McIntyre | G4: Sailboard | H4: 20.757540730072805 | I4: Master | J4: No | K4: Neither
A5: =A4+1 -> 4 | B5: 328 | C5: 40096.525680219907 | D5: Mr | E5: Adrian | F5: Wallis | G5: Sailboard | H5: 20.667879715982799 | I5: Master | J5: No | K5: Gold Fleet
A6: =A5+1 -> 5 | B6: 210 | C6: 40096.577055706017 | D6: Mr | E6: Gavin | F6: Nicholson | G6: Sailboard | H6: 19.94927856333824 | I6: Neither | J6: Yes | K6: Neither
A7: =A6+1 -> 6 | B7: 140 | C7: 40096.628066006946 | D7: Mr | E7: Steve | F7: Jones | G7: Sailboard | H7: 19.922217864930069 | I7: Neither | J7: No | K7: Gold Fleet
A8: =A7+1 -> 7 | B8: 681 | C8: 40096.628238055557 | D8: Mr | E8: Alan | F8: Cross | G8: Sailboard | H8: 19.655230600173834 | I8: Master | J8: No | K8: Gold Fleet
A9: =A8+1 -> 8 | B9: 292 | C9: 40096.611891446759 | D9: Mr | E9: Nic | F9: Dodd | G9: Sailboard | H9: 19.46707299114588 | I9: Neither | J9: No | K9: Neither
A10: =A9+1 -> 9 | B10: 69 | C10: 40096.541930659725 | D10: Mr | E10: Gareth | F10: Baker | G10: Sailboard | H10: 19.422021866107787 | I10: Neither | J10: No | K10: Gold Fleet
A11: =A10+1 -> 10 | B11: 23 | C11: 40096.526317523145 | D11: Mr | E11: barry | F11: mason | G11: Sailboard | H11: 19.366177816791872 | I11: Master | J11: No | K11: Neither
A12: =A11+1 -> 11 | B12: 863 | C12: 40096.605169513889 | D12: Mr | E12: Duncan | F12: Adam | G12: Sailboard | H12: 19.13662112842108 | I12: Master | J12: No | K12: Neither
A13: =A12+1 -> 12 | B13: 358 | C13: 40096.541742453701 | D13: Mr | E13: Gerard | F13: Northwood | G13: Sailboard | H13: 19.008312049432927 | I13: Master | J13: No | K13: Gold Fleet
A14: =A13+1 -> 13 | B14: 102 | C14: 40096.606038449077 | D14: Mr | E14: Norman | F14: Petty | G14: Sailboard | H14: 18.759449210867597 | I14: Master | J14: No | K14: Neither
A15: =A14+1 -> 14 | B15: 3021 | C15: 40096.519608287039 | D15: Miss | E15: Katherine | F15: Knight | G15: Boat | H15: 18.351840398645493 | I15: Neither | J15: Yes | K15: Neither
A16: =A15+1 -> 15 | B16: 175 | C16: 40096.540744178237 | D16: Mr | E16: Robin | F16: Penna | G16: Sailboard | H16: 17.969809562458806 | I16: Master | J16: No | K16: Gold Fleet
A17: =A16+1 -> 16 | B17: 888 | C17: 40096.524971805557 | D17: Mr | E17: Michael | F17: George | G17: Sailboard | H17: 17.868995254198783 | I17: Neither | J17: No | K17: Neither
A18: =A17+1 -> 17 | B18: 146 | C18: 40096.605443263892 | D18: Mr | E18: Will | F18: Giles | G18: Sailboard | H18: 17.310296584495532 | I18: Junior | J18: No | K18: Neither
A19: =A18+1 -> 18 | B19: 329 | C19: 40096.574465173609 | D19: Mr | E19: Mark | F19: Collins | G19: Sailboard | H19: 16.966457160503637 | I19: Master | J19: No | K19: Neither
A20: =A19+1 -> 19 | B20: 131 | C20: 40096.522754386577 | D20: Mr | E20: P J | F20: Simmons | G20: Sailboard | H20: 16.828215394738045 | I20: Neither | J20: No | K20: Professional
A21: =A20+1 -> 20 | B21: 206 | C21: 40096.614124814812 | D21: Mr | E21: martin | F21: allman | G21: Sailboard | H21: 16.558122979458847 | I21: Master | J21: No | K21: Neither
A22: =A21+1 -> 21 | B22: 425 | C22: 40096.634876678239 | D22: Mr | E22: Sam | F22: Jenkins | G22: Sailboard | H22: 16.461718366542712 | I22: Junior | J22: No | K22: Gold Fleet
A23: =A22+1 -> 22 | B23: 626 | C23: 40096.540250925929 | D23: Mr | E23: martin | F23: hayes | G23: Kite Board | H23: 15.435218728468115 | I23: Neither | J23: No | K23: Neither
A24: =A23+1 -> 23 | B24: 343 | C24: 0.62662037037037044 | D24: Mr | E24: andrew | F24: robinson | G24: Sailboard | H24: 15.16 | I24: Junior | J24: No | K24: Neither
A25: =A24+1 -> 24 | B25: 714 | C25: 40096.615604953702 | D25: Miss | E25: Emily | F25: Hall | G25: Sailboard | H25: 10.804321968695815 | I25: Junior | J25: Yes | K25: Gold Fleet
A26: =A25+1 -> 25 | B26: 104 | C26: 40096.626855821756 | D26: Mr | E26: Will | F26: Houghton | G26: Sailboard | H26: 8.3907400406875237 | I26: Junior | J26: Yes | K26: Neither
A27: =A26+1 -> 26 | B27: 54 | C27: 40096.607602013886 | D27: Mr | E27: Alan | F27: Blundell | G27: Boat | H27: 8.133866160379867 | I27: Master | J27: No | K27: Neither
A28: =A27+1 -> 27 | B28: 852 | C28: 40096.576407650464 | D28: Mr | E28: Henry | F28: Bloodworth | G28: Sailboard | H28: 7.2391982325977819 | I28: Junior | J28: No | K28: Neither
A29: =A28+1 -> 28 | B29: 349 | C29: 40096.630900208336 | D29: Mr | E29: Bruno | F29: Warner | G29: Sailboard | H29: 6.7561440775057804 | I29: Master | J29: No | K29: Neither
A30: =A29+1 -> 29 | B30: 101 | C30: 40096.626911087966 | D30: Mr | E30: Torix | F30: Bennett | G30: Boat | H30: 6.4120606953182087 | I30: Master | J30: No | K30: Gold Fleet
A31: =A30+1 -> 30 | B31: 330 | C31: 40096.571396111111 | D31: Mr | E31: ALISTAIR | F31: WILLIAMS | G31: Sailboard | H31: 5.9153156639832165 | I31: Master | J31: No | K31: Neither
A32: =A31+1 -> 31 | B32: 161 | C32: 40096.559053761572 | D32: Miss | E32: Martina | F32: Zuhlke | G32: Sailboard | H32: 5.8300009647924842 | I32: Neither | J32: Yes | K32: Neither
A33: =A32+1 -> 32 | B33: 112 | C33: 40096.584356793981 | D33: Miss | E33: Emily | F33: Wood | G33: Sailboard | H33: 5.6898111693514215 | I33: Neither | J33: No | K33: Neither
A34: =A33+1 -> 33 | B34: 420 | C34: 40096.55967328704 | D34: Mr | E34: Chris | F34: Etchells | G34: Sailboard | H34: 5.6389588798491834 | I34: Neither | J34: Yes | K34: Neither
A35: =A34+1 -> 34 | B35: 30 | C35: 40096.57917740741 | D35: Mr | E35: alan | F35: bennett | G35: Sailboard | H35: 5.1921625556151545 | I35: Neither | J35: No | K35: Neither
A36: =A35+1 -> 35 | B36: 353 | C36: 40096.579807407405 | D36: Mr | E36: paul | F36: robinson | G36: Sailboard | H36: 5.0332299121353081 | I36: Master | J36: No | K36: Neither
A37: =A36+1 -> 36 | B37: 670 | C37: 40096.564711956016 | D37: Mr | E37: Eddie | F37: Murrell | G37: Sailboard | H37: 5.0131148442000528 | I37: Master | J37: No | K37: Gold Fleet
A38: =A37+1 -> 37 | B38: 116 | C38: 40096.617306921296 | D38: Mr | E38: Michael | F38: Barton | G38: Boat | H38: 4.8213682107108005 | I38: Master | J38: No | K38: Neither
A39: =A38+1 -> 38 | B39: 248 | C39: 40096.551503993054 | D39: Mr | E39: MArcus | F39: Partridge | G39: Sailboard | H39: 4.7082798534159576 | I39: Neither | J39: No | K39: Neither
A40: =A39+1 -> 39 | B40: 95 | C40: 40096.55668976852 | D40: Mr | E40: Stephen | F40: Cronshaw | G40: Sailboard | H40: 4.5846979067983087 | I40: Neither | J40: Yes | K40: Neither
A41: =A40+1 -> 40 | B41: 129 | C41: 40096.566914490744 | D41: Mr | E41: Tim | F41: Fricke | G41: Sailboard | H41: 4.4659470224671391 | I41: Neither | J41: No | K41: Neither
A42: =A41+1 -> 41 | B42: 143 | C42: 40096.572508506943 | D42: Mr | E42: Charles | F42: Wilson | G42: Sailboard | H42: 4.2644672100162442 | I42: Neither | J42: No | K42: Neither
A43: =A42+1 -> 42 | B43: 76 | C43: 40096.553346898145 | D43: Mr | E43: Simon | F43: Perkins | G43: Sailboard | H43: 4.2229812820763426 | I43: Neither | J43: No | K43: Neither
A44: =A43+1 -> 43 | B44: 42 | C44: 40096.574244930554 | D44: Mr | E44: John | F44: Langdown | G44: Sailboard | H44: 4.2193753232448259 | I44: Neither | J44: No | K44: Neither
A45: =A44+1 -> 44 | B45: 1966 | C45: 40096.56827427083 | D45: Mr | E45: Martin | F45: Schramm | G45: Sailboard | H45: 3.9785670710482255 | I45: Neither | J45: Yes | K45: Neither
A46: =A45+1 -> 45 | B46: 55 | C46: 40096.537054386572 | D46: Mr | E46: James | F46: Lawton | G46: Sailboard | H46: 3.9591872471867005 | I46: Neither | J46: Yes | K46: Neither
A47: =A46+1 -> 46 | B47: 555 | C47: 40096.546113634256 | D47: Mr | E47: claude | F47: Van-martyn | G47: Sailboard | H47: 3.8278368220455454 | I47: Master | J47: No | K47: Neither
A48: =A47+1 -> 47 | B48: 571 | C48: 40096.650726423613 | D48: Mr | E48: Ryan | F48: Dunkling | G48: Sailboard | H48: 3.8198722043239224 | I48: Junior | J48: Yes | K48: Neither

A1: Sail Number | B1: Time | C1: Title | D1: FirstName | E1: LastName | F1: CraftType | G1: Knots | H1: AgeStatus | I1: Novice | J1: Professional | K1: fastest
A2: 625 | B2: 40096.52118841435 | C2: Mr | D2: Jason | E2: McCaffrey | F2: Kite Board | G2: 24.483142474882481 | H2: Neither | I2: No | J2: Gold Fleet | K2: fastest
A3: 44 | B3: 40096.611183692126 | C3: Mr | D3: Dave | E3: Strudwick | F3: Sailboard | G3: 20.997426773182923 | H3: Master | I3: No | J3: Gold Fleet | K3: fastest
A4: 3 | B4: 40096.61402306713 | C4: Mr | D4: John | E4: McIntyre | F4: Sailboard | G4: 20.757540730072805 | H4: Master | I4: No | J4: Neither | K4: fastest
A5: 328 | B5: 40096.525680219907 | C5: Mr | D5: Adrian | E5: Wallis | F5: Sailboard | G5: 20.667879715982799 | H5: Master | I5: No | J5: Gold Fleet | K5: fastest
A6: 210 | B6: 40096.577055706017 | C6: Mr | D6: Gavin | E6: Nicholson | F6: Sailboard | G6: 19.94927856333824 | H6: Neither | I6: Yes | J6: Neither | K6: fastest
A7: 140 | B7: 40096.628066006946 | C7: Mr | D7: Steve | E7: Jones | F7: Sailboard | G7: 19.922217864930069 | H7: Neither | I7: No | J7: Gold Fleet | K7: fastest
A8: 681 | B8: 40096.628238055557 | C8: Mr | D8: Alan | E8: Cross | F8: Sailboard | G8: 19.655230600173834 | H8: Master | I8: No | J8: Gold Fleet | K8: fastest
A9: 292 | B9: 40096.611891446759 | C9: Mr | D9: Nic | E9: Dodd | F9: Sailboard | G9: 19.46707299114588 | H9: Neither | I9: No | J9: Neither | K9: fastest
A10: 69 | B10: 40096.541930659725 | C10: Mr | D10: Gareth | E10: Baker | F10: Sailboard | G10: 19.422021866107787 | H10: Neither | I10: No | J10: Gold Fleet | K10: fastest
A11: 23 | B11: 40096.526317523145 | C11: Mr | D11: barry | E11: mason | F11: Sailboard | G11: 19.366177816791872 | H11: Master | I11: No | J11: Neither | K11: fastest
A12: 863 | B12: 40096.605169513889 | C12: Mr | D12: Duncan | E12: Adam | F12: Sailboard | G12: 19.13662112842108 | H12: Master | I12: No | J12: Neither | K12: fastest
A13: 358 | B13: 40096.541742453701 | C13: Mr | D13: Gerard | E13: Northwood | F13: Sailboard | G13: 19.008312049432927 | H13: Master | I13: No | J13: Gold Fleet | K13: fastest
A14: 102 | B14: 40096.606038449077 | C14: Mr | D14: Norman | E14: Petty | F14: Sailboard | G14: 18.759449210867597 | H14: Master | I14: No | J14: Neither | K14: fastest
A15: 3021 | B15: 40096.519608287039 | C15: Miss | D15: Katherine | E15: Knight | F15: Boat | G15: 18.351840398645493 | H15: Neither | I15: Yes | J15: Neither | K15: fastest
A16: 175 | B16: 40096.540744178237 | C16: Mr | D16: Robin | E16: Penna | F16: Sailboard | G16: 17.969809562458806 | H16: Master | I16: No | J16: Gold Fleet | K16: fastest
A17: 888 | B17: 40096.524971805557 | C17: Mr | D17: Michael | E17: George | F17: Sailboard | G17: 17.868995254198783 | H17: Neither | I17: No | J17: Neither | K17: fastest
A18: 146 | B18: 40096.605443263892 | C18: Mr | D18: Will | E18: Giles | F18: Sailboard | G18: 17.310296584495532 | H18: Junior | I18: No | J18: Neither | K18: fastest
A19: 329 | B19: 40096.574465173609 | C19: Mr | D19: Mark | E19: Collins | F19: Sailboard | G19: 16.966457160503637 | H19: Master | I19: No | J19: Neither | K19: fastest
A20: 131 | B20: 40096.522754386577 | C20: Mr | D20: P J | E20: Simmons | F20: Sailboard | G20: 16.828215394738045 | H20: Neither | I20: No | J20: Professional | K20: fastest
A21: 206 | B21: 40096.614124814812 | C21: Mr | D21: martin | E21: allman | F21: Sailboard | G21: 16.558122979458847 | H21: Master | I21: No | J21: Neither | K21: fastest
A22: 425 | B22: 40096.634876678239 | C22: Mr | D22: Sam | E22: Jenkins | F22: Sailboard | G22: 16.461718366542712 | H22: Junior | I22: No | J22: Gold Fleet | K22: fastest
A23: 626 | B23: 40096.540250925929 | C23: Mr | D23: martin | E23: hayes | F23: Kite Board | G23: 15.435218728468115 | H23: Neither | I23: No | J23: Neither | K23: fastest
A24: 343 | B24: 0.62662037037037044 | C24: Mr | D24: andrew | E24: robinson | F24: Sailboard | G24: 15.16 | H24: Junior | I24: No | J24: Neither | K24: fastest
A25: 714 | B25: 40096.615604953702 | C25: Miss | D25: Emily | E25: Hall | F25: Sailboard | G25: 10.804321968695815 | H25: Junior | I25: Yes | J25: Gold Fleet | K25: fastest
A26: 104 | B26: 40096.626855821756 | C26: Mr | D26: Will | E26: Houghton | F26: Sailboard | G26: 8.3907400406875237 | H26: Junior | I26: Yes | J26: Neither | K26: fastest
A27: 54 | B27: 40096.607602013886 | C27: Mr | D27: Alan | E27: Blundell | F27: Boat | G27: 8.133866160379867 | H27: Master | I27: No | J27: Neither | K27: fastest
A28: 852 | B28: 40096.576407650464 | C28: Mr | D28: Henry | E28: Bloodworth | F28: Sailboard | G28: 7.2391982325977819 | H28: Junior | I28: No | J28: Neither | K28: fastest
A29: 349 | B29: 40096.630900208336 | C29: Mr | D29: Bruno | E29: Warner | F29: Sailboard | G29: 6.7561440775057804 | H29: Master | I29: No | J29: Neither | K29: fastest
A30: 101 | B30: 40096.626911087966 | C30: Mr | D30: Torix | E30: Bennett | F30: Boat | G30: 6.4120606953182087 | H30: Master | I30: No | J30: Gold Fleet | K30: fastest
A31: 330 | B31: 40096.571396111111 | C31: Mr | D31: ALISTAIR | E31: WILLIAMS | F31: Sailboard | G31: 5.9153156639832165 | H31: Master | I31: No | J31: Neither | K31: fastest
A32: 161 | B32: 40096.559053761572 | C32: Miss | D32: Martina | E32: Zuhlke | F32: Sailboard | G32: 5.8300009647924842 | H32: Neither | I32: Yes | J32: Neither | K32: fastest
A33: 112 | B33: 40096.584356793981 | C33: Miss | D33: Emily | E33: Wood | F33: Sailboard | G33: 5.6898111693514215 | H33: Neither | I33: No | J33: Neither | K33: fastest
A34: 420 | B34: 40096.55967328704 | C34: Mr | D34: Chris | E34: Etchells | F34: Sailboard | G34: 5.6389588798491834 | H34: Neither | I34: Yes | J34: Neither | K34: fastest
A35: 30 | B35: 40096.57917740741 | C35: Mr | D35: alan | E35: bennett | F35: Sailboard | G35: 5.1921625556151545 | H35: Neither | I35: No | J35: Neither | K35: fastest
A36: 353 | B36: 40096.579807407405 | C36: Mr | D36: paul | E36: robinson | F36: Sailboard | G36: 5.0332299121353081 | H36: Master | I36: No | J36: Neither | K36: fastest
A37: 670 | B37: 40096.564711956016 | C37: Mr | D37: Eddie | E37: Murrell | F37: Sailboard | G37: 5.0131148442000528 | H37: Master | I37: No | J37: Gold Fleet | K37: fastest
A38: 116 | B38: 40096.617306921296 | C38: Mr | D38: Michael | E38: Barton | F38: Boat | G38: 4.8213682107108005 | H38: Master | I38: No | J38: Neither | K38: fastest
A39: 248 | B39: 40096.551503993054 | C39: Mr | D39: MArcus | E39: Partridge | F39: Sailboard | G39: 4.7082798534159576 | H39: Neither | I39: No | J39: Neither | K39: fastest
A40: 95 | B40: 40096.55668976852 | C40: Mr | D40: Stephen | E40: Cronshaw | F40: Sailboard | G40: 4.5846979067983087 | H40: Neither | I40: Yes | J40: Neither | K40: fastest
A41: 129 | B41: 40096.566914490744 | C41: Mr | D41: Tim | E41: Fricke | F41: Sailboard | G41: 4.4659470224671391 | H41: Neither | I41: No | J41: Neither | K41: fastest
A42: 143 | B42: 40096.572508506943 | C42: Mr | D42: Charles | E42: Wilson | F42: Sailboard | G42: 4.2644672100162442 | H42: Neither | I42: No | J42: Neither | K42: fastest
A43: 76 | B43: 40096.553346898145 | C43: Mr | D43: Simon | E43: Perkins | F43: Sailboard | G43: 4.2229812820763426 | H43: Neither | I43: No | J43: Neither | K43: fastest
A44: 42 | B44: 40096.574244930554 | C44: Mr | D44: John | E44: Langdown | F44: Sailboard | G44: 4.2193753232448259 | H44: Neither | I44: No | J44: Neither | K44: fastest
A45: 1966 | B45: 40096.56827427083 | C45: Mr | D45: Martin | E45: Schramm | F45: Sailboard | G45: 3.9785670710482255 | H45: Neither | I45: Yes | J45: Neither | K45: fastest
A46: 55 | B46: 40096.537054386572 | C46: Mr | D46: James | E46: Lawton | F46: Sailboard | G46: 3.9591872471867005 | H46: Neither | I46: Yes | J46: Neither | K46: fastest
A47: 555 | B47: 40096.546113634256 | C47: Mr | D47: claude | E47: Van-martyn | F47: Sailboard | G47: 3.8278368220455454 | H47: Master | I47: No | J47: Neither | K47: fastest
A48: 571 | B48: 40096.650726423613 | C48: Mr | D48: Ryan | E48: Dunkling | F48: Sailboard | G48: 3.8198722043239224 | H48: Junior | I48: Yes | J48: Neither | K48: fastest

A1: Sail Number | B1: Time | C1: Title | D1: FirstName | E1: LastName | F1: CraftType | G1: Knots | H1: AgeStatus | I1: Novice | J1: Professional
A2: 3 | B2: 40096.61402306713 | C2: Mr | D2: John | E2: McIntyre | F2: Sailboard | G2: 20.757540730072805 | H2: Master | I2: No | J2: Neither
A3: 3 | B3: 40096.611040312499 | C3: Mr | D3: John | E3: McIntyre | F3: Sailboard | G3: 20.302807046481071 | H3: Master | I3: No | J3: Neither
A4: 3 | B4: 40096.626987650459 | C4: Mr | D4: John | E4: McIntyre | F4: Sailboard | G4: 19.393881877511234 | H4: Master | I4: No | J4: Neither
A5: 3 | B5: 40096.602921064812 | C5: Mr | D5: John | E5: McIntyre | F5: Sailboard | G5: 19.178269162451347 | H5: Master | I5: No | J5: Neither
A6: 3 | B6: 40096.634567974535 | C6: Mr | D6: John | E6: McIntyre | F6: Sailboard | G6: 17.343798735171184 | H6: Master | I6: No | J6: Neither
A7: 3 | B7: 40096.644040590276 | C7: Mr | D7: John | E7: McIntyre | F7: Sailboard | G7: 15.575264183930431 | H7: Master | I7: No | J7: Neither
A8: 23 | B8: 40096.526317523145 | C8: Mr | D8: barry | E8: mason | F8: Sailboard | G8: 19.366177816791872 | H8: Master | I8: No | J8: Neither
A9: 23 | B9: 40096.583475358799 | C9: Mr | D9: barry | E9: mason | F9: Sailboard | G9: 4.7486635922734521 | H9: Master | I9: No | J9: Neither
A10: 30 | B10: 40096.57917740741 | C10: Mr | D10: alan | E10: bennett | F10: Sailboard | G10: 5.1921625556151545 | H10: Neither | I10: No | J10: Neither
A11: 30 | B11: 40096.55804009259 | C11: Mr | D11: alan | E11: bennett | F11: Sailboard | G11: 4.8851144127072885 | H11: Neither | I11: No | J11: Neither
A12: 42 | B12: 40096.574244930554 | C12: Mr | D12: John | E12: Langdown | F12: Sailboard | G12: 4.2193753232448259 | H12: Neither | I12: No | J12: Neither
A13: 42 | B13: 40096.557638333332 | C13: Mr | D13: John | E13: Langdown | F13: Sailboard | G13: 4.109863364244827 | H13: Neither | I13: No | J13: Neither
A14: 44 | B14: 40096.611183692126 | C14: Mr | D14: Dave | E14: Strudwick | F14: Sailboard | G14: 20.997426773182923 | H14: Master | I14: No | J14: Gold Fleet
A15: 44 | B15: 40096.604056076387 | C15: Mr | D15: Dave | E15: Strudwick | F15: Sailboard | G15: 20.334821842120718 | H15: Master | I15: No | J15: Gold Fleet
A16: 44 | B16: 40096.627313715275 | C16: Mr | D16: Dave | E16: Strudwick | F16: Sailboard | G16: 20.074252580691951 | H16: Master | I16: No | J16: Gold Fleet
A17: 44 | B17: 40096.607771712966 | C17: Mr | D17: Dave | E17: Strudwick | F17: Sailboard | G17: 19.66034662938862 | H17: Master | I17: No | J17: Gold Fleet
A18: 44 | B18: 40096.614731574075 | C18: Mr | D18: Dave | E18: Strudwick | F18: Sailboard | G18: 19.504415811037394 | H18: Master | I18: No | J18: Gold Fleet
A19: 44 | B19: 40096.565318252317 | C19: Mr | D19: Dave | E19: Strudwick | F19: Sailboard | G19: 4.8162297443301654 | H19: Master | I19: No | J19: Gold Fleet
A20: 44 | B20: 40096.646793368054 | C20: Mr | D20: Dave | E20: Strudwick | F20: Sailboard | G20: 4.451602248732109 | H20: Master | I20: No | J20: Gold Fleet
A21: 54 | B21: 40096.607602013886 | C21: Mr | D21: Alan | E21: Blundell | F21: Boat | G21: 8.133866160379867 | H21: Master | I21: No | J21: Neither
A22: 54 | B22: 40096.628348275466 | C22: Mr | D22: Alan | E22: Blundell | F22: Boat | G22: 5.8118011136604499 | H22: Master | I22: No | J22: Neither
A23: 54 | B23: 40096.616866979166 | C23: Mr | D23: Alan | E23: Blundell | F23: Boat | G23: 5.7411837061462565 | H23: Master | I23: No | J23: Neither
A24: 54 | B24: 40096.637704803237 | C24: Mr | D24: Alan | E24: Blundell | F24: Boat | G24: 4.8204231463213487 | H24: Master | I24: No | J24: Neither
A25: 54 | B25: 40096.64955707176 | C25: Mr | D25: Alan | E25: Blundell | F25: Boat | G25: 3.9376918826572496 | H25: Master | I25: No | J25: Neither
A26: 55 | B26: 40096.537054386572 | C26: Mr | D26: James | E26: Lawton | F26: Sailboard | G26: 3.9591872471867005 | H26: Neither | I26: Yes | J26: Neither
A27: 69 | B27: 40096.541930659725 | C27: Mr | D27: Gareth | E27: Baker | F27: Sailboard | G27: 19.422021866107787 | H27: Neither | I27: No | J27: Gold Fleet
A28: 69 | B28: 40096.533855891204 | C28: Mr | D28: Gareth | E28: Baker | F28: Sailboard | G28: 18.425066163350817 | H28: Neither | I28: No | J28: Gold Fleet
A29: 69 | B29: 40096.529834305555 | C29: Mr | D29: Gareth | E29: Baker | F29: Sailboard | G29: 18.411592510081956 | H29: Neither | I29: No | J29: Gold Fleet
A30: 69 | B30: 40096.558612905093 | C30: Mr | D30: Gareth | E30: Baker | F30: Sailboard | G30: 17.687274633635717 | H30: Neither | I30: No | J30: Gold Fleet
A31: 76 | B31: 40096.553346898145 | C31: Mr | D31: Simon | E31: Perkins | F31: Sailboard | G31: 4.2229812820763426 | H31: Neither | I31: No | J31: Neither
A32: 95 | B32: 40096.55668976852 | C32: Mr | D32: Stephen | E32: Cronshaw | F32: Sailboard | G32: 4.5846979067983087 | H32: Neither | I32: Yes | J32: Neither
A33: 101 | B33: 40096.626911087966 | C33: Mr | D33: Torix | E33: Bennett | F33: Boat | G33: 6.4120606953182087 | H33: Master | I33: No | J33: Gold Fleet
A34: 102 | B34: 40096.606038449077 | C34: Mr | D34: Norman | E34: Petty | F34: Sailboard | G34: 18.759449210867597 | H34: Master | I34: No | J34: Neither
A35: 102 | B35: 40096.60289115741 | C35: Mr | D35: Norman | E35: Petty | F35: Sailboard | G35: 18.598111016259022 | H35: Master | I35: No | J35: Neither
A36: 102 | B36: 40096.629185185186 | C36: Mr | D36: Norman | E36: Petty | F36: Sailboard | G36: 18.135925451012074 | H36: Master | I36: No | J36: Neither
A37: 102 | B37: 40096.572236817126 | C37: Mr | D37: Norman | E37: Petty | F37: Sailboard | G37: 17.962178401118582 | H37: Master | I37: No | J37: Neither
A38: 102 | B38: 40096.609377939814 | C38: Mr | D38: Norman | E38: Petty | F38: Sailboard | G38: 17.915920943551782 | H38: Master | I38: No | J38: Neither
A39: 102 | B39: 40096.588395243052 | C39: Mr | D39: Norman | E39: Petty | F39: Sailboard | G39: 17.51356287988235 | H39: Master | I39: No | J39: Neither
A40: 102 | B40: 40096.635487546293 | C40: Mr | D40: Norman | E40: Petty | F40: Sailboard | G40: 17.057868840064977 | H40: Master | I40: No | J40: Neither
A41: 102 | B41: 40096.576457002317 | C41: Mr | D41: Norman | E41: Petty | F41: Sailboard | G41: 16.281257609908593 | H41: Master | I41: No | J41: Neither
A42: 102 | B42: 40096.567474583331 | C42: Mr | D42: Norman | E42: Petty | F42: Sailboard | G42: 15.682209814503189 | H42: Master | I42: No | J42: Neither
A43: 102 | B43: 40096.582714826392 | C43: Mr | D43: Norman | E43: Petty | F43: Sailboard | G43: 15.588581099639988 | H43: Master | I43: No | J43: Neither
A44: 102 | B44: 40096.561716122684 | C44: Mr | D44: Norman | E44: Petty | F44: Sailboard | G44: 15.172122268641436 | H44: Master | I44: No | J44: Neither
A45: 102 | B45: 40096.551650277775 | C45: Mr | D45: Norman | E45: Petty | F45: Sailboard | G45: 14.39845596605597 | H45: Master | I45: No | J45: Neither
A46: 102 | B46: 40096.65053983796 | C46: Mr | D46: Norman | E46: Petty | F46: Sailboard | G46: 4.1159421930943099 | H46: Master | I46: No | J46: Neither
A47: 104 | B47: 40096.626855821756 | C47: Mr | D47: Will | E47: Houghton | F47: Sailboard | G47: 8.3907400406875237 | H47: Junior | I47: Yes | J47: Neither
A48: 104 | B48: 40096.634386423611 | C48: Mr | D48: Will | E48: Houghton | F48: Sailboard | G48: 6.4158732906922236 | H48: Junior | I48: Yes | J48: Neither
A49: 104 | B49: 40096.57459138889 | C49: Mr | D49: Will | E49: Houghton | F49: Sailboard | G49: 6.1643158785061525 | H49: Junior | I49: Yes | J49: Neither
A50: 104 | B50: 40096.560661840274 | C50: Mr | D50: Will | E50: Houghton | F50: Sailboard | G50: 6.0628119291764433 | H50: Junior | I50: Yes | J50: Neither
A51: 104 | B51: 40096.54724039352 | C51: Mr | D51: Will | E51: Houghton | F51: Sailboard | G51: 5.0821906223749114 | H51: Junior | I51: Yes | J51: Neither
A52: 104 | B52: 40096.652378449071 | C52: Mr | D52: Will | E52: Houghton | F52: Sailboard | G52: 3.9009694926377105 | H52: Junior | I52: Yes | J52: Neither
A53: 112 | B53: 40096.584356793981 | C53: Miss | D53: Emily | E53: Wood | F53: Sailboard | G53: 5.6898111693514215 | H53: Neither | I53: No | J53: Neither
A54: 112 | B54: 40096.567515601855 | C54: Miss | D54: Emily | E54: Wood | F54: Sailboard | G54: 5.6621781340305306 | H54: Neither | I54: No | J54: Neither
A55: 112 | B55: 40096.643655 | C55: Miss | D55: Emily | E55: Wood | F55: Sailboard | G55: 5.0558990781687774 | H55: Neither | I55: No | J55: Neither
A56: 116 | B56: 40096.617306921296 | C56: Mr | D56: Michael | E56: Barton | F56: Boat | G56: 4.8213682107108005 | H56: Master | I56: No | J56: Neither
A57: 116 | B57: 40096.60595449074 | C57: Mr | D57: Michael | E57: Barton | F57: Boat | G57: 4.7613857722627237 | H57: Master | I57: No | J57: Neither
A58: 116 | B58: 40096.630929363426 | C58: Mr | D58: Michael | E58: Barton | F58: Boat | G58: 4.6967572179780692 | H58: Master | I58: No | J58: Neither
A59: 116 | B59: 40096.642008402778 | C59: Mr | D59: Michael | E59: Barton | F59: Boat | G59: 4.4894579004534032 | H59: Master | I59: No | J59: Neither
A60: 129 | B60: 40096.566914490744 | C60: Mr | D60: Tim | E60: Fricke | F60: Sailboard | G60: 4.4659470224671391 | H60: Neither | I60: No | J60: Neither
A61: 131 | B61: 40096.522754386577 | C61: Mr | D61: P J | E61: Simmons | F61: Sailboard | G61: 16.828215394738045 | H61: Neither | I61: No | J61: Professional
A62: 140 | B62: 40096.628066006946 | C62: Mr | D62: Steve | E62: Jones | F62: Sailboard | G62: 19.922217864930069 | H62: Neither | I62: No | J62: Gold Fleet
A63: 140 | B63: 40096.611761284723 | C63: Mr | D63: Steve | E63: Jones | F63: Sailboard | G63: 19.688166061398729 | H63: Neither | I63: No | J63: Gold Fleet
A64: 140 | B64: 40096.605501597223 | C64: Mr | D64: Steve | E64: Jones | F64: Sailboard | G64: 19.186620444984669 | H64: Neither | I64: No | J64: Gold Fleet
A65: 140 | B65: 40096.533293020831 | C65: Mr | D65: Steve | E65: Jones | F65: Sailboard | G65: 18.664090977959777 | H65: Neither | I65: No | J65: Gold Fleet
A66: 140 | B66: 40096.615526261572 | C66: Mr | D66: Steve | E66: Jones | F66: Sailboard | G66: 18.653884586298304 | H66: Neither | I66: No | J66: Gold Fleet
A67: 140 | B67: 40096.608632314812 | C67: Mr | D67: Steve | E67: Jones | F67: Sailboard | G67: 18.378952445798923 | H67: Neither | I67: No | J67: Gold Fleet
A68: 140 | B68: 40096.631307638891 | C68: Mr | D68: Steve | E68: Jones | F68: Sailboard | G68: 18.135925451012074 | H68: Neither | I68: No | J68: Gold Fleet
A69: 140 | B69: 40096.635157604163 | C69: Mr | D69: Steve | E69: Jones | F69: Sailboard | G69: 17.985702681790912 | H69: Neither | I69: No | J69: Gold Fleet
A70: 140 | B70: 40096.538054826386 | C70: Mr | D70: Steve | E70: Jones | F70: Sailboard | G70: 17.632712645785364 | H70: Neither | I70: No | J70: Gold Fleet
A71: 140 | B71: 40096.624493310184 | C71: Mr | D71: Steve | E71: Jones | F71: Sailboard | G71: 17.129712310709074 | H71: Neither | I71: No | J71: Gold Fleet
A72: 140 | B72: 40096.543467928241 | C72: Mr | D72: Steve | E72: Jones | F72: Sailboard | G72: 16.777220021911553 | H72: Neither | I72: No | J72: Gold Fleet
A73: 140 | B73: 40096.620964502312 | C73: Mr | D73: Steve | E73: Jones | F73: Sailboard | G73: 16.3237327777275 | H73: Neither | I73: No | J73: Gold Fleet
A74: 140 | B74: 40096.553197905094 | C74: Mr | D74: Steve | E74: Jones | F74: Sailboard | G74: 6.8820745671006653 | H74: Neither | I74: No | J74: Gold Fleet
A75: 140 | B75: 40096.643332372689 | C75: Mr | D75: Steve | E75: Jones | F75: Sailboard | G75: 6.2206316856004724 | H75: Neither | I75: No | J75: Gold Fleet
A76: 143 | B76: 40096.572508506943 | C76: Mr | D76: Charles | E76: Wilson | F76: Sailboard | G76: 4.2644672100162442 | H76: Neither | I76: No | J76: Neither
A77: 143 | B77: 40096.545415682871 | C77: Mr | D77: Charles | E77: Wilson | F77: Sailboard | G77: 4.2293995881291728 | H77: Neither | I77: No | J77: Neither
A78: 146 | B78: 40096.605443263892 | C78: Mr | D78: Will | E78: Giles | F78: Sailboard | G78: 17.310296584495532 | H78: Junior | I78: No | J78: Neither
A79: 146 | B79: 40096.626237488425 | C79: Mr | D79: Will | E79: Giles | F79: Sailboard | G79: 15.664322349019063 | H79: Junior | I79: No | J79: Neither
A80: 146 | B80: 40096.610113391202 | C80: Mr | D80: Will | E80: Giles | F80: Sailboard | G80: 15.47497413059271 | H80: Junior | I80: No | J80: Neither
A81: 146 | B81: 40096.615400636576 | C81: Mr | D81: Will | E81: Giles | F81: Sailboard | G81: 15.44942583644676 | H81: Junior | I81: No | J81: Neither
A82: 146 | B82: 40096.565377962965 | C82: Mr | D82: Will | E82: Giles | F82: Sailboard | G82: 5.1358022134307424 | H82: Junior | I82: No | J82: Neither
A83: 161 | B83: 40096.559053761572 | C83: Miss | D83: Martina | E83: Zuhlke | F83: Sailboard | G83: 5.8300009647924842 | H83: Neither | I83: Yes | J83: Neither
A84: 161 | B84: 40096.569421145832 | C84: Miss | D84: Martina | E84: Zuhlke | F84: Sailboard | G84: 5.4650910782751785 | H84: Neither | I84: Yes | J84: Neither
A85: 161 | B85: 40096.656415914353 | C85: Miss | D85: Martina | E85: Zuhlke | F85: Sailboard | G85: 4.1546072255970232 | H85: Neither | I85: Yes | J85: Neither
A86: 161 | B86: 40096.647302314814 | C86: Miss | D86: Martina | E86: Zuhlke | F86: Sailboard | G86: 4.0320112700064321 | H86: Neither | I86: Yes | J86: Neither
A87: 175 | B87: 40096.540744178237 | C87: Mr | D87: Robin | E87: Penna | F87: Sailboard | G87: 17.969809562458806 | H87: Master | I87: No | J87: Gold Fleet
A88: 175 | B88: 40096.568407592589 | C88: Mr | D88: Robin | E88: Penna | F88: Sailboard | G88: 16.768174823824641 | H88: Master | I88: No | J88: Gold Fleet
A89: 175 | B89: 40096.531980914355 | C89: Mr | D89: Robin | E89: Penna | F89: Sailboard | G89: 16.375300464083477 | H89: Master | I89: No | J89: Gold Fleet
A90: 175 | B90: 40096.561013831022 | C90: Mr | D90: Robin | E90: Penna | F90: Sailboard | G90: 15.477012496934343 | H90: Master | I90: No | J90: Gold Fleet
A91: 203 | B91: 40096.603432743053 | C91: Mr | D91: Dave | E91: Standing | F91: Sailboard | G91: 0.15921365525611617 | H91: Master | I91: No | J91: Gold Fleet
A92: 206 | B92: 40096.614124814812 | C92: Mr | D92: martin | E92: allman | F92: Sailboard | G92: 16.558122979458847 | H92: Master | I92: No | J92: Neither
A93: 206 | B93: 40096.605468912036 | C93: Mr | D93: martin | E93: allman | F93: Sailboard | G93: 16.074598757090786 | H93: Master | I93: No | J93: Neither
A94: 206 | B94: 40096.61004136574 | C94: Mr | D94: martin | E94: allman | F94: Sailboard | G94: 16.05483040804814 | H94: Master | I94: No | J94: Neither
A95: 206 | B95: 40096.635086504626 | C95: Mr | D95: martin | E95: allman | F95: Sailboard | G95: 15.824188696110729 | H95: Master | I95: No | J95: Neither
A96: 206 | B96: 40096.630136064814 | C96: Mr | D96: martin | E96: allman | F96: Sailboard | G96: 15.441304328752601 | H96: Master | I96: No | J96: Neither
A97: 206 | B97: 40096.626197685182 | C97: Mr | D97: martin | E97: allman | F97: Sailboard | G97: 14.523436446654602 | H97: Master | I97: No | J97: Neither
A98: 206 | B98: 40096.644087534725 | C98: Mr | D98: martin | E98: allman | F98: Sailboard | G98: 13.641541913028183 | H98: Master | I98: No | J98: Neither
A99: 206 | B99: 40096.572132291665 | C99: Mr | D99: martin | E99: allman | F99: Sailboard | G99: 6.054030211063596 | H99: Master | I99: No | J99: Neither
A100: 206 | B100: 40096.600493738428 | C100: Mr | D100: martin | E100: allman | F100: Sailboard | G100: 0.58091383931318741 | H100: Master | I100: No | J100: Neither
A101: 210 | B101: 40096.577055706017 | C101: Mr | D101: Gavin | E101: Nicholson | F101: Sailboard | G101: 19.94927856333824 | H101: Neither | I101: Yes | J101: Neither
A102: 210 | B102: 40096.607278055555 | C102: Mr | D102: Gavin | E102: Nicholson | F102: Sailboard | G102: 19.788008867552868 | H102: Neither | I102: Yes | J102: Neither
A103: 210 | B103: 40096.628829224537 | C103: Mr | D103: Gavin | E103: Nicholson | F103: Sailboard | G103: 19.22219529216154 | H103: Neither | I103: Yes | J103: Neither
A104: 210 | B104: 40096.603526342595 | C104: Mr | D104: Gavin | E104: Nicholson | F104: Sailboard | G104: 18.626940192950208 | H104: Neither | I104: Yes | J104: Neither
A105: 210 | B105: 40096.588597534719 | C105: Mr | D105: Gavin | E105: Nicholson | F105: Sailboard | G105: 18.240726630842715 | H105: Neither | I105: Yes | J105: Neither
A106: 210 | B106: 40096.615766377312 | C106: Mr | D106: Gavin | E106: Nicholson | F106: Sailboard | G106: 18.210570428649046 | H106: Neither | I106: Yes | J106: Neither
A107: 210 | B107: 40096.633367233793 | C107: Mr | D107: Gavin | E107: Nicholson | F107: Sailboard | G107: 17.355184757973287 | H107: Neither | I107: Yes | J107: Neither
A108: 210 | B108: 40096.625287546296 | C108: Mr | D108: Gavin | E108: Nicholson | F108: Sailboard | G108: 17.205522439703323 | H108: Neither | I108: Yes | J108: Neither
A109: 210 | B109: 40096.63761972222 | C109: Mr | D109: Gavin | E109: Nicholson | F109: Sailboard | G109: 16.90704939472089 | H109: Neither | I109: Yes | J109: Neither
A110: 210 | B110: 40096.58325113426 | C110: Mr | D110: Gavin | E110: Nicholson | F110: Sailboard | G110: 16.437409142934928 | H110: Neither | I110: Yes | J110: Neither
A111: 210 | B111: 40096.544243923614 | C111: Mr | D111: Gavin | E111: Nicholson | F111: Sailboard | G111: 4.8932976274532756 | H111: Neither | I111: Yes | J111: Neither
A112: 248 | B112: 40096.551503993054 | C112: Mr | D112: MArcus | E112: Partridge | F112: Sailboard | G112: 4.7082798534159576 | H112: Neither | I112: No | J112: Neither
A113: 248 | B113: 40096.64694820602 | C113: Mr | D113: MArcus | E113: Partridge | F113: Sailboard | G113: 4.6879911117465038 | H113: Neither | I113: No | J113: Neither
A114: 292 | B114: 40096.611891446759 | C114: Mr | D114: Nic | E114: Dodd | F114: Sailboard | G114: 19.46707299114588 | H114: Neither | I114: No | J114: Neither
A115: 292 | B115: 40096.628379108799 | C115: Mr | D115: Nic | E115: Dodd | F115: Sailboard | G115: 19.053178418692543 | H115: Neither | I115: No | J115: Neither
A116: 292 | B116: 40096.609093541665 | C116: Mr | D116: Nic | E116: Dodd | F116: Sailboard | G116: 18.632848271667207 | H116: Neither | I116: No | J116: Neither
A117: 292 | B117: 40096.615366932871 | C117: Mr | D117: Nic | E117: Dodd | F117: Sailboard | G117: 18.302923375752801 | H117: Neither | I117: No | J117: Neither
A118: 292 | B118: 40096.603399224536 | C118: Mr | D118: Nic | E118: Dodd | F118: Sailboard | G118: 18.25426643727662 | H118: Neither | I118: No | J118: Neither
A119: 292 | B119: 40096.625253194441 | C119: Mr | D119: Nic | E119: Dodd | F119: Sailboard | G119: 17.147489854150837 | H119: Neither | I119: No | J119: Neither
A120: 292 | B120: 40096.556993576392 | C120: Mr | D120: Nic | E120: Dodd | F120: Sailboard | G120: 14.483056411324995 | H120: Neither | I120: No | J120: Neither
A121: 292 | B121: 40096.639325208336 | C121: Mr | D121: Nic | E121: Dodd | F121: Sailboard | G121: 1.9845794444450082 | H121: Neither | I121: No | J121: Neither
A122: 328 | B122: 40096.525680219907 | C122: Mr | D122: Adrian | E122: Wallis | F122: Sailboard | G122: 20.667879715982799 | H122: Master | I122: No | J122: Gold Fleet
A123: 328 | B123: 40096.611522893516 | C123: Mr | D123: Adrian | E123: Wallis | F123: Sailboard | G123: 20.167669328710996 | H123: Master | I123: No | J123: Gold Fleet
A124: 328 | B124: 40096.63025076389 | C124: Mr | D124: Adrian | E124: Wallis | F124: Sailboard | G124: 19.783196125649805 | H124: Master | I124: No | J124: Gold Fleet
A125: 328 | B125: 40096.604202997682 | C125: Mr | D125: Adrian | E125: Wallis | F125: Sailboard | G125: 19.4921917941322 | H125: Master | I125: No | J125: Gold Fleet
A126: 328 | B126: 40096.615015046293 | C126: Mr | D126: Adrian | E126: Wallis | F126: Sailboard | G126: 18.981016515230504 | H126: Master | I126: No | J126: Gold Fleet
A127: 328 | B127: 40096.601243252313 | C127: Mr | D127: Adrian | E127: Wallis | F127: Sailboard | G127: 18.917179392168929 | H127: Master | I127: No | J127: Gold Fleet
A128: 328 | B128: 40096.607970474535 | C128: Mr | D128: Adrian | E128: Wallis | F128: Sailboard | G128: 18.087223073265985 | H128: Master | I128: No | J128: Gold Fleet
A129: 328 | B129: 40096.635306469907 | C129: Mr | D129: Adrian | E129: Wallis | F129: Sailboard | G129: 17.262539779451526 | H129: Master | I129: No | J129: Gold Fleet
A130: 328 | B130: 40096.641517557873 | C130: Mr | D130: Adrian | E130: Wallis | F130: Sailboard | G130: 16.216838688748805 | H130: Master | I130: No | J130: Gold Fleet
A131: 328 | B131: 40096.551578622682 | C131: Mr | D131: Adrian | E131: Wallis | F131: Sailboard | G131: 4.3608401466639748 | H131: Master | I131: No | J131: Gold Fleet
A132: 328 | B132: 40096.652920439818 | C132: Mr | D132: Adrian | E132: Wallis | F132: Sailboard | G132: 4.0144085110199299 | H132: Master | I132: No | J132: Gold Fleet
A133: 329 | B133: 40096.574465173609 | C133: Mr | D133: Mark | E133: Collins | F133: Sailboard | G133: 16.966457160503637 | H133: Master | I133: No | J133: Neither
A134: 329 | B134: 40096.568851319447 | C134: Mr | D134: Mark | E134: Collins | F134: Sailboard | G134: 16.883833897029369 | H134: Master | I134: No | J134: Neither
A135: 329 | B135: 40096.560326064813 | C135: Mr | D135: Mark | E135: Collins | F135: Sailboard | G135: 16.691417952890632 | H135: Master | I135: No | J135: Neither
A136: 329 | B136: 40096.582155659722 | C136: Mr | D136: Mark | E136: Collins | F136: Sailboard | G136: 12.914332821281963 | H136: Master | I136: No | J136: Neither
A137: 330 | B137: 40096.571396111111 | C137: Mr | D137: ALISTAIR | E137: WILLIAMS | F137: Sailboard | G137: 5.9153156639832165 | H137: Master | I137: No | J137: Neither
A138: 330 | B138: 40096.559540532406 | C138: Mr | D138: ALISTAIR | E138: WILLIAMS | F138: Sailboard | G138: 5.4670971809487279 | H138: Master | I138: No | J138: Neither
A139: 343 | B139: 40096.626615486108 | C139: Mr | D139: andrew | E139: robinson | F139: Sailboard | G139: 15.159724328699394 | H139: Junior | I139: No | J139: Neither
A140: 343 | B140: 40096.63750409722 | C140: Mr | D140: andrew | E140: robinson | F140: Sailboard | G140: 14.38181079682078 | H140: Junior | I140: No | J140: Neither
A141: 343 | B141: 40096.569586296297 | C141: Mr | D141: andrew | E141: robinson | F141: Sailboard | G141: 13.271893736619244 | H141: Junior | I141: No | J141: Neither
A142: 343 | B142: 40096.578759791664 | C142: Mr | D142: andrew | E142: robinson | F142: Sailboard | G142: 10.858574394427828 | H142: Junior | I142: No | J142: Neither
A143: 343 | B143: 40096.547397048613 | C143: Mr | D143: andrew | E143: robinson | F143: Sailboard | G143: 6.0713053903284875 | H143: Junior | I143: No | J143: Neither
A144: 343 | B144: 40096.651091921296 | C144: Mr | D144: andrew | E144: robinson | F144: Sailboard | G144: 4.3685868867604389 | H144: Junior | I144: No | J144: Neither
A145: 349 | B145: 40096.630900208336 | C145: Mr | D145: Bruno | E145: Warner | F145: Sailboard | G145: 6.7561440775057804 | H145: Master | I145: No | J145: Neither
A146: 349 | B146: 40096.642714502312 | C146: Mr | D146: Bruno | E146: Warner | F146: Sailboard | G146: 5.2673989257409444 | H146: Master | I146: No | J146: Neither
A147: 353 | B147: 40096.579807407405 | C147: Mr | D147: paul | E147: robinson | F147: Sailboard | G147: 5.0332299121353081 | H147: Master | I147: No | J147: Neither
A148: 353 | B148: 40096.557278298613 | C148: Mr | D148: paul | E148: robinson | F148: Sailboard | G148: 4.6157365766604768 | H148: Master | I148: No | J148: Neither
A149: 353 | B149: 40096.645510555558 | C149: Mr | D149: paul | E149: robinson | F149: Sailboard | G149: 4.5144507612184279 | H149: Master | I149: No | J149: Neither
A150: 358 | B150: 40096.541742453701 | C150: Mr | D150: Gerard | E150: Northwood | F150: Sailboard | G150: 19.008312049432927 | H150: Master | I150: No | J150: Gold Fleet
A151: 358 | B151: 40096.627851319441 | C151: Mr | D151: Gerard | E151: Northwood | F151: Sailboard | G151: 18.889807271471707 | H151: Master | I151: No | J151: Gold Fleet
A152: 358 | B152: 40096.630514618053 | C152: Mr | D152: Gerard | E152: Northwood | F152: Sailboard | G152: 18.64467526644075 | H152: Master | I152: No | J152: Gold Fleet
A153: 358 | B153: 40096.532277152779 | C153: Mr | D153: Gerard | E153: Northwood | F153: Sailboard | G153: 18.361081498223971 | H153: Master | I153: No | J153: Gold Fleet
A154: 358 | B154: 40096.557089722221 | C154: Mr | D154: Gerard | E154: Northwood | F154: Sailboard | G154: 17.9927414235806 | H154: Master | I154: No | J154: Gold Fleet
A155: 358 | B155: 40096.528052719907 | C155: Mr | D155: Gerard | E155: Northwood | F155: Sailboard | G155: 17.770500471493641 | H155: Master | I155: No | J155: Gold Fleet
A156: 358 | B156: 40096.624746886577 | C156: Mr | D156: Gerard | E156: Northwood | F156: Sailboard | G156: 17.703857415613573 | H156: Master | I156: No | J156: Gold Fleet
A157: 358 | B157: 40096.633262060182 | C157: Mr | D157: Gerard | E157: Northwood | F157: Sailboard | G157: 17.449117313473714 | H157: Master | I157: No | J157: Gold Fleet
A158: 358 | B158: 40096.552966365743 | C158: Mr | D158: Gerard | E158: Northwood | F158: Sailboard | G158: 17.295856973434841 | H158: Master | I158: No | J158: Gold Fleet
A159: 358 | B159: 40096.636042835649 | C159: Mr | D159: Gerard | E159: Northwood | F159: Sailboard | G159: 16.454802056036566 | H159: Master | I159: No | J159: Gold Fleet
A160: 358 | B160: 40096.6396518287 | C160: Mr | D160: Gerard | E160: Northwood | F160: Sailboard | G160: 16.222560951116844 | H160: Master | I160: No | J160: Gold Fleet
A161: 358 | B161: 40096.620869618055 | C161: Mr | D161: Gerard | E161: Northwood | F161: Sailboard | G161: 15.980103803900827 | H161: Master | I161: No | J161: Gold Fleet
A162: 358 | B162: 40096.653549351853 | C162: Mr | D162: Gerard | E162: Northwood | F162: Sailboard | G162: 3.9037777164161831 | H162: Master | I162: No | J162: Gold Fleet
A163: 420 | B163: 40096.55967328704 | C163: Mr | D163: Chris | E163: Etchells | F163: Sailboard | G163: 5.6389588798491834 | H163: Neither | I163: Yes | J163: Neither
A164: 425 | B164: 40096.634876678239 | C164: Mr | D164: Sam | E164: Jenkins | F164: Sailboard | G164: 16.461718366542712 | H164: Junior | I164: No | J164: Gold Fleet
A165: 425 | B165: 40096.56967730324 | C165: Mr | D165: Sam | E165: Jenkins | F165: Sailboard | G165: 15.92571282238991 | H165: Junior | I165: No | J165: Gold Fleet
A166: 425 | B166: 40096.616755891206 | C166: Mr | D166: Sam | E166: Jenkins | F166: Sailboard | G166: 15.602841797965866 | H166: Junior | I166: No | J166: Gold Fleet
A167: 425 | B167: 40096.585684097219 | C167: Mr | D167: Sam | E167: Jenkins | F167: Sailboard | G167: 7.4649249340924824 | H167: Junior | I167: No | J167: Gold Fleet
A168: 555 | B168: 40096.546113634256 | C168: Mr | D168: claude | E168: Van-martyn | F168: Sailboard | G168: 3.8278368220455454 | H168: Master | I168: No | J168: Neither
A169: 571 | B169: 40096.650726423613 | C169: Mr | D169: Ryan | E169: Dunkling | F169: Sailboard | G169: 3.8198722043239224 | H169: Junior | I169: Yes | J169: Neither
A170: 625 | B170: 40096.52118841435 | C170: Mr | D170: Jason | E170: McCaffrey | F170: Kite Board | G170: 24.483142474882481 | H170: Neither | I170: No | J170: Gold Fleet
A171: 625 | B171: 40096.526290590278 | C171: Mr | D171: Jason | E171: McCaffrey | F171: Kite Board | G171: 23.753878494820491 | H171: Neither | I171: No | J171: Gold Fleet
A172: 625 | B172: 40096.53001278935 | C172: Mr | D172: Jason | E172: McCaffrey | F172: Kite Board | G172: 22.543573766517241 | H172: Neither | I172: No | J172: Gold Fleet
A173: 625 | B173: 40096.606839814813 | C173: Mr | D173: Jason | E173: McCaffrey | F173: Kite Board | G173: 21.894310484350719 | H173: Neither | I173: No | J173: Gold Fleet
A174: 625 | B174: 40096.570835092592 | C174: Mr | D174: Jason | E174: McCaffrey | F174: Kite Board | G174: 21.629638621138227 | H174: Neither | I174: No | J174: Gold Fleet
A175: 625 | B175: 40096.5609778125 | C175: Mr | D175: Jason | E175: McCaffrey | F175: Kite Board | G175: 21.270268541149484 | H175: Neither | I175: No | J175: Gold Fleet
A176: 625 | B176: 40096.567563923614 | C176: Mr | D176: Jason | E176: McCaffrey | F176: Kite Board | G176: 21.000762591710942 | H176: Neither | I176: No | J176: Gold Fleet
A177: 625 | B177: 40096.602252175922 | C177: Mr | D177: Jason | E177: McCaffrey | F177: Kite Board | G177: 20.969944888569863 | H177: Neither | I177: No | J177: Gold Fleet
A178: 625 | B178: 40096.509065752318 | C178: Mr | D178: Jason | E178: McCaffrey | F178: Kite Board | G178: 19.956431611328576 | H178: Neither | I178: No | J178: Gold Fleet
A179: 625 | B179: 40096.6324134838 | C179: Mr | D179: Jason | E179: McCaffrey | F179: Kite Board | G179: 19.730411451152897 | H179: Neither | I179: No | J179: Gold Fleet
A180: 625 | B180: 40096.636095706017 | C180: Mr | D180: Jason | E180: McCaffrey | F180: Kite Board | G180: 19.40313418691969 | H180: Neither | I180: No | J180: Gold Fleet
A181: 625 | B181: 40096.611136284722 | C181: Mr | D181: Jason | E181: McCaffrey | F181: Kite Board | G181: 18.926320927108485 | H181: Neither | I181: No | J181: Gold Fleet
A182: 625 | B182: 40096.643186365742 | C182: Mr | D182: Jason | E182: McCaffrey | F182: Kite Board | G182: 18.586016475529 | H182: Neither | I182: No | J182: Gold Fleet
A183: 625 | B183: 40096.647612824076 | C183: Mr | D183: Jason | E183: McCaffrey | F183: Kite Board | G183: 14.287566961061284 | H183: Neither | I183: No | J183: Gold Fleet
A184: 626 | B184: 40096.540250925929 | C184: Mr | D184: martin | E184: hayes | F184: Kite Board | G184: 15.435218728468115 | H184: Neither | I184: No | J184: Neither
A185: 626 | B185: 40096.606758993054 | C185: Mr | D185: martin | E185: hayes | F185: Kite Board | G185: 11.219524497407944 | H185: Neither | I185: No | J185: Neither
A186: 670 | B186: 40096.564711956016 | C186: Mr | D186: Eddie | E186: Murrell | F186: Sailboard | G186: 5.0131148442000528 | H186: Master | I186: No | J186: Gold Fleet
A187: 681 | B187: 40096.628238055557 | C187: Mr | D187: Alan | E187: Cross | F187: Sailboard | G187: 19.655230600173834 | H187: Master | I187: No | J187: Gold Fleet
A188: 681 | B188: 40096.540358136575 | C188: Mr | D188: Alan | E188: Cross | F188: Sailboard | G188: 19.232333736607675 | H188: Master | I188: No | J188: Gold Fleet
A189: 681 | B189: 40096.555593182871 | C189: Mr | D189: Alan | E189: Cross | F189: Sailboard | G189: 18.678596821170633 | H189: Master | I189: No | J189: Gold Fleet
A190: 681 | B190: 40096.631000925925 | C190: Mr | D190: Alan | E190: Cross | F190: Sailboard | G190: 18.173327380704102 | H190: Master | I190: No | J190: Gold Fleet
A191: 681 | B191: 40096.527649814816 | C191: Mr | D191: Alan | E191: Cross | F191: Sailboard | G191: 18.094031656065248 | H191: Master | I191: No | J191: Gold Fleet
A192: 681 | B192: 40096.634335879629 | C192: Mr | D192: Alan | E192: Cross | F192: Sailboard | G192: 17.99059864814107 | H192: Master | I192: No | J192: Gold Fleet
A193: 681 | B193: 40096.533085648145 | C193: Mr | D193: Alan | E193: Cross | F193: Sailboard | G193: 17.96889334254956 | H193: Master | I193: No | J193: Gold Fleet
A194: 681 | B194: 40096.624999074076 | C194: Mr | D194: Alan | E194: Cross | F194: Sailboard | G194: 17.592230865545815 | H194: Master | I194: No | J194: Gold Fleet
A195: 714 | B195: 40096.615604953702 | C195: Miss | D195: Emily | E195: Hall | F195: Sailboard | G195: 10.804321968695815 | H195: Junior | I195: Yes | J195: Gold Fleet
A196: 714 | B196: 40096.556410648147 | C196: Miss | D196: Emily | E196: Hall | F196: Sailboard | G196: 6.1336732660556663 | H196: Junior | I196: Yes | J196: Gold Fleet
A197: 714 | B197: 40096.565190960646 | C197: Miss | D197: Emily | E197: Hall | F197: Sailboard | G197: 5.4198259656367576 | H197: Junior | I197: Yes | J197: Gold Fleet
A198: 852 | B198: 40096.576407650464 | C198: Mr | D198: Henry | E198: Bloodworth | F198: Sailboard | G198: 7.2391982325977819 | H198: Junior | I198: No | J198: Neither
A199: 852 | B199: 40096.545708599537 | C199: Mr | D199: Henry | E199: Bloodworth | F199: Sailboard | G199: 5.7660087243781799 | H199: Junior | I199: No | J199: Neither
A200: 863 | B200: 40096.605169513889 | C200: Mr | D200: Duncan | E200: Adam | F200: Sailboard | G200: 19.13662112842108 | H200: Master | I200: No | J200: Neither
A201: 863 | B201: 40096.526129131948 | C201: Mr | D201: Duncan | E201: Adam | F201: Sailboard | G201: 18.48335807101186 | H201: Master | I201: No | J201: Neither
A202: 863 | B202: 40096.601063564813 | C202: Mr | D202: Duncan | E202: Adam | F202: Sailboard | G202: 18.477867531520914 | H202: Master | I202: No | J202: Neither
A203: 863 | B203: 40096.613111539351 | C203: Mr | D203: Duncan | E203: Adam | F203: Sailboard | G203: 18.428277256180699 | H203: Master | I203: No | J203: Neither
A204: 863 | B204: 40096.609691041667 | C204: Mr | D204: Duncan | E204: Adam | F204: Sailboard | G204: 17.680768485469404 | H204: Master | I204: No | J204: Neither
A205: 863 | B205: 40096.573969791665 | C205: Mr | D205: Duncan | E205: Adam | F205: Sailboard | G205: 17.401737947702959 | H205: Master | I205: No | J205: Neither
A206: 863 | B206: 40096.562193182872 | C206: Mr | D206: Duncan | E206: Adam | F206: Sailboard | G206: 16.644652191734348 | H206: Master | I206: No | J206: Neither
A207: 863 | B207: 40096.569056562497 | C207: Mr | D207: Duncan | E207: Adam | F207: Sailboard | G207: 16.104465379135867 | H207: Master | I207: No | J207: Neither
A208: 888 | B208: 40096.524971805557 | C208: Mr | D208: Michael | E208: George | F208: Sailboard | G208: 17.868995254198783 | H208: Neither | I208: No | J208: Neither
A209: 1966 | B209: 40096.56827427083 | C209: Mr | D209: Martin | E209: Schramm | F209: Sailboard | G209: 3.9785670710482255 | H209: Neither | I209: Yes | J209: Neither
A210: 3021 | B210: 40096.519608287039 | C210: Miss | D210: Katherine | E210: Knight | F210: Boat | G210: 18.351840398645493 | H210: Neither | I210: Yes | J210: Neither
A211: 3021 | B211: 40096.525364062501 | C211: Miss | D211: Katherine | E211: Knight | F211: Boat | G211: 18.273824432432814 | H211: Neither | I211: Yes | J211: Neither
A212: 3021 | B212: 40096.531419976855 | C212: Miss | D212: Katherine | E212: Knight | F212: Boat | G212: 17.55368264195117 | H212: Neither | I212: Yes | J212: Neither
A213: 3021 | B213: 40096.630695694446 | C213: Miss | D213: Katherine | E213: Knight | F213: Boat | G213: 16.697479932167301 | H213: Neither | I213: Yes | J213: Neither
A214: 3021 | B214: 40096.542911435186 | C214: Miss | D214: Katherine | E214: Knight | F214: Boat | G214: 16.583570981184746 | H214: Neither | I214: Yes | J214: Neither
A215: 3021 | B215: 40096.573512824078 | C215: Miss | D215: Katherine | E215: Knight | F215: Boat | G215: 16.530685173701478 | H215: Neither | I215: Yes | J215: Neither
A216: 3021 | B216: 40096.610862384259 | C216: Miss | D216: Katherine | E216: Knight | F216: Boat | G216: 16.524743839180282 | H216: Neither | I216: Yes | J216: Neither
A217: 3021 | B217: 40096.627389351852 | C217: Miss | D217: Katherine | E217: Knight | F217: Boat | G217: 16.521903784369744 | H217: Neither | I217: Yes | J217: Neither
A218: 3021 | B218: 40096.603504155093 | C218: Miss | D218: Katherine | E218: Knight | F218: Boat | G218: 16.519580755432084 | H218: Neither | I218: Yes | J218: Neither
A219: 3021 | B219: 40096.615676516201 | C219: Miss | D219: Katherine | E219: Knight | F219: Boat | G219: 16.484043788378106 | H219: Neither | I219: Yes | J219: Neither
A220: 3021 | B220: 40096.568099768519 | C220: Miss | D220: Katherine | E220: Knight | F220: Boat | G220: 16.410115063889265 | H220: Neither | I220: Yes | J220: Neither
A221: 3021 | B221: 40096.537411087964 | C221: Miss | D221: Katherine | E221: Knight | F221: Boat | G221: 16.250982052985037 | H221: Neither | I221: Yes | J221: Neither
A222: 3021 | B222: 40096.578798784722 | C222: Miss | D222: Katherine | E222: Knight | F222: Boat | G222: 16.116246624013897 | H222: Neither | I222: Yes | J222: Neither
A223: 3021 | B223: 40096.607104305556 | C223: Miss | D223: Katherine | E223: Knight | F223: Boat | G223: 16.098336168603584 | H223: Neither | I223: Yes | J223: Neither
A224: 3021 | B224: 40096.562266689813 | C224: Miss | D224: Katherine | E224: Knight | F224: Boat | G224: 16.035597029092944 | H224: Neither | I224: Yes | J224: Neither
A225: 3021 | B225: 40096.556373622683 | C225: Miss | D225: Katherine | E225: Knight | F225: Boat | G225: 16.019563874879552 | H225: Neither | I225: Yes | J225: Neither
A226: 3021 | B226: 40096.584778680553 | C226: Miss | D226: Katherine | E226: Knight | F226: Boat | G226: 15.162984871682179 | H226: Neither | I226: Yes | J226: Neither
A227: 3021 | B227: 40096.636569513888 | C227: Miss | D227: Katherine | E227: Knight | F227: Boat | G227: 14.957937723149248 | H227: Neither | I227: Yes | J227: Neither
A228: 3021 | B228: 40096.550713379627 | C228: Miss | D228: Katherine | E228: Knight | F228: Boat | G228: 14.114219094288405 | H228: Neither | I228: Yes | J228: Neither