A1: Home | Event News | Gallery | Weather | Results <!-- HIDE FROM OLD BROWSERS function addDate() { monthNames = new Array("January", "February", "March", "April", "May", "June", "July", "August", "September", "October", "November", "December"); myDate = new Date(); var year = myDate.getYear(); if (year < 1000) year += 1900; document.write("<FONT SIZE='3' FACE='Arial, Sans-serif' COLOR='CC0000'><B>" + myDate.getDate() + ", " + " " + monthNames[myDate.getMonth()] + " " + year + "</B></FONT>"); } addDate() // END HIDING --> 14, October 2009 Results Sunday Pro Fleet GPS Fastest Times Combined Weymouth Speed Week and GPS Pro Fleet Fastest Speeds All runs recorded excluding GPS Pro Fleet, sorted by Sail Number, Speed Descending Amended 14/10/09

A1: 1 | B1: Patrick Van Hoof | E1: 30.13
A2: 2 | B2: Dan Ellis | E2: 30.09
A3: 3 | B3: Anders Bringdal | E3: 29.66
A4: 4 | B4: Martin Ogier | E4: 28.84
A5: 5 | B5: Ant Baker | E5: 28.27
A6: 6 | B6: David White | E6: 27.83
A7: 7 | B7: Zara Davis | E7: 27.30
A8: 8 | B8: Fred_Willis | E8: 27.28
A9: 9 | B9: Paul Simmons | E9: 26.95
A10: 10 | B10: Pete Davis | E10: 26.65
A11: 11 | B11: Thorsten Niehaus | E11: 25.87

A2: Position | B2: Sail Number | C2: Time | D2: FirstName | E2: LastName | F2: CraftType | H2: Knots | I2: Title | J2: AgeStatus | K2: Novice | L2: Professional
A3: 1 | B3: 625 | C3: 40097.583567372683 | D3: Jason | E3: McCaffrey | F3: Kite Board | G3: Result | H3: 31.562887157222601 | I3: Mr | J3: Neither | K3: No | L3: Gold Fleet
A4: =A2+1 -> 2 | B4: 622 | C4: 40097.54950552083 | D4: Richard | E4: Fabbri | F4: Kite Board | G4: Result | H4: 30.398764014563866 | I4: Mr | J4: Neither | K4: Yes | L4: Neither
A5: =A3+1 -> 3 | B5: 52 | C5: GPS | D5: Patrick | E5: Van Hoof | F5: Sailboard | G5: Result | H5: 30.13 | I5: Mr | J5: Master | K5: Yes | L5: Gold Fleet
A6: =A4+1 -> 4 | B6: 521 | C6: GPS | D6: dan | E6: ellis | F6: Sailboard | G6: Result | H6: 30.09 | I6: Mr | J6: Neither | K6: No | L6: Professional
A7: =A6+1 -> 5 | B7: 10 | C7: GPS | D7: Anders | E7: Bringdal | F7: Sailboard | G7: Result | H7: 29.66 | I7: Mr | J7: Neither | K7: No | L7: Professional
A8: =A7+1 -> 6 | B8: 115 | C8: 40097.456523796296 | D8: stephen | E8: corps | F8: Sailboard | G8: Result | H8: 29.544350831960099 | I8: Mr | J8: Neither | K8: No | L8: Gold Fleet
A9: =A8+1 -> 7 | B9: 175 | C9: 40097.446929814818 | D9: Robin | E9: Penna | F9: Sailboard | G9: Result | H9: 29.467783212304585 | I9: Mr | J9: Master | K9: No | L9: Gold Fleet
A10: =A9+1 -> 8 | B10: 609 | C10: 40097.499336076391 | D10: philip | E10: ladbrook | F10: Kite Board | G10: Result | H10: 29.066833276682857 | I10: Mr | J10: Master | K10: Yes | L10: Gold Fleet
A11: =A10+1 -> 9 | B11: 68 | C11: GPS | D11: MARTYN | E11: OGIER | F11: Sailboard | G11: Result | H11: 28.84 | I11: Mr | J11: Neither | K11: No | L11: Professional
A12: =A11+1 -> 10 | B12: 873 | C12: 40097.457648715281 | D12: Lance | E12: Newbery | F12: Sailboard | G12: Result | H12: 28.548903695439922 | I12: Mr | J12: Neither | K12: No | L12: Gold Fleet
A13: =A12+1 -> 11 | B13: 181 | C13: 40097.553996134258 | D13: Peter | E13: Martin | F13: Sailboard | G13: Result | H13: 28.486608958517195 | I13: Mr | J13: Neither | K13: No | L13: Neither
A14: =A13+1 -> 12 | B14: 157 | C14: 40097.463157488426 | D14: nigel | E14: spriggs | F14: Sailboard | G14: Result | H14: 28.348383706116696 | I14: Mr | J14: Neither | K14: No | L14: Gold Fleet
A15: =A14+1 -> 13 | B15: 14 | C15: 40097.477093761576 | D15: Ian | E15: Hill | F15: Sailboard | G15: Result | H15: 28.314983994566813 | I15: Mr | J15: Neither | K15: No | L15: Gold Fleet
A16: =A15+1 -> 14 | B16: 77 | C16: GPS | D16: Anthony | E16: Baker | F16: Sailboard | G16: Result | H16: 28.27 | I16: Mr | J16: Neither | K16: No | L16: Professional
A17: =A16+1 -> 15 | B17: 129 | C17: 40097.455160763886 | D17: Tim | E17: Fricke | F17: Sailboard | G17: Result | H17: 28.069956981552238 | I17: Mr | J17: Neither | K17: No | L17: Neither
A18: =A17+1 -> 16 | B18: 328 | C18: 40097.556147569441 | D18: Adrian | E18: Wallis | F18: Sailboard | G18: Result | H18: 28.048364872568939 | I18: Mr | J18: Master | K18: No | L18: Gold Fleet
A19: =A18+1 -> 17 | B19: 888 | C19: 40097.551231458332 | D19: Michael | E19: George | F19: Sailboard | G19: Result | H19: 27.991937175324409 | I19: Mr | J19: Neither | K19: No | L19: Neither
A20: =A19+1 -> 18 | B20: 69 | C20: 40097.548399583335 | D20: Gareth | E20: Baker | F20: Sailboard | G20: Result | H20: 27.963808149633643 | I20: Mr | J20: Neither | K20: No | L20: Gold Fleet
A21: =A20+1 -> 19 | B21: 63 | C21: GPS | D21: Dave | E21: White | F21: Sailboard | G21: Result | H21: 27.83 | I21: Mr | J21: Neither | K21: No | L21: Professional
A22: =A21+1 -> 20 | B22: 203 | C22: 40097.447481400464 | D22: Dave | E22: Standing | F22: Sailboard | G22: Result | H22: 27.6913977539607 | I22: Mr | J22: Master | K22: No | L22: Gold Fleet
A23: =A22+1 -> 21 | B23: 140 | C23: 40097.595178842595 | D23: Steve | E23: Jones | F23: Sailboard | G23: Result | H23: 27.6197929005865 | I23: Mr | J23: Neither | K23: No | L23: Gold Fleet
A24: =A23+1 -> 22 | B24: 151 | C24: 40097.583871944444 | D24: sam | E24: latham | F24: Sailboard | G24: Result | H24: 27.614023225202153 | I24: Mr | J24: Neither | K24: No | L24: Neither
A25: =A24+1 -> 23 | B25: 102 | C25: 40097.554297847222 | D25: Norman | E25: Petty | F25: Sailboard | G25: Result | H25: 27.411447464855549 | I25: Mr | J25: Master | K25: No | L25: Neither
A26: =A25+1 -> 24 | B26: 626 | C26: 40097.448415879633 | D26: martin | E26: hayes | F26: Kite Board | G26: Result | H26: 27.342695435851137 | I26: Mr | J26: Neither | K26: No | L26: Neither
A27: =A26+1 -> 25 | B27: 559 | C27: 40097.461242696758 | D27: TONY | E27: ATTFIELD | F27: Sailboard | G27: Result | H27: 27.305275747744659 | I27: Mr | J27: Neither | K27: No | L27: Neither
A28: =A27+1 -> 26 | B28: 47 | C28: GPS | D28: Zara | E28: Davis | F28: Sailboard | G28: Result | H28: 27.30 | I28: Mrs | J28: Neither | K28: No | L28: Gold Fleet
A29: =A28+1 -> 27 | B29: 951 | C29: GPS | D29: Fred | E29: Willis | F29: Sailboard | G29: Result | H29: 27.28 | I29: Mr | J29: Neither | K29: No | L29: Professional
A30: =A29+1 -> 28 | B30: 29 | C30: 40097.453710983798 | D30: Tony | E30: Robinson | F30: Sailboard | G30: Result | H30: 27.155916798497817 | I30: Mr | J30: Master | K30: No | L30: Neither
A31: =A30+1 -> 29 | B31: 99 | C31: 40097.45643204861 | D31: steve | E31: franklyn | F31: Sailboard | G31: Result | H31: 27.114138778778567 | I31: Mr | J31: Neither | K31: Yes | L31: Gold Fleet
A32: =A31+1 -> 30 | B32: 56 | C32: 40097.554774525466 | D32: Tim | E32: Lawes | F32: Sailboard | G32: Result | H32: 27.091909221096266 | I32: Mr | J32: Neither | K32: No | L32: Gold Fleet
A33: =A32+1 -> 31 | B33: 76 | C33: 40097.445840081018 | D33: Simon | E33: Perkins | F33: Sailboard | G33: Result | H33: 27.067637885232703 | I33: Mr | J33: Neither | K33: No | L33: Neither
A34: =A33+1 -> 32 | B34: 983 | C34: 40097.451901365741 | D34: HAMISH | E34: GODDARD | F34: Sailboard | G34: Result | H34: 26.997150749545145 | I34: Mr | J34: Master | K34: Yes | L34: Neither
A35: =A34+1 -> 33 | B35: 131 | C35: GPS | D35: P J | E35: Simmons | F35: Sailboard | G35: Result | H35: 26.95 | I35: Mr | J35: Neither | K35: No | L35: Professional
A36: =A35+1 -> 34 | B36: 681 | C36: 40097.446680960646 | D36: Alan | E36: Cross | F36: Sailboard | G36: Result | H36: 26.924973424895661 | I36: Mr | J36: Master | K36: No | L36: Gold Fleet
A37: =A36+1 -> 35 | B37: 358 | C37: 40097.478261724536 | D37: Gerard | E37: Northwood | F37: Sailboard | G37: Result | H37: 26.779057056263156 | I37: Mr | J37: Master | K37: No | L37: Gold Fleet
A38: =A37+1 -> 36 | B38: 568 | C38: 40097.548118784725 | D38: alex | E38: burges | F38: Sailboard | G38: Result | H38: 26.681083924536299 | I38: Mr | J38: Neither | K38: Yes | L38: Neither
A39: =A38+1 -> 37 | B39: 73 | C39: GPS | D39: Pete | E39: Davis | F39: Sailboard | G39: Result | H39: 26.65 | I39: Mr | J39: Neither | K39: No | L39: Professional
A40: =A39+1 -> 38 | B40: 50 | C40: 40097.553079884259 | D40: BARRY | E40: PEARCE | F40: Sailboard | G40: Result | H40: 26.552451914073036 | I40: Mr | J40: Master | K40: No | L40: Neither
A41: =A40+1 -> 39 | B41: 79 | C41: 40097.453059143518 | D41: Rob | E41: King | F41: Sailboard | G41: Result | H41: 26.489263555893967 | I41: Mr | J41: Master | K41: Yes | L41: Neither
A42: =A41+1 -> 40 | B42: 93 | C42: 40097.48315078704 | D42: Richard | E42: Hobson | F42: Sailboard | G42: Result | H42: 26.474010393129632 | I42: Mr | J42: Neither | K42: No | L42: Neither
A43: =A42+1 -> 41 | B43: 44 | C43: 40097.59958159722 | D43: Dave | E43: Strudwick | F43: Sailboard | G43: Result | H43: 26.459437364344499 | I43: Mr | J43: Master | K43: No | L43: Gold Fleet
A44: =A43+1 -> 42 | B44: 2 | C44: 40097.593469467596 | D44: Will | E44: Oscroft | F44: Sailboard | G44: Result | H44: 26.244047291563572 | I44: Mr | J44: Neither | K44: No | L44: Neither
A45: =A44+1 -> 43 | B45: 55 | C45: 40097.497288333332 | D45: James | E45: Lawton | F45: Sailboard | G45: Result | H45: 26.229075553835436 | I45: Mr | J45: Neither | K45: Yes | L45: Neither
A46: =A45+1 -> 44 | B46: 133 | C46: 40097.443742256946 | D46: Mark | E46: Briggs | F46: Sailboard | G46: Result | H46: 26.068716227958788 | I46: Mr | J46: Neither | K46: Yes | L46: Neither
A47: =A46+1 -> 45 | B47: 292 | C47: 40097.547228611111 | D47: Nic | E47: Dodd | F47: Sailboard | G47: Result | H47: 25.934453457080959 | I47: Mr | J47: Neither | K47: No | L47: Neither
A48: =A47+1 -> 46 | B48: 15 | C48: GPS | D48: Thorsten | E48: Niehaus | F48: Sailboard | G48: Result | H48: 25.87 | I48: Mr | J48: Neither | K48: No | L48: Professional
A49: =A48+1 -> 47 | B49: 51 | C49: 40097.596187766205 | D49: Clive | E49: Ellis | F49: Sailboard | G49: Result | H49: 25.864043127484116 | I49: Mr | J49: Master | K49: No | L49: Neither
A50: =A49+1 -> 48 | B50: 496 | C50: 40097.489151712965 | D50: Tim | E50: Tarrington | F50: Sailboard | G50: Result | H50: 25.675643963308708 | I50: Mr | J50: Neither | K50: No | L50: Neither
A51: =A50+1 -> 49 | B51: 62 | C51: 40097.546154363423 | D51: Dave | E51: Crowhurst | F51: Sailboard | G51: Result | H51: 25.671281180529736 | I51: Mr | J51: Master | K51: Yes | L51: Neither
A52: =A51+1 -> 50 | B52: 43 | C52: 40097.487506585647 | D52: Simon | E52: Thompson | F52: Sailboard | G52: Result | H52: 25.583708177867415 | I52: Mr | J52: Neither | K52: No | L52: Gold Fleet
A53: =A52+1 -> 51 | B53: 3 | C53: 40097.599946076392 | D53: John | E53: McIntyre | F53: Sailboard | G53: Result | H53: 25.489969629662784 | I53: Mr | J53: Master | K53: No | L53: Neither
A54: =A53+1 -> 52 | B54: 113 | C54: 40097.454890335648 | D54: Rudiger | E54: Lotz | F54: Sailboard | G54: Result | H54: 25.401186657008804 | I54: Mr | J54: Master | K54: No | L54: Gold Fleet
A55: =A54+1 -> 53 | B55: 555 | C55: 40097.438852268519 | D55: claude | E55: Van-martyn | F55: Sailboard | G55: Result | H55: 25.36280428366651 | I55: Mr | J55: Master | K55: No | L55: Neither
A56: =A55+1 -> 54 | B56: 143 | C56: 40097.450629803243 | D56: Charles | E56: Wilson | F56: Sailboard | G56: Result | H56: 25.306356081706177 | I56: Mr | J56: Neither | K56: No | L56: Neither
A57: =A56+1 -> 55 | B57: 329 | C57: 40097.482491435185 | D57: Mark | E57: Collins | F57: Sailboard | G57: Result | H57: 25.303934189477808 | I57: Mr | J57: Master | K57: No | L57: Neither
A58: =A57+1 -> 56 | B58: 97 | C58: 40097.607362442126 | D58: Mike | E58: Price | F58: Sailboard | G58: Result | H58: 25.242926145223436 | I58: Mr | J58: Master | K58: No | L58: Neither
A59: =A58+1 -> 57 | B59: 210 | C59: 40097.610305150461 | D59: Gavin | E59: Nicholson | F59: Sailboard | G59: Result | H59: 25.242925766412181 | I59: Mr | J59: Neither | K59: Yes | L59: Neither
A60: =A59+1 -> 58 | B60: 42 | C60: 40097.597802800927 | D60: John | E60: Langdown | F60: Sailboard | G60: Result | H60: 25.208024205789073 | I60: Mr | J60: Neither | K60: No | L60: Neither
A61: =A60+1 -> 59 | B61: 670 | C61: 40097.448385046293 | D61: Eddie | E61: Murrell | F61: Sailboard | G61: Result | H61: 25.15345890167465 | I61: Mr | J61: Master | K61: No | L61: Gold Fleet
A62: =A61+1 -> 60 | B62: 39 | C62: 40097.604672766203 | D62: Simon | E62: Todd | F62: Sailboard | G62: Result | H62: 25.07472728961184 | I62: Mr | J62: Neither | K62: Yes | L62: Neither
A63: =A62+1 -> 61 | B63: 571 | C63: 40097.457160636572 | D63: Ryan | E63: Dunkling | F63: Sailboard | G63: Result | H63: 24.997078371457565 | I63: Mr | J63: Junior | K63: Yes | L63: Neither
A64: =A63+1 -> 62 | B64: 863 | C64: 40097.432374942131 | D64: Duncan | E64: Adam | F64: Sailboard | G64: Result | H64: 24.749020651203033 | I64: Mr | J64: Master | K64: No | L64: Neither
A65: =A64+1 -> 63 | B65: 656 | C65: 40097.454772766207 | D65: william | E65: robinson | F65: Sailboard | G65: Result | H65: 24.735126602591166 | I65: Mr | J65: Master | K65: No | L65: Neither
A66: =A65+1 -> 64 | B66: 12 | C66: 40097.455860196758 | D66: Jim | E66: Brooks-Dowsett | F66: Sailboard | G66: Result | H66: 24.674524109842508 | I66: Mr | J66: Neither | K66: No | L66: Gold Fleet
A67: =A66+1 -> 65 | B67: 760 | C67: 40097.58322630787 | D67: Antony | E67: Todd | F67: Sailboard | G67: Result | H67: 24.506405760838323 | I67: Mr | J67: Neither | K67: Yes | L67: Neither
A68: =A67+1 -> 66 | B68: 49 | C68: 40097.461521446756 | D68: Jeremy | E68: Gardner | F68: Sailboard | G68: Result | H68: 24.459357802889706 | I68: Mr | J68: Master | K68: Yes | L68: Neither
A69: =A68+1 -> 67 | B69: 420 | C69: 40097.545346435189 | D69: Chris | E69: Etchells | F69: Sailboard | G69: Result | H69: 24.428280393301318 | I69: Mr | J69: Neither | K69: Yes | L69: Neither
A70: =A69+1 -> 68 | B70: 1966 | C70: 40097.552360601854 | D70: Martin | E70: Schramm | F70: Sailboard | G70: Result | H70: 24.344485001835068 | I70: Mr | J70: Neither | K70: Yes | L70: Neither
A71: =A70+1 -> 69 | B71: 30 | C71: 40097.582785983795 | D71: alan | E71: bennett | F71: Sailboard | G71: Result | H71: 24.314817302161934 | I71: Mr | J71: Neither | K71: No | L71: Neither
A72: =A71+1 -> 70 | B72: 146 | C72: 40097.549393402776 | D72: Will | E72: Giles | F72: Sailboard | G72: Result | H72: 24.227910905506768 | I72: Mr | J72: Junior | K72: No | L72: Neither
A73: =A72+1 -> 71 | B73: 40 | C73: 40097.547422870368 | D73: Ian | E73: Hobbs | F73: Sailboard | G73: Result | H73: 24.089926229851766 | I73: Mr | J73: Master | K73: Yes | L73: Neither
A74: =A73+1 -> 72 | B74: 353 | C74: 40097.452532094911 | D74: paul | E74: robinson | F74: Sailboard | G74: Result | H74: 24.054854327270647 | I74: Mr | J74: Master | K74: No | L74: Neither
A75: =A74+1 -> 73 | B75: 624 | C75: 40097.621177569446 | D75: Jenny | E75: Cooper | F75: Kite Board | G75: Result | H75: 24.010067490804939 | I75: Mrs | J75: Master | K75: Yes | L75: Gold Fleet
A76: =A75+1 -> 74 | B76: 2811 | C76: 40097.556903842589 | D76: Henry | E76: Luce | F76: Sailboard | G76: Result | H76: 23.998080246274284 | I76: Mr | J76: Master | K76: No | L76: Neither
A77: =A76+1 -> 75 | B77: 88 | C77: 40097.564774768522 | D77: Richard | E77: Riddell | F77: Sailboard | G77: Result | H77: 23.852466401257338 | I77: Mr | J77: Neither | K77: No | L77: Neither
A78: =A77+1 -> 76 | B78: 444 | C78: 40097.481811273145 | D78: Richard | E78: Haynes | F78: Sailboard | G78: Result | H78: 23.842786175920562 | I78: Mr | J78: Master | K78: No | L78: Neither
A79: =A78+1 -> 77 | B79: 330 | C79: 40097.483101064812 | D79: ALISTAIR | E79: WILLIAMS | F79: Sailboard | G79: Result | H79: 23.710736114313193 | I79: Mr | J79: Master | K79: No | L79: Neither
A80: =A79+1 -> 78 | B80: 95 | C80: 40097.585560671294 | D80: Stephen | E80: Cronshaw | F80: Sailboard | G80: Result | H80: 23.587504311597876 | I80: Mr | J80: Neither | K80: Yes | L80: Neither
A81: =A80+1 -> 79 | B81: 24 | C81: 40097.483668483794 | D81: Trevor | E81: Funnell | F81: Sailboard | G81: Result | H81: 23.495787524278395 | I81: Mr | J81: Master | K81: No | L81: Neither
A82: =A81+1 -> 80 | B82: 773 | C82: 40097.620616354165 | D82: Adrian | E82: Nisbet | F82: Sailboard | G82: Result | H82: 23.274451095562895 | I82: Mr | J82: Neither | K82: Yes | L82: Neither
A83: =A82+1 -> 81 | B83: 248 | C83: 40097.583388969906 | D83: MArcus | E83: Partridge | F83: Sailboard | G83: Result | H83: 23.009583132994138 | I83: Mr | J83: Neither | K83: No | L83: Neither
A84: =A83+1 -> 82 | B84: 425 | C84: 40097.457848495367 | D84: Sam | E84: Jenkins | F84: Sailboard | G84: Result | H84: 23.00507778889197 | I84: Mr | J84: Junior | K84: No | L84: Gold Fleet
A85: =A84+1 -> 83 | B85: 8 | C85: 40097.58297275463 | D85: Raj | E85: Kanasam | F85: Sailboard | G85: Result | H85: 22.803169930816722 | I85: Mr | J85: Neither | K85: No | L85: Neither
A86: =A85+1 -> 84 | B86: 66 | C86: 40097.478370034725 | D86: Alex | E86: Bennett- Baggs | F86: Sailboard | G86: Result | H86: 22.80218633794167 | I86: Mr | J86: Neither | K86: No | L86: Neither
A87: =A86+1 -> 85 | B87: 206 | C87: 40097.585763055555 | D87: martin | E87: allman | F87: Sailboard | G87: Result | H87: 22.14233317006283 | I87: Mr | J87: Master | K87: No | L87: Neither
A88: =A87+1 -> 86 | B88: 349 | C88: 40097.463558993055 | D88: Bruno | E88: Warner | F88: Sailboard | G88: Result | H88: 21.912004020786345 | I88: Mr | J88: Master | K88: No | L88: Neither
A89: =A88+1 -> 87 | B89: 104 | C89: 40097.461955358798 | D89: Will | E89: Houghton | F89: Sailboard | G89: Result | H89: 21.529672498070745 | I89: Mr | J89: Junior | K89: Yes | L89: Neither
A90: =A89+1 -> 88 | B90: 23 | C90: 40097.494273796299 | D90: barry | E90: mason | F90: Sailboard | G90: Result | H90: 21.529234364412162 | I90: Mr | J90: Master | K90: No | L90: Neither
A91: =A90+1 -> 89 | B91: 343 | C91: 40097.499604641205 | D91: andrew | E91: robinson | F91: Sailboard | G91: Result | H91: 21.489420315587349 | I91: Mr | J91: Junior | K91: No | L91: Neither
A92: =A91+1 -> 90 | B92: 90 | C92: 40097.620826597224 | D92: ian | E92: blundell | F92: Sailboard | G92: Result | H92: 21.226717883476951 | I92: Mr | J92: Neither | K92: Yes | L92: Neither
A93: =A92+1 -> 91 | B93: 852 | C93: 40097.581340393517 | D93: Henry | E93: Bloodworth | F93: Sailboard | G93: Result | H93: 19.391392404358211 | I93: Mr | J93: Junior | K93: No | L93: Neither
A94: =A93+1 -> 92 | B94: 714 | C94: 40097.463800543985 | D94: Emily | E94: Hall | F94: Sailboard | G94: Result | H94: 16.7228293977177 | I94: Miss | J94: Junior | K94: Yes | L94: Gold Fleet
A95: =A94+1 -> 93 | B95: 112 | C95: 40097.608139548611 | D95: Emily | E95: Wood | F95: Sailboard | G95: Result | H95: 15.025952480751064 | I95: Miss | J95: Neither | K95: No | L95: Neither
A96: =A95+1 -> 94 | B96: 101 | C96: 40097.548583807868 | D96: Torix | E96: Bennett | F96: Boat | G96: Result | H96: 12.345039696564669 | I96: Mr | J96: Master | K96: No | L96: Gold Fleet
A97: =A96+1 -> 95 | B97: 54 | C97: 40097.573870324071 | D97: Alan | E97: Blundell | F97: Boat | G97: Result | H97: 12.268698650012105 | I97: Mr | J97: Master | K97: No | L97: Neither
A98: =A97+1 -> 96 | B98: 5 | C98: 40097.610988935186 | D98: Jean | E98: Hurtado | F98: Boat | G98: Result | H98: 5.2943514396720222 | I98: Mr | J98: Master | K98: No | L98: Neither

A1: Sail Number | B1: Time | C1: Title | D1: FirstName | E1: LastName | F1: CraftType | G1: Knots | H1: AgeStatus | I1: Novice | J1: Professional
A2: 2 | B2: 40097.593469467596 | C2: Mr | D2: Will | E2: Oscroft | F2: Sailboard | G2: 26.244047291563572 | H2: Neither | I2: No | J2: Neither
A3: 2 | B3: 40097.451535960645 | C3: Mr | D3: Will | E3: Oscroft | F3: Sailboard | G3: 25.655710455902678 | H3: Neither | I3: No | J3: Neither
A4: 2 | B4: 40097.599808599538 | C4: Mr | D4: Will | E4: Oscroft | F4: Sailboard | G4: 25.455607784068278 | H4: Neither | I4: No | J4: Neither
A5: 2 | B5: 40097.607284224534 | C5: Mr | D5: Will | E5: Oscroft | F5: Sailboard | G5: 24.358504722873302 | H5: Neither | I5: No | J5: Neither
A6: 2 | B6: 40097.620970902775 | C6: Mr | D6: Will | E6: Oscroft | F6: Sailboard | G6: 23.864309257662697 | H6: Neither | I6: No | J6: Neither
A7: 2 | B7: 40097.550659328706 | C7: Mr | D7: Will | E7: Oscroft | F7: Sailboard | G7: 23.709672671218662 | H7: Neither | I7: No | J7: Neither
A8: 2 | B8: 40097.459805231483 | C8: Mr | D8: Will | E8: Oscroft | F8: Sailboard | G8: 23.070324530564879 | H8: Neither | I8: No | J8: Neither
A9: 2 | B9: 40097.575337418981 | C9: Mr | D9: Will | E9: Oscroft | F9: Sailboard | G9: 6.9204934917892507 | H9: Neither | I9: No | J9: Neither
A10: 3 | B10: 40097.599946076392 | C10: Mr | D10: John | E10: McIntyre | F10: Sailboard | G10: 25.489969629662784 | H10: Master | I10: No | J10: Neither
A11: 3 | B11: 40097.595640069441 | C11: Mr | D11: John | E11: McIntyre | F11: Sailboard | G11: 25.343353002726115 | H11: Master | I11: No | J11: Neither
A12: 3 | B12: 40097.448932106483 | C12: Mr | D12: John | E12: McIntyre | F12: Sailboard | G12: 25.242925766412181 | H12: Master | I12: No | J12: Neither
A13: 3 | B13: 40097.4827071412 | C13: Mr | D13: John | E13: McIntyre | F13: Sailboard | G13: 25.154655430707262 | H13: Master | I13: No | J13: Neither
A14: 3 | B14: 40097.437761793983 | C14: Mr | D14: John | E14: McIntyre | F14: Sailboard | G14: 25.04503353832682 | H14: Master | I14: No | J14: Neither
A15: 3 | B15: 40097.623956030089 | C15: Mr | D15: John | E15: McIntyre | F15: Sailboard | G15: 24.891752106280915 | H15: Master | I15: No | J15: Neither
A16: 3 | B16: 40097.559525196761 | C16: Mr | D16: John | E16: McIntyre | F16: Sailboard | G16: 24.888822637382553 | H16: Master | I16: No | J16: Neither
A17: 3 | B17: 40097.549890798611 | C17: Mr | D17: John | E17: McIntyre | F17: Sailboard | G17: 24.680859027201102 | H17: Master | I17: No | J17: Neither
A18: 3 | B18: 40097.441071377318 | C18: Mr | D18: John | E18: McIntyre | F18: Sailboard | G18: 24.51151804520709 | H18: Master | I18: No | J18: Neither
A19: 3 | B19: 40097.614567245371 | C19: Mr | D19: John | E19: McIntyre | F19: Sailboard | G19: 24.505269749234262 | H19: Master | I19: No | J19: Neither
A20: 3 | B20: 40097.592143194444 | C20: Mr | D20: John | E20: McIntyre | F20: Sailboard | G20: 24.344485354161055 | H20: Master | I20: No | J20: Neither
A21: 3 | B21: 40097.618862916665 | C21: Mr | D21: John | E21: McIntyre | F21: Sailboard | G21: 24.337201432709303 | H21: Master | I21: No | J21: Neither
A22: 3 | B22: 40097.564665879632 | C22: Mr | D22: John | E22: McIntyre | F22: Sailboard | G22: 24.326004042223342 | H22: Master | I22: No | J22: Neither
A23: 3 | B23: 40097.546796030096 | C23: Mr | D23: John | E23: McIntyre | F23: Sailboard | G23: 24.324325410218513 | H23: Master | I23: No | J23: Neither
A24: 3 | B24: 40097.431251319445 | C24: Mr | D24: John | E24: McIntyre | F24: Sailboard | G24: 24.231797196353334 | H24: Master | I24: No | J24: Neither
A25: 3 | B25: 40097.499323020835 | C25: Mr | D25: John | E25: McIntyre | F25: Sailboard | G25: 24.180819061489583 | H25: Master | I25: No | J25: Neither
A26: 3 | B26: 40097.479901273146 | C26: Mr | D26: John | E26: McIntyre | F26: Sailboard | G26: 24.152652140096166 | H26: Master | I26: No | J26: Neither
A27: 3 | B27: 40097.434207523147 | C27: Mr | D27: John | E27: McIntyre | F27: Sailboard | G27: 23.942657537017372 | H27: Master | I27: No | J27: Neither
A28: 3 | B28: 40097.608037337966 | C28: Mr | D28: John | E28: McIntyre | F28: Sailboard | G28: 23.926946480172454 | H28: Master | I28: No | J28: Neither
A29: 3 | B29: 40097.553896886573 | C29: Mr | D29: John | E29: McIntyre | F29: Sailboard | G29: 23.886410874528202 | H29: Master | I29: No | J29: Neither
A30: 3 | B30: 40097.443942592596 | C30: Mr | D30: John | E30: McIntyre | F30: Sailboard | G30: 23.623336185623973 | H30: Master | I30: No | J30: Neither
A31: 3 | B31: 40097.486988055556 | C31: Mr | D31: John | E31: McIntyre | F31: Sailboard | G31: 23.496309355748775 | H31: Master | I31: No | J31: Neither
A32: 3 | B32: 40097.492943171295 | C32: Mr | D32: John | E32: McIntyre | F32: Sailboard | G32: 23.347421272422437 | H32: Master | I32: No | J32: Neither
A33: 3 | B33: 40097.496289965275 | C33: Mr | D33: John | E33: McIntyre | F33: Sailboard | G33: 22.835670897841677 | H33: Master | I33: No | J33: Neither
A34: 3 | B34: 40097.472374675926 | C34: Mr | D34: John | E34: McIntyre | F34: Sailboard | G34: 3.4863142394930398 | H34: Master | I34: No | J34: Neither
A35: 5 | B35: 40097.610988935186 | C35: Mr | D35: Jean | E35: Hurtado | F35: Boat | G35: 5.2943514396720222 | H35: Master | I35: No | J35: Neither
A36: 8 | B36: 40097.58297275463 | C36: Mr | D36: Raj | E36: Kanasam | F36: Sailboard | G36: 22.803169930816722 | H36: Neither | I36: No | J36: Neither
A37: 8 | B37: 40097.562666006947 | C37: Mr | D37: Raj | E37: Kanasam | F37: Sailboard | G37: 21.592538854687159 | H37: Neither | I37: No | J37: Neither
A38: 8 | B38: 40097.624283854166 | C38: Mr | D38: Raj | E38: Kanasam | F38: Sailboard | G38: 21.305409785816604 | H38: Neither | I38: No | J38: Neither
A39: 8 | B39: 40097.473697893518 | C39: Mr | D39: Raj | E39: Kanasam | F39: Sailboard | G39: 21.095024727407626 | H39: Neither | I39: No | J39: Neither
A40: 8 | B40: 40097.484377349538 | C40: Mr | D40: Raj | E40: Kanasam | F40: Sailboard | G40: 19.980564636724544 | H40: Neither | I40: No | J40: Neither
A41: 12 | B41: 40097.455860196758 | C41: Mr | D41: Jim | E41: Brooks-Dowsett | F41: Sailboard | G41: 24.674524109842508 | H41: Neither | I41: No | J41: Gold Fleet
A42: 12 | B42: 40097.621569826391 | C42: Mr | D42: Jim | E42: Brooks-Dowsett | F42: Sailboard | G42: 24.432795847756569 | H42: Neither | I42: No | J42: Gold Fleet
A43: 12 | B43: 40097.615781539353 | C43: Mr | D43: Jim | E43: Brooks-Dowsett | F43: Sailboard | G43: 24.000803428780287 | H43: Neither | I43: No | J43: Gold Fleet
A44: 12 | B44: 40097.560966458332 | C44: Mr | D44: Jim | E44: Brooks-Dowsett | F44: Sailboard | G44: 22.980580274878108 | H44: Neither | I44: No | J44: Gold Fleet
A45: 12 | B45: 40097.576373368058 | C45: Mr | D45: Jim | E45: Brooks-Dowsett | F45: Sailboard | G45: 13.060115110997407 | H45: Neither | I45: No | J45: Gold Fleet
A46: 14 | B46: 40097.477093761576 | C46: Mr | D46: Ian | E46: Hill | F46: Sailboard | G46: 28.314983994566813 | H46: Neither | I46: No | J46: Gold Fleet
A47: 14 | B47: 40097.599476793985 | C47: Mr | D47: Ian | E47: Hill | F47: Sailboard | G47: 28.131937357682542 | H47: Neither | I47: No | J47: Gold Fleet
A48: 14 | B48: 40097.465431122684 | C48: Mr | D48: Ian | E48: Hill | F48: Sailboard | G48: 27.859193648623087 | H48: Neither | I48: No | J48: Gold Fleet
A49: 14 | B49: 40097.462617847224 | C49: Mr | D49: Ian | E49: Hill | F49: Sailboard | G49: 27.811567043545832 | H49: Neither | I49: No | J49: Gold Fleet
A50: 14 | B50: 40097.484395590276 | C50: Mr | D50: Ian | E50: Hill | F50: Sailboard | G50: 27.356135195180467 | H50: Neither | I50: No | J50: Gold Fleet
A51: 14 | B51: 40097.499507048611 | C51: Mr | D51: Ian | E51: Hill | F51: Sailboard | G51: 27.320090133713133 | H51: Neither | I51: No | J51: Gold Fleet
A52: 14 | B52: 40097.46965914352 | C52: Mr | D52: Ian | E52: Hill | F52: Sailboard | G52: 27.317267043320676 | H52: Neither | I52: No | J52: Gold Fleet
A53: 14 | B53: 40097.603631817132 | C53: Mr | D53: Ian | E53: Hill | F53: Sailboard | G53: 27.116224123854028 | H53: Neither | I53: No | J53: Gold Fleet
A54: 14 | B54: 40097.59525791667 | C54: Mr | D54: Ian | E54: Hill | F54: Sailboard | G54: 26.834100660329266 | H54: Neither | I54: No | J54: Gold Fleet
A55: 14 | B55: 40097.487066574075 | C55: Mr | D55: Ian | E55: Hill | F55: Sailboard | G55: 26.358527484215678 | H55: Neither | I55: No | J55: Gold Fleet
A56: 14 | B56: 40097.575774201388 | C56: Mr | D56: Ian | E56: Hill | F56: Sailboard | G56: 26.093803781368603 | H56: Neither | I56: No | J56: Gold Fleet
A57: 14 | B57: 40097.493002233794 | C57: Mr | D57: Ian | E57: Hill | F57: Sailboard | G57: 25.304539809406073 | H57: Neither | I57: No | J57: Gold Fleet
A58: 14 | B58: 40097.579319687502 | C58: Mr | D58: Ian | E58: Hill | F58: Sailboard | G58: 25.226064404958464 | H58: Neither | I58: No | J58: Gold Fleet
A59: 14 | B59: 40097.496256226848 | C59: Mr | D59: Ian | E59: Hill | F59: Sailboard | G59: 25.177414522317832 | H59: Neither | I59: No | J59: Gold Fleet
A60: 14 | B60: 40097.572265752315 | C60: Mr | D60: Ian | E60: Hill | F60: Sailboard | G60: 24.588462302807802 | H60: Neither | I60: No | J60: Gold Fleet
A61: 23 | B61: 40097.494273796299 | C61: Mr | D61: barry | E61: mason | F61: Sailboard | G61: 21.529234364412162 | H61: Master | I61: No | J61: Neither
A62: 24 | B62: 40097.483668483794 | C62: Mr | D62: Trevor | E62: Funnell | F62: Sailboard | G62: 23.495787524278395 | H62: Master | I62: No | J62: Neither
A63: 24 | B63: 40097.472587233795 | C63: Mr | D63: Trevor | E63: Funnell | F63: Sailboard | G63: 23.402708970071679 | H63: Master | I63: No | J63: Neither
A64: 29 | B64: 40097.453710983798 | C64: Mr | D64: Tony | E64: Robinson | F64: Sailboard | G64: 27.155916798497817 | H64: Master | I64: No | J64: Neither
A65: 29 | B65: 40097.457815254631 | C65: Mr | D65: Tony | E65: Robinson | F65: Sailboard | G65: 26.69388099656198 | H65: Master | I65: No | J65: Neither
A66: 29 | B66: 40097.461650405094 | C66: Mr | D66: Tony | E66: Robinson | F66: Sailboard | G66: 26.538458126441071 | H66: Master | I66: No | J66: Neither
A67: 29 | B67: 40097.482016076392 | C67: Mr | D67: Tony | E67: Robinson | F67: Sailboard | G67: 26.21542004880801 | H67: Master | I67: No | J67: Neither
A68: 29 | B68: 40097.441135613422 | C68: Mr | D68: Tony | E68: Robinson | F68: Sailboard | G68: 26.068716227958788 | H68: Master | I68: No | J68: Neither
A69: 29 | B69: 40097.474416481484 | C69: Mr | D69: Tony | E69: Robinson | F69: Sailboard | G69: 25.942724603396421 | H69: Master | I69: No | J69: Neither
A70: 29 | B70: 40097.600364444443 | C70: Mr | D70: Tony | E70: Robinson | F70: Sailboard | G70: 25.848869715279911 | H70: Master | I70: No | J70: Neither
A71: 29 | B71: 40097.431752534721 | C71: Mr | D71: Tony | E71: Robinson | F71: Sailboard | G71: 25.656332640466776 | H71: Master | I71: No | J71: Neither
A72: 29 | B72: 40097.467455243059 | C72: Mr | D72: Tony | E72: Robinson | F72: Sailboard | G72: 25.540453448136386 | H72: Master | I72: No | J72: Neither
A73: 29 | B73: 40097.436087789349 | C73: Mr | D73: Tony | E73: Robinson | F73: Sailboard | G73: 25.499189950393113 | H73: Master | I73: No | J73: Neither
A74: 29 | B74: 40097.593855798608 | C74: Mr | D74: Tony | E74: Robinson | F74: Sailboard | G74: 24.932247392974944 | H74: Master | I74: No | J74: Neither
A75: 29 | B75: 40097.60997834491 | C75: Mr | D75: Tony | E75: Robinson | F75: Sailboard | G75: 22.922793662622741 | H75: Master | I75: No | J75: Neither
A76: 30 | B76: 40097.582785983795 | C76: Mr | D76: alan | E76: bennett | F76: Sailboard | G76: 24.314817302161934 | H76: Neither | I76: No | J76: Neither
A77: 30 | B77: 40097.463533912036 | C77: Mr | D77: alan | E77: bennett | F77: Sailboard | G77: 24.077310805495436 | H77: Neither | I77: No | J77: Neither
A78: 30 | B78: 40097.5452874537 | C78: Mr | D78: alan | E78: bennett | F78: Sailboard | G78: 23.870773863197705 | H78: Neither | I78: No | J78: Neither
A79: 30 | B79: 40097.595882256945 | C79: Mr | D79: alan | E79: bennett | F79: Sailboard | G79: 23.681531147501381 | H79: Neither | I79: No | J79: Neither
A80: 30 | B80: 40097.550888275466 | C80: Mr | D80: alan | E80: bennett | F80: Sailboard | G80: 23.271377682311225 | H80: Neither | I80: No | J80: Neither
A81: 30 | B81: 40097.495232719906 | C81: Mr | D81: alan | E81: bennett | F81: Sailboard | G81: 23.216198559457411 | H81: Neither | I81: No | J81: Neither
A82: 30 | B82: 40097.4807349537 | C82: Mr | D82: alan | E82: bennett | F82: Sailboard | G82: 22.893018224142129 | H82: Neither | I82: No | J82: Neither
A83: 30 | B83: 40097.471960844909 | C83: Mr | D83: alan | E83: bennett | F83: Sailboard | G83: 22.610092301964556 | H83: Neither | I83: No | J83: Neither
A84: 30 | B84: 40097.488329236112 | C84: Mr | D84: alan | E84: bennett | F84: Sailboard | G84: 22.176231074531326 | H84: Neither | I84: No | J84: Neither
A85: 30 | B85: 40097.563897118052 | C85: Mr | D85: alan | E85: bennett | F85: Sailboard | G85: 22.104841453715068 | H85: Neither | I85: No | J85: Neither
A86: 30 | B86: 40097.58778765046 | C86: Mr | D86: alan | E86: bennett | F86: Sailboard | G86: 21.944289153424911 | H86: Neither | I86: No | J86: Neither
A87: 30 | B87: 40097.622754178243 | C87: Mr | D87: alan | E87: bennett | F87: Sailboard | G87: 21.884341772024129 | H87: Neither | I87: No | J87: Neither
A88: 30 | B88: 40097.575074594904 | C88: Mr | D88: alan | E88: bennett | F88: Sailboard | G88: 21.795033015399969 | H88: Neither | I88: No | J88: Neither
A89: 30 | B89: 40097.603720231484 | C89: Mr | D89: alan | E89: bennett | F89: Sailboard | G89: 21.43931645658034 | H89: Neither | I89: No | J89: Neither
A90: 39 | B90: 40097.604672766203 | C90: Mr | D90: Simon | E90: Todd | F90: Sailboard | G90: 25.07472728961184 | H90: Neither | I90: Yes | J90: Neither
A91: 39 | B91: 40097.598896331016 | C91: Mr | D91: Simon | E91: Todd | F91: Sailboard | G91: 24.304757888952672 | H91: Neither | I91: Yes | J91: Neither
A92: 39 | B92: 40097.617081458331 | C92: Mr | D92: Simon | E92: Todd | F92: Sailboard | G92: 23.982840742625328 | H92: Neither | I92: Yes | J92: Neither
A93: 39 | B93: 40097.584120057872 | C93: Mr | D93: Simon | E93: Todd | F93: Sailboard | G93: 23.613840677771186 | H93: Neither | I93: Yes | J93: Neither
A94: 39 | B94: 40097.622406273149 | C94: Mr | D94: Simon | E94: Todd | F94: Sailboard | G94: 23.262162954182163 | H94: Neither | I94: Yes | J94: Neither
A95: 39 | B95: 40097.612508611113 | C95: Mr | D95: Simon | E95: Todd | F95: Sailboard | G95: 23.171938273132202 | H95: Neither | I95: Yes | J95: Neither
A96: 39 | B96: 40097.591752789354 | C96: Mr | D96: Simon | E96: Todd | F96: Sailboard | G96: 23.096022558691619 | H96: Neither | I96: Yes | J96: Neither
A97: 40 | B97: 40097.547422870368 | C97: Mr | D97: Ian | E97: Hobbs | F97: Sailboard | G97: 24.089926229851766 | H97: Master | I97: Yes | J97: Neither
A98: 40 | B98: 40097.595710312497 | C98: Mr | D98: Ian | E98: Hobbs | F98: Sailboard | G98: 23.939947191783908 | H98: Master | I98: Yes | J98: Neither
A99: 40 | B99: 40097.444154687502 | C99: Mr | D99: Ian | E99: Hobbs | F99: Sailboard | G99: 23.302659718006332 | H99: Master | I99: Yes | J99: Neither
A100: 40 | B100: 40097.605870173611 | C100: Mr | D100: Ian | E100: Hobbs | F100: Sailboard | G100: 23.286239016466102 | H100: Master | I100: Yes | J100: Neither
A101: 40 | B101: 40097.458784641203 | C101: Mr | D101: Ian | E101: Hobbs | F101: Sailboard | G101: 23.137967713656231 | H101: Master | I101: Yes | J101: Neither
A102: 40 | B102: 40097.430456631948 | C102: Mr | D102: Ian | E102: Hobbs | F102: Sailboard | G102: 22.668740145142468 | H102: Master | I102: Yes | J102: Neither
A103: 40 | B103: 40097.471889930559 | C103: Mr | D103: Ian | E103: Hobbs | F103: Sailboard | G103: 21.772146849560688 | H103: Master | I103: Yes | J103: Neither
A104: 40 | B104: 40097.491559768518 | C104: Mr | D104: Ian | E104: Hobbs | F104: Sailboard | G104: 21.546342804936039 | H104: Master | I104: Yes | J104: Neither
A105: 40 | B105: 40097.481048784721 | C105: Mr | D105: Ian | E105: Hobbs | F105: Sailboard | G105: 19.085848056982172 | H105: Master | I105: Yes | J105: Neither
A106: 40 | B106: 40097.581775324077 | C106: Mr | D106: Ian | E106: Hobbs | F106: Sailboard | G106: 2.69137347479804 | H106: Master | I106: Yes | J106: Neither
A107: 42 | B107: 40097.597802800927 | C107: Mr | D107: John | E107: Langdown | F107: Sailboard | G107: 25.208024205789073 | H107: Neither | I107: No | J107: Neither
A108: 42 | B108: 40097.450870127315 | C108: Mr | D108: John | E108: Langdown | F108: Sailboard | G108: 24.432795847756569 | H108: Neither | I108: No | J108: Neither
A109: 42 | B109: 40097.604347812499 | C109: Mr | D109: John | E109: Langdown | F109: Sailboard | G109: 24.202403351892194 | H109: Neither | I109: No | J109: Neither
A110: 42 | B110: 40097.483788645834 | C110: Mr | D110: John | E110: Langdown | F110: Sailboard | G110: 23.830427864663744 | H110: Neither | I110: No | J110: Neither
A111: 42 | B111: 40097.619751678241 | C111: Mr | D111: John | E111: Langdown | F111: Sailboard | G111: 23.573306900566902 | H111: Neither | I111: No | J111: Neither
A112: 42 | B112: 40097.565467812499 | C112: Mr | D112: John | E112: Langdown | F112: Sailboard | G112: 22.896983895643874 | H112: Neither | I112: No | J112: Neither
A113: 42 | B113: 40097.614266307872 | C113: Mr | D113: John | E113: Langdown | F113: Sailboard | G113: 22.863319727844992 | H113: Neither | I113: No | J113: Neither
A114: 42 | B114: 40097.437374629633 | C114: Mr | D114: John | E114: Langdown | F114: Sailboard | G114: 22.81497750142335 | H114: Neither | I114: No | J114: Neither
A115: 42 | B115: 40097.587934305557 | C115: Mr | D115: John | E115: Langdown | F115: Sailboard | G115: 22.658054531081572 | H115: Neither | I115: No | J115: Neither
A116: 42 | B116: 40097.578421203703 | C116: Mr | D116: John | E116: Langdown | F116: Sailboard | G116: 22.321816395734604 | H116: Neither | I116: No | J116: Neither
A117: 42 | B117: 40097.468482685188 | C117: Mr | D117: John | E117: Langdown | F117: Sailboard | G117: 21.846815300283332 | H117: Neither | I117: No | J117: Neither
A118: 42 | B118: 40097.466731840279 | C118: Mr | D118: John | E118: Langdown | F118: Sailboard | G118: 1.2841548097329416 | H118: Neither | I118: No | J118: Neither
A119: 43 | B119: 40097.487506585647 | C119: Mr | D119: Simon | E119: Thompson | F119: Sailboard | G119: 25.583708177867415 | H119: Neither | I119: No | J119: Gold Fleet
A120: 43 | B120: 40097.444905497687 | C120: Mr | D120: Simon | E120: Thompson | F120: Sailboard | G120: 25.42317153538222 | H120: Neither | I120: No | J120: Gold Fleet
A121: 43 | B121: 40097.601335219908 | C121: Mr | D121: Simon | E121: Thompson | F121: Sailboard | G121: 25.179212967484975 | H121: Neither | I121: No | J121: Gold Fleet
A122: 43 | B122: 40097.470190381944 | C122: Mr | D122: Simon | E122: Thompson | F122: Sailboard | G122: 24.732812808020562 | H122: Neither | I122: No | J122: Gold Fleet
A123: 44 | B123: 40097.59958159722 | C123: Mr | D123: Dave | E123: Strudwick | F123: Sailboard | G123: 26.459437364344499 | H123: Master | I123: No | J123: Gold Fleet
A124: 44 | B124: 40097.464366006941 | C124: Mr | D124: Dave | E124: Strudwick | F124: Sailboard | G124: 26.011644960550775 | H124: Master | I124: No | J124: Gold Fleet
A125: 44 | B125: 40097.467911006941 | C125: Mr | D125: Dave | E125: Strudwick | F125: Sailboard | G125: 25.898249220329603 | H125: Master | I125: No | J125: Gold Fleet
A126: 44 | B126: 40097.475129155093 | C126: Mr | D126: Dave | E126: Strudwick | F126: Sailboard | G126: 25.670657878979821 | H126: Master | I126: No | J126: Gold Fleet
A127: 44 | B127: 40097.584470196758 | C127: Mr | D127: Dave | E127: Strudwick | F127: Sailboard | G127: 25.509032004815573 | H127: Master | I127: No | J127: Gold Fleet
A128: 44 | B128: 40097.594452372687 | C128: Mr | D128: Dave | E128: Strudwick | F128: Sailboard | G128: 24.843214020435884 | H128: Master | I128: No | J128: Gold Fleet
A129: 44 | B129: 40097.60662366898 | C129: Mr | D129: Dave | E129: Strudwick | F129: Sailboard | G129: 24.769890650821523 | H129: Master | I129: No | J129: Gold Fleet
A130: 44 | B130: 40097.484934120374 | C130: Mr | D130: Dave | E130: Strudwick | F130: Sailboard | G130: 23.985016336321195 | H130: Master | I130: No | J130: Gold Fleet
A131: 44 | B131: 40097.489059224536 | C131: Mr | D131: Dave | E131: Strudwick | F131: Sailboard | G131: 21.540198023225113 | H131: Master | I131: No | J131: Gold Fleet
A132: 49 | B132: 40097.461521446756 | C132: Mr | D132: Jeremy | E132: Gardner | F132: Sailboard | G132: 24.459357802889706 | H132: Master | I132: Yes | J132: Neither
A133: 49 | B133: 40097.449174097223 | C133: Mr | D133: Jeremy | E133: Gardner | F133: Sailboard | G133: 24.441266736980452 | H133: Master | I133: Yes | J133: Neither
A134: 49 | B134: 40097.62084609954 | C134: Mr | D134: Jeremy | E134: Gardner | F134: Sailboard | G134: 24.401785856558348 | H134: Master | I134: Yes | J134: Neither
A135: 49 | B135: 40097.490414293985 | C135: Mr | D135: Jeremy | E135: Gardner | F135: Sailboard | G135: 23.252955199205442 | H135: Master | I135: Yes | J135: Neither
A136: 49 | B136: 40097.466807476849 | C136: Mr | D136: Jeremy | E136: Gardner | F136: Sailboard | G136: 22.891035903476194 | H136: Master | I136: Yes | J136: Neither
A137: 49 | B137: 40097.443811041667 | C137: Mr | D137: Jeremy | E137: Gardner | F137: Sailboard | G137: 21.260432612819166 | H137: Master | I137: Yes | J137: Neither
A138: 49 | B138: 40097.582058055559 | C138: Mr | D138: Jeremy | E138: Gardner | F138: Sailboard | G138: 7.6445770068566121 | H138: Master | I138: Yes | J138: Neither
A139: 50 | B139: 40097.553079884259 | C139: Mr | D139: BARRY | E139: PEARCE | F139: Sailboard | G139: 26.552451914073036 | H139: Master | I139: No | J139: Neither
A140: 50 | B140: 40097.549239814813 | C140: Mr | D140: BARRY | E140: PEARCE | F140: Sailboard | G140: 26.404599619178828 | H140: Master | I140: No | J140: Neither
A141: 50 | B141: 40097.602231099539 | C141: Mr | D141: BARRY | E141: PEARCE | F141: Sailboard | G141: 25.81416356201699 | H141: Master | I141: No | J141: Neither
A142: 50 | B142: 40097.476711967596 | C142: Mr | D142: BARRY | E142: PEARCE | F142: Sailboard | G142: 25.795901697157444 | H142: Master | I142: No | J142: Neither
A143: 50 | B143: 40097.582580196758 | C143: Mr | D143: BARRY | E143: PEARCE | F143: Sailboard | G143: 25.617796621045979 | H143: Master | I143: No | J143: Neither
A144: 50 | B144: 40097.556826817126 | C144: Mr | D144: BARRY | E144: PEARCE | F144: Sailboard | G144: 25.604770424683981 | H144: Master | I144: No | J144: Neither
A145: 50 | B145: 40097.472336250001 | C145: Mr | D145: BARRY | E145: PEARCE | F145: Sailboard | G145: 25.477073071782709 | H145: Master | I145: No | J145: Neither
A146: 50 | B146: 40097.492191620368 | C146: Mr | D146: BARRY | E146: PEARCE | F146: Sailboard | G146: 24.768730445134171 | H146: Master | I146: No | J146: Neither
A147: 50 | B147: 40097.487946527777 | C147: Mr | D147: BARRY | E147: PEARCE | F147: Sailboard | G147: 24.557056523022073 | H147: Master | I147: No | J147: Neither
A148: 50 | B148: 40097.563016145832 | C148: Mr | D148: BARRY | E148: PEARCE | F148: Sailboard | G148: 24.451439489529317 | H148: Master | I148: No | J148: Neither
A149: 50 | B149: 40097.624611678242 | C149: Mr | D149: BARRY | E149: PEARCE | F149: Sailboard | G149: 24.053760136969199 | H149: Master | I149: No | J149: Neither
A150: 50 | B150: 40097.575252523151 | C150: Mr | D150: BARRY | E150: PEARCE | F150: Sailboard | G150: 2.4424951394635048 | H150: Master | I150: No | J150: Neither
A151: 51 | B151: 40097.596187766205 | C151: Mr | D151: Clive | E151: Ellis | F151: Sailboard | G151: 25.864043127484116 | H151: Master | I151: No | J151: Neither
A152: 51 | B152: 40097.60207778935 | C152: Mr | D152: Clive | E152: Ellis | F152: Sailboard | G152: 25.39264728982954 | H152: Master | I152: No | J152: Neither
A153: 51 | B153: 40097.61674759259 | C153: Mr | D153: Clive | E153: Ellis | F153: Sailboard | G153: 24.41812689780032 | H153: Master | I153: No | J153: Neither
A154: 51 | B154: 40097.621744050928 | C154: Mr | D154: Clive | E154: Ellis | F154: Sailboard | G154: 24.41812689780032 | H154: Master | I154: No | J154: Neither
A155: 51 | B155: 40097.610110821763 | C155: Mr | D155: Clive | E155: Ellis | F155: Sailboard | G155: 24.327682905930374 | H155: Master | I155: No | J155: Neither
A156: 51 | B156: 40097.440288344907 | C156: Mr | D156: Clive | E156: Ellis | F156: Sailboard | G156: 23.471797171704846 | H156: Master | I156: No | J156: Neither
A157: 54 | B157: 40097.573870324071 | C157: Mr | D157: Alan | E157: Blundell | F157: Boat | G157: 12.268698650012105 | H157: Master | I157: No | J157: Neither
A158: 54 | B158: 40097.565149895832 | C158: Mr | D158: Alan | E158: Blundell | F158: Boat | G158: 11.550281878411015 | H158: Master | I158: No | J158: Neither
A159: 55 | B159: 40097.497288333332 | C159: Mr | D159: James | E159: Lawton | F159: Sailboard | G159: 26.229075553835436 | H159: Neither | I159: Yes | J159: Neither
A160: 55 | B160: 40097.583439421294 | C160: Mr | D160: James | E160: Lawton | F160: Sailboard | G160: 23.804142034902753 | H160: Neither | I160: Yes | J160: Neither
A161: 55 | B161: 40097.546646226852 | C161: Mr | D161: James | E161: Lawton | F161: Sailboard | G161: 23.361863696822276 | H161: Neither | I161: Yes | J161: Neither
A162: 55 | B162: 40097.559769791667 | C162: Mr | D162: James | E162: Lawton | F162: Sailboard | G162: 22.837643330619574 | H162: Neither | I162: Yes | J162: Neither
A163: 55 | B163: 40097.602992372682 | C163: Mr | D163: James | E163: Lawton | F163: Sailboard | G163: 22.79186589514347 | H163: Neither | I163: Yes | J163: Neither
A164: 55 | B164: 40097.480056446759 | C164: Mr | D164: James | E164: Lawton | F164: Sailboard | G164: 22.708171114153011 | H164: Neither | I164: Yes | J164: Neither
A165: 55 | B165: 40097.474799479169 | C165: Mr | D165: James | E165: Lawton | F165: Sailboard | G165: 22.641559646687234 | H165: Neither | I165: Yes | J165: Neither
A166: 55 | B166: 40097.469366527781 | C166: Mr | D166: James | E166: Lawton | F166: Sailboard | G166: 22.621216704882183 | H166: Neither | I166: Yes | J166: Neither
A167: 55 | B167: 40097.612033217592 | C167: Mr | D167: James | E167: Lawton | F167: Sailboard | G167: 22.503275167520183 | H167: Neither | I167: Yes | J167: Neither
A168: 55 | B168: 40097.593734247683 | C168: Mr | D168: James | E168: Lawton | F168: Sailboard | G168: 21.788745870543671 | H168: Neither | I168: Yes | J168: Neither
A169: 55 | B169: 40097.46430915509 | C169: Mr | D169: James | E169: Lawton | F169: Sailboard | G169: 21.771250470334639 | H169: Neither | I169: Yes | J169: Neither
A170: 55 | B170: 40097.571795277778 | C170: Mr | D170: James | E170: Lawton | F170: Sailboard | G170: 21.669974146260408 | H170: Neither | I170: Yes | J170: Neither
A171: 55 | B171: 40097.587849490737 | C171: Mr | D171: James | E171: Lawton | F171: Sailboard | G171: 21.642476757711318 | H171: Neither | I171: Yes | J171: Neither
A172: 55 | B172: 40097.49375760417 | C172: Mr | D172: James | E172: Lawton | F172: Sailboard | G172: 21.560840004606117 | H172: Neither | I172: Yes | J172: Neither
A173: 55 | B173: 40097.565636030093 | C173: Mr | D173: James | E173: Lawton | F173: Sailboard | G173: 21.546342528947779 | H173: Neither | I173: Yes | J173: Neither
A174: 55 | B174: 40097.486569421293 | C174: Mr | D174: James | E174: Lawton | F174: Sailboard | G174: 21.029580151806854 | H174: Neither | I174: Yes | J174: Neither
A175: 55 | B175: 40097.577286099535 | C175: Mr | D175: James | E175: Lawton | F175: Sailboard | G175: 19.893359232456934 | H175: Neither | I175: Yes | J175: Neither
A176: 56 | B176: 40097.554774525466 | C176: Mr | D176: Tim | E176: Lawes | F176: Sailboard | G176: 27.091909221096266 | H176: Neither | I176: No | J176: Gold Fleet
A177: 56 | B177: 40097.548441099534 | C177: Mr | D177: Tim | E177: Lawes | F177: Sailboard | G177: 26.693881420172691 | H177: Neither | I177: No | J177: Gold Fleet
A178: 56 | B178: 40097.607564085651 | C178: Mr | D178: Tim | E178: Lawes | F178: Sailboard | G178: 26.485282539993694 | H178: Neither | I178: No | J178: Gold Fleet
A179: 56 | B179: 40097.617985462966 | C179: Mr | D179: Tim | E179: Lawes | F179: Sailboard | G179: 26.059079916072061 | H179: Neither | I179: No | J179: Gold Fleet
A180: 56 | B180: 40097.585210821759 | C180: Mr | D180: Tim | E180: Lawes | F180: Sailboard | G180: 25.868472078732385 | H180: Neither | I180: No | J180: Gold Fleet
A181: 56 | B181: 40097.581757546293 | C181: Mr | D181: Tim | E181: Lawes | F181: Sailboard | G181: 25.667542216852613 | H181: Neither | I181: No | J181: Gold Fleet
A182: 56 | B182: 40097.601975590274 | C182: Mr | D182: Tim | E182: Lawes | F182: Sailboard | G182: 25.280341781823481 | H182: Neither | I182: No | J182: Gold Fleet
A183: 56 | B183: 40097.564382048608 | C183: Mr | D183: Tim | E183: Lawes | F183: Sailboard | G183: 24.218478008166969 | H183: Neither | I183: No | J183: Gold Fleet
A184: 56 | B184: 40097.499758414349 | C184: Mr | D184: Tim | E184: Lawes | F184: Sailboard | G184: 24.211824077556866 | H184: Neither | I184: No | J184: Gold Fleet
A185: 56 | B185: 40097.589573958336 | C185: Mr | D185: Tim | E185: Lawes | F185: Sailboard | G185: 23.917205379110428 | H185: Neither | I185: No | J185: Gold Fleet
A186: 56 | B186: 40097.594182696761 | C186: Mr | D186: Tim | E186: Lawes | F186: Sailboard | G186: 23.622280899533298 | H186: Neither | I186: No | J186: Gold Fleet
A187: 56 | B187: 40097.578998252313 | C187: Mr | D187: Tim | E187: Lawes | F187: Sailboard | G187: 6.5399117166954648 | H187: Neither | I187: No | J187: Gold Fleet
A188: 62 | B188: 40097.546154363423 | C188: Mr | D188: Dave | E188: Crowhurst | F188: Sailboard | G188: 25.671281180529736 | H188: Master | I188: Yes | J188: Neither
A189: 62 | B189: 40097.494950914355 | C189: Mr | D189: Dave | E189: Crowhurst | F189: Sailboard | G189: 24.269058124891348 | H189: Master | I189: Yes | J189: Neither
A190: 62 | B190: 40097.461406273149 | C190: Mr | D190: Dave | E190: Crowhurst | F190: Sailboard | G190: 24.255141498466681 | H190: Master | I190: Yes | J190: Neither
A191: 62 | B191: 40097.550294293978 | C191: Mr | D191: Dave | E191: Crowhurst | F191: Sailboard | G191: 24.098710277237132 | H191: Master | I191: Yes | J191: Neither
A192: 62 | B192: 40097.553490185186 | C192: Mr | D192: Dave | E192: Crowhurst | F192: Sailboard | G192: 23.864309257662697 | H192: Master | I192: Yes | J192: Neither
A193: 62 | B193: 40097.468115821757 | C193: Mr | D193: Dave | E193: Crowhurst | F193: Sailboard | G193: 23.677289084063077 | H193: Master | I193: Yes | J193: Neither
A194: 62 | B194: 40097.477732905092 | C194: Mr | D194: Dave | E194: Crowhurst | F194: Sailboard | G194: 23.617005219828073 | H194: Master | I194: Yes | J194: Neither
A195: 62 | B195: 40097.49807209491 | C195: Mr | D195: Dave | E195: Crowhurst | F195: Sailboard | G195: 23.573306900566902 | H195: Master | I195: Yes | J195: Neither
A196: 62 | B196: 40097.490112025465 | C196: Mr | D196: Dave | E196: Crowhurst | F196: Sailboard | G196: 23.563851561076653 | H196: Master | I196: Yes | J196: Neither
A197: 62 | B197: 40097.586402546294 | C197: Mr | D197: Dave | E197: Crowhurst | F197: Sailboard | G197: 23.522966031387007 | H197: Master | I197: Yes | J197: Neither
A198: 62 | B198: 40097.472633240737 | C198: Mr | D198: Dave | E198: Crowhurst | F198: Sailboard | G198: 23.29547315513646 | H198: Master | I198: Yes | J198: Neither
A199: 62 | B199: 40097.464830567129 | C199: Mr | D199: Dave | E199: Crowhurst | F199: Sailboard | G199: 23.285213632005565 | H199: Master | I199: Yes | J199: Neither
A200: 62 | B200: 40097.624358472225 | C200: Mr | D200: Dave | E200: Crowhurst | F200: Sailboard | G200: 23.108135755229078 | H200: Master | I200: Yes | J200: Neither
A201: 62 | B201: 40097.580223622688 | C201: Mr | D201: Dave | E201: Crowhurst | F201: Sailboard | G201: 23.003076014962939 | H201: Master | I201: Yes | J201: Neither
A202: 62 | B202: 40097.560793888886 | C202: Mr | D202: Dave | E202: Crowhurst | F202: Sailboard | G202: 22.75948971938827 | H202: Master | I202: Yes | J202: Neither
A203: 62 | B203: 40097.613003530096 | C203: Mr | D203: Dave | E203: Crowhurst | F203: Sailboard | G203: 22.640589945921015 | H203: Master | I203: Yes | J203: Neither
A204: 62 | B204: 40097.607962731483 | C204: Mr | D204: Dave | E204: Crowhurst | F204: Sailboard | G204: 22.341623875652083 | H204: Master | I204: Yes | J204: Neither
A205: 62 | B205: 40097.618178414348 | C205: Mr | D205: Dave | E205: Crowhurst | F205: Sailboard | G205: 22.043555568515131 | H205: Master | I205: Yes | J205: Neither
A206: 66 | B206: 40097.478370034725 | C206: Mr | D206: Alex | E206: Bennett- Baggs | F206: Sailboard | G206: 22.80218633794167 | H206: Neither | I206: No | J206: Neither
A207: 66 | B207: 40097.500877418985 | C207: Mr | D207: Alex | E207: Bennett- Baggs | F207: Sailboard | G207: 21.974386029092443 | H207: Neither | I207: No | J207: Neither
A208: 69 | B208: 40097.548399583335 | C208: Mr | D208: Gareth | E208: Baker | F208: Sailboard | G208: 27.963808149633643 | H208: Neither | I208: No | J208: Gold Fleet
A209: 69 | B209: 40097.449284814815 | C209: Mr | D209: Gareth | E209: Baker | F209: Sailboard | G209: 26.430338139675634 | H209: Neither | I209: No | J209: Gold Fleet
A210: 69 | B210: 40097.45199050926 | C210: Mr | D210: Gareth | E210: Baker | F210: Sailboard | G210: 26.319819932504526 | H210: Neither | I210: No | J210: Gold Fleet
A211: 69 | B211: 40097.445480775466 | C211: Mr | D211: Gareth | E211: Baker | F211: Sailboard | G211: 26.162882845021272 | H211: Neither | I211: No | J211: Gold Fleet
A212: 69 | B212: 40097.595059409723 | C212: Mr | D212: Gareth | E212: Baker | F212: Sailboard | G212: 26.109266602193781 | H212: Neither | I212: No | J212: Gold Fleet
A213: 69 | B213: 40097.458247141207 | C213: Mr | D213: Gareth | E213: Baker | F213: Sailboard | G213: 25.989908296983963 | H213: Neither | I213: No | J213: Gold Fleet
A214: 69 | B214: 40097.442501331017 | C214: Mr | D214: Gareth | E214: Baker | F214: Sailboard | G214: 25.910305796669146 | H214: Neither | I214: No | J214: Gold Fleet
A215: 69 | B215: 40097.439844432869 | C215: Mr | D215: Gareth | E215: Baker | F215: Sailboard | G215: 25.549092921938968 | H215: Neither | I215: No | J215: Gold Fleet
A216: 69 | B216: 40097.552657997687 | C216: Mr | D216: Gareth | E216: Baker | F216: Sailboard | G216: 25.317261860545837 | H216: Neither | I216: No | J216: Gold Fleet
A217: 69 | B217: 40097.463339305556 | C217: Mr | D217: Gareth | E217: Baker | F217: Sailboard | G217: 25.314837880537844 | H217: Neither | I217: No | J217: Gold Fleet
A218: 69 | B218: 40097.623027002315 | C218: Mr | D218: Gareth | E218: Baker | F218: Sailboard | G218: 25.128951551150259 | H218: Neither | I218: No | J218: Gold Fleet
A219: 69 | B219: 40097.619480601854 | C219: Mr | D219: Gareth | E219: Baker | F219: Sailboard | G219: 24.985856147992095 | H219: Neither | I219: No | J219: Gold Fleet
A220: 69 | B220: 40097.576291620368 | C220: Mr | D220: Gareth | E220: Baker | F220: Sailboard | G220: 24.959906642852605 | H220: Neither | I220: No | J220: Gold Fleet
A221: 69 | B221: 40097.614138368059 | C221: Mr | D221: Gareth | E221: Baker | F221: Sailboard | G221: 24.830379919586175 | H221: Neither | I221: No | J221: Gold Fleet
A222: 69 | B222: 40097.580015312502 | C222: Mr | D222: Gareth | E222: Baker | F222: Sailboard | G222: 24.095964488075627 | H222: Neither | I222: No | J222: Gold Fleet
A223: 69 | B223: 40097.603781608799 | C223: Mr | D223: Gareth | E223: Baker | F223: Sailboard | G223: 23.639707676905189 | H223: Neither | I223: No | J223: Gold Fleet
A224: 69 | B224: 40097.566131597225 | C224: Mr | D224: Gareth | E224: Baker | F224: Sailboard | G224: 22.985075713825651 | H224: Neither | I224: No | J224: Gold Fleet
A225: 76 | B225: 40097.445840081018 | C225: Mr | D225: Simon | E225: Perkins | F225: Sailboard | G225: 27.067637885232703 | H225: Neither | I225: No | J225: Neither
A226: 76 | B226: 40097.500376840275 | C226: Mr | D226: Simon | E226: Perkins | F226: Sailboard | G226: 26.647466331020851 | H226: Neither | I226: No | J226: Neither
A227: 76 | B227: 40097.457737777775 | C227: Mr | D227: Simon | E227: Perkins | F227: Sailboard | G227: 26.503205914753131 | H227: Neither | I227: No | J227: Neither
A228: 76 | B228: 40097.450409016201 | C228: Mr | D228: Simon | E228: Perkins | F228: Sailboard | G228: 26.023167640054972 | H228: Neither | I228: No | J228: Neither
A229: 76 | B229: 40097.495439363425 | C229: Mr | D229: Simon | E229: Perkins | F229: Sailboard | G229: 25.94081543986897 | H229: Neither | I229: No | J229: Neither
A230: 76 | B230: 40097.467708090277 | C230: Mr | D230: Simon | E230: Perkins | F230: Sailboard | G230: 25.758200616303512 | H230: Neither | I230: No | J230: Neither
A231: 76 | B231: 40097.490987638892 | C231: Mr | D231: Simon | E231: Perkins | F231: Sailboard | G231: 24.852555747472767 | H231: Neither | I231: No | J231: Neither
A232: 76 | B232: 40097.476035034721 | C232: Mr | D232: Simon | E232: Perkins | F232: Sailboard | G232: 24.463884398957504 | H232: Neither | I232: No | J232: Neither
A233: 76 | B233: 40097.59393171296 | C233: Mr | D233: Simon | E233: Perkins | F233: Sailboard | G233: 0.45890950447767204 | H233: Neither | I233: No | J233: Neither
A234: 79 | B234: 40097.453059143518 | C234: Mr | D234: Rob | E234: King | F234: Sailboard | G234: 26.489263555893967 | H234: Master | I234: Yes | J234: Neither
A235: 79 | B235: 40097.497619664355 | C235: Mr | D235: Rob | E235: King | F235: Sailboard | G235: 25.459284868370322 | H235: Master | I235: Yes | J235: Neither
A236: 79 | B236: 40097.597846863428 | C236: Mr | D236: Rob | E236: King | F236: Sailboard | G236: 25.392037445212782 | H236: Master | I236: Yes | J236: Neither
A237: 79 | B237: 40097.623664317129 | C237: Mr | D237: Rob | E237: King | F237: Sailboard | G237: 25.214636062121151 | H237: Master | I237: Yes | J237: Neither
A238: 79 | B238: 40097.467019849537 | C238: Mr | D238: Rob | E238: King | F238: Sailboard | G238: 25.046813120361591 | H238: Master | I238: Yes | J238: Neither
A239: 79 | B239: 40097.620335196756 | C239: Mr | D239: Rob | E239: King | F239: Sailboard | G239: 24.738020364189495 | H239: Master | I239: Yes | J239: Neither
A240: 79 | B240: 40097.489323819442 | C240: Mr | D240: Rob | E240: King | F240: Sailboard | G240: 24.616509868025659 | H240: Master | I240: Yes | J240: Neither
A241: 79 | B241: 40097.609869016203 | C241: Mr | D241: Rob | E241: King | F241: Sailboard | G241: 24.518906699196442 | H241: Master | I241: Yes | J241: Neither
A242: 79 | B242: 40097.614758541669 | C242: Mr | D242: Rob | E242: King | F242: Sailboard | G242: 24.513222614018211 | H242: Master | I242: Yes | J242: Neither
A243: 79 | B243: 40097.439907199077 | C243: Mr | D243: Rob | E243: King | F243: Sailboard | G243: 24.429973404419805 | H243: Master | I243: Yes | J243: Neither
A244: 79 | B244: 40097.605077986111 | C244: Mr | D244: Rob | E244: King | F244: Sailboard | G244: 24.300289631865894 | H244: Master | I244: Yes | J244: Neither
A245: 79 | B245: 40097.551888402777 | C245: Mr | D245: Rob | E245: King | F245: Sailboard | G245: 21.826523526217585 | H245: Master | I245: Yes | J245: Neither
A246: 79 | B246: 40097.563834722219 | C246: Mr | D246: Rob | E246: King | F246: Sailboard | G246: 20.567382673554921 | H246: Master | I246: Yes | J246: Neither
A247: 79 | B247: 40097.479441631942 | C247: Mr | D247: Rob | E247: King | F247: Sailboard | G247: 1.6022330841372379 | H247: Master | I247: Yes | J247: Neither
A248: 88 | B248: 40097.564774768522 | C248: Mr | D248: Richard | E248: Riddell | F248: Sailboard | G248: 23.852466401257338 | H248: Neither | I248: No | J248: Neither
A249: 88 | B249: 40097.55461428241 | C249: Mr | D249: Richard | E249: Riddell | F249: Sailboard | G249: 18.570675398903045 | H249: Neither | I249: No | J249: Neither
A250: 88 | B250: 40097.550575173613 | C250: Mr | D250: Richard | E250: Riddell | F250: Sailboard | G250: 18.461737429651503 | H250: Neither | I250: No | J250: Neither
A251: 90 | B251: 40097.620826597224 | C251: Mr | D251: ian | E251: blundell | F251: Sailboard | G251: 21.226717883476951 | H251: Neither | I251: Yes | J251: Neither
A252: 93 | B252: 40097.48315078704 | C252: Mr | D252: Richard | E252: Hobson | F252: Sailboard | G252: 26.474010393129632 | H252: Neither | I252: No | J252: Neither
A253: 93 | B253: 40097.478019456015 | C253: Mr | D253: Richard | E253: Hobson | F253: Sailboard | G253: 26.409215651017117 | H253: Neither | I253: No | J253: Neither
A254: 93 | B254: 40097.488879097225 | C254: Mr | D254: Richard | E254: Hobson | F254: Sailboard | G254: 25.95928313399919 | H254: Neither | I254: No | J254: Neither
A255: 93 | B255: 40097.557287754629 | C255: Mr | D255: Richard | E255: Hobson | F255: Sailboard | G255: 25.847605836157406 | H255: Neither | I255: No | J255: Neither
A256: 93 | B256: 40097.498729317129 | C256: Mr | D256: Richard | E256: Hobson | F256: Sailboard | G256: 25.35429069942608 | H256: Neither | I256: No | J256: Neither
A257: 93 | B257: 40097.493917511572 | C257: Mr | D257: Richard | E257: Hobson | F257: Sailboard | G257: 25.072349527505828 | H257: Neither | I257: No | J257: Neither
A258: 93 | B258: 40097.583105219906 | C258: Mr | D258: Richard | E258: Hobson | F258: Sailboard | G258: 24.791377184029788 | H258: Neither | I258: No | J258: Neither
A259: 93 | B259: 40097.56567398148 | C259: Mr | D259: Richard | E259: Hobson | F259: Sailboard | G259: 24.695268605147131 | H259: Neither | I259: No | J259: Neither
A260: 93 | B260: 40097.470007627315 | C260: Mr | D260: Richard | E260: Hobson | F260: Sailboard | G260: 24.641175590338761 | H260: Neither | I260: No | J260: Neither
A261: 93 | B261: 40097.612114502313 | C261: Mr | D261: Richard | E261: Hobson | F261: Sailboard | G261: 24.544516663054026 | H261: Neither | I261: No | J261: Neither
A262: 93 | B262: 40097.439232847224 | C262: Mr | D262: Richard | E262: Hobson | F262: Sailboard | G262: 24.515495860350963 | H262: Neither | I262: No | J262: Neither
A263: 93 | B263: 40097.49647204861 | C263: Mr | D263: Richard | E263: Hobson | F263: Sailboard | G263: 23.932361897207183 | H263: Neither | I263: No | J263: Neither
A264: 93 | B264: 40097.576058599538 | C264: Mr | D264: Richard | E264: Hobson | F264: Sailboard | G264: 23.128352358475112 | H264: Neither | I264: No | J264: Neither
A265: 93 | B265: 40097.57926515046 | C265: Mr | D265: Richard | E265: Hobson | F265: Sailboard | G265: 22.519569108016196 | H265: Neither | I265: No | J265: Neither
A266: 93 | B266: 40097.591927488429 | C266: Mr | D266: Richard | E266: Hobson | F266: Sailboard | G266: 22.352013342863277 | H266: Neither | I266: No | J266: Neither
A267: 93 | B267: 40097.596248217589 | C267: Mr | D267: Richard | E267: Hobson | F267: Sailboard | G267: 21.849975480122023 | H267: Neither | I267: No | J267: Neither
A268: 93 | B268: 40097.5700769213 | C268: Mr | D268: Richard | E268: Hobson | F268: Sailboard | G268: 21.535810999432307 | H268: Neither | I268: No | J268: Neither
A269: 95 | B269: 40097.585560671294 | C269: Mr | D269: Stephen | E269: Cronshaw | F269: Sailboard | G269: 23.587504311597876 | H269: Neither | I269: Yes | J269: Neither
A270: 95 | B270: 40097.604021747684 | C270: Mr | D270: Stephen | E270: Cronshaw | F270: Sailboard | G270: 22.974589090923846 | H270: Neither | I270: Yes | J270: Neither
A271: 95 | B271: 40097.573465949077 | C271: Mr | D271: Stephen | E271: Cronshaw | F271: Sailboard | G271: 22.561369768926205 | H271: Neither | I271: Yes | J271: Neither
A272: 95 | B272: 40097.545607870372 | C272: Mr | D272: Stephen | E272: Cronshaw | F272: Sailboard | G272: 22.423584522255407 | H272: Neither | I272: Yes | J272: Neither
A273: 95 | B273: 40097.557876006947 | C273: Mr | D273: Stephen | E273: Cronshaw | F273: Sailboard | G273: 22.358629800483413 | H273: Neither | I273: Yes | J273: Neither
A274: 95 | B274: 40097.487764976853 | C274: Mr | D274: Stephen | E274: Cronshaw | F274: Sailboard | G274: 22.194383392711629 | H274: Neither | I274: Yes | J274: Neither
A275: 95 | B275: 40097.580476076386 | C275: Mr | D275: Stephen | E275: Cronshaw | F275: Sailboard | G275: 21.723841029486813 | H275: Neither | I275: Yes | J275: Neither
A276: 95 | B276: 40097.481175347224 | C276: Mr | D276: Stephen | E276: Cronshaw | F276: Sailboard | G276: 21.599154505685529 | H276: Neither | I276: Yes | J276: Neither
A277: 95 | B277: 40097.465098206019 | C277: Mr | D277: Stephen | E277: Cronshaw | F277: Sailboard | G277: 21.338944730899957 | H277: Neither | I277: Yes | J277: Neither
A278: 95 | B278: 40097.612164212966 | C278: Mr | D278: Stephen | E278: Cronshaw | F278: Sailboard | G278: 21.0908174105877 | H278: Neither | I278: Yes | J278: Neither
A279: 95 | B279: 40097.565356157407 | C279: Mr | D279: Stephen | E279: Cronshaw | F279: Sailboard | G279: 20.922231176988277 | H279: Neither | I279: Yes | J279: Neither
A280: 95 | B280: 40097.497862314813 | C280: Mr | D280: Stephen | E280: Cronshaw | F280: Sailboard | G280: 20.319192330935415 | H280: Neither | I280: Yes | J280: Neither
A281: 97 | B281: 40097.607362442126 | C281: Mr | D281: Mike | E281: Price | F281: Sailboard | G281: 25.242926145223436 | H281: Master | I281: No | J281: Neither
A282: 97 | B282: 40097.601252916669 | C282: Mr | D282: Mike | E282: Price | F282: Sailboard | G282: 25.198413010617131 | H282: Master | I282: No | J282: Neither
A283: 97 | B283: 40097.61724028935 | C283: Mr | D283: Mike | E283: Price | F283: Sailboard | G283: 25.195411298008665 | H283: Master | I283: No | J283: Neither
A284: 97 | B284: 40097.625450624997 | C284: Mr | D284: Mike | E284: Price | F284: Sailboard | G284: 24.445221781702056 | H284: Master | I284: No | J284: Neither
A285: 99 | B285: 40097.45643204861 | C285: Mr | D285: steve | E285: franklyn | F285: Sailboard | G285: 27.114138778778567 | H285: Neither | I285: Yes | J285: Gold Fleet
A286: 99 | B286: 40097.481435127316 | C286: Mr | D286: steve | E286: franklyn | F286: Sailboard | G286: 26.513838021916619 | H286: Neither | I286: Yes | J286: Gold Fleet
A287: 99 | B287: 40097.468893634257 | C287: Mr | D287: steve | E287: franklyn | F287: Sailboard | G287: 25.784580145628443 | H287: Neither | I287: Yes | J287: Gold Fleet
A288: 99 | B288: 40097.492391400461 | C288: Mr | D288: steve | E288: franklyn | F288: Sailboard | G288: 22.670684455868855 | H288: Neither | I288: Yes | J288: Gold Fleet
A289: 101 | B289: 40097.548583807868 | C289: Mr | D289: Torix | E289: Bennett | F289: Boat | G289: 12.345039696564669 | H289: Master | I289: No | J289: Gold Fleet
A290: 102 | B290: 40097.554297847222 | C290: Mr | D290: Norman | E290: Petty | F290: Sailboard | G290: 27.411447464855549 | H290: Master | I290: No | J290: Neither
A291: 102 | B291: 40097.559828831021 | C291: Mr | D291: Norman | E291: Petty | F291: Sailboard | G291: 25.471550134861726 | H291: Master | I291: No | J291: Neither
A292: 102 | B292: 40097.48351554398 | C292: Mr | D292: Norman | E292: Petty | F292: Sailboard | G292: 25.420116039352724 | H292: Master | I292: No | J292: Neither
A293: 102 | B293: 40097.547783182868 | C293: Mr | D293: Norman | E293: Petty | F293: Sailboard | G293: 25.336673477961082 | H293: Master | I293: No | J293: Neither
A294: 102 | B294: 40097.550930671299 | C294: Mr | D294: Norman | E294: Petty | F294: Sailboard | G294: 25.302723036583838 | H294: Master | I294: No | J294: Neither
A295: 102 | B295: 40097.476480335645 | C295: Mr | D295: Norman | E295: Petty | F295: Sailboard | G295: 24.468413026695895 | H295: Master | I295: No | J295: Neither
A296: 102 | B296: 40097.480192442126 | C296: Mr | D296: Norman | E296: Petty | F296: Sailboard | G296: 23.562276463564828 | H296: Master | I296: No | J296: Neither
A297: 102 | B297: 40097.471765787035 | C297: Mr | D297: Norman | E297: Petty | F297: Sailboard | G297: 22.571001219494413 | H297: Master | I297: No | J297: Neither
A298: 102 | B298: 40097.584679421299 | C298: Mr | D298: Norman | E298: Petty | F298: Sailboard | G298: 21.994953794812787 | H298: Master | I298: No | J298: Neither
A299: 102 | B299: 40097.579846828703 | C299: Mr | D299: Norman | E299: Petty | F299: Sailboard | G299: 21.859912332832277 | H299: Master | I299: No | J299: Neither
A300: 102 | B300: 40097.626576006944 | C300: Mr | D300: Norman | E300: Petty | F300: Sailboard | G300: 3.0664631078825999 | H300: Master | I300: No | J300: Neither
A301: 104 | B301: 40097.461955358798 | C301: Mr | D301: Will | E301: Houghton | F301: Sailboard | G301: 21.529672498070745 | H301: Junior | I301: Yes | J301: Neither
A302: 104 | B302: 40097.607231550923 | C302: Mr | D302: Will | E302: Houghton | F302: Sailboard | G302: 21.219050995062513 | H302: Junior | I302: Yes | J302: Neither
A303: 104 | B303: 40097.625418680553 | C303: Mr | D303: Will | E303: Houghton | F303: Sailboard | G303: 20.957476842302441 | H303: Junior | I303: Yes | J303: Neither
A304: 104 | B304: 40097.619508750002 | C304: Mr | D304: Will | E304: Houghton | F304: Sailboard | G304: 20.858263688198523 | H304: Junior | I304: Yes | J304: Neither
A305: 104 | B305: 40097.612943541666 | C305: Mr | D305: Will | E305: Houghton | F305: Sailboard | G305: 20.792233499995685 | H305: Junior | I305: Yes | J305: Neither
A306: 104 | B306: 40097.441569872688 | C306: Mr | D306: Will | E306: Houghton | F306: Sailboard | G306: 20.211227095958165 | H306: Junior | I306: Yes | J306: Neither
A307: 104 | B307: 40097.479072337963 | C307: Mr | D307: Will | E307: Houghton | F307: Sailboard | G307: 20.190388476217805 | H307: Junior | I307: Yes | J307: Neither
A308: 104 | B308: 40097.585496145832 | C308: Mr | D308: Will | E308: Houghton | F308: Sailboard | G308: 20.178829941637936 | H308: Junior | I308: Yes | J308: Neither
A309: 104 | B309: 40097.493537337963 | C309: Mr | D309: Will | E309: Houghton | F309: Sailboard | G309: 20.050653319157693 | H309: Junior | I309: Yes | J309: Neither
A310: 104 | B310: 40097.59130915509 | C310: Mr | D310: Will | E310: Houghton | F310: Sailboard | G310: 19.699169398041278 | H310: Junior | I310: Yes | J310: Neither
A311: 104 | B311: 40097.567115706021 | C311: Mr | D311: Will | E311: Houghton | F311: Sailboard | G311: 16.017137294656038 | H311: Junior | I311: Yes | J311: Neither
A312: 104 | B312: 40097.436925624999 | C312: Mr | D312: Will | E312: Houghton | F312: Sailboard | G312: 15.164942007500825 | H312: Junior | I312: Yes | J312: Neither
A313: 104 | B313: 40097.579285335647 | C313: Mr | D313: Will | E313: Houghton | F313: Sailboard | G313: 2.3786846644431603 | H313: Junior | I313: Yes | J313: Neither
A314: 112 | B314: 40097.608139548611 | C314: Miss | D314: Emily | E314: Wood | F314: Sailboard | G314: 15.025952480751064 | H314: Neither | I314: No | J314: Neither
A315: 112 | B315: 40097.592706342592 | C315: Miss | D315: Emily | E315: Wood | F315: Sailboard | G315: 14.347272904662997 | H315: Neither | I315: No | J315: Neither
A316: 113 | B316: 40097.454890335648 | C316: Mr | D316: Rudiger | E316: Lotz | F316: Sailboard | G316: 25.401186657008804 | H316: Master | I316: No | J316: Gold Fleet
A317: 113 | B317: 40097.561499710646 | C317: Mr | D317: Rudiger | E317: Lotz | F317: Sailboard | G317: 25.254983402990803 | H317: Master | I317: No | J317: Gold Fleet
A318: 113 | B318: 40097.431370740742 | C318: Mr | D318: Rudiger | E318: Lotz | F318: Sailboard | G318: 24.818724589276346 | H318: Master | I318: No | J318: Gold Fleet
A319: 113 | B319: 40097.550702361114 | C319: Mr | D319: Rudiger | E319: Lotz | F319: Sailboard | G319: 24.514927419922515 | H319: Master | I319: No | J319: Gold Fleet
A320: 113 | B320: 40097.480550277774 | C320: Mr | D320: Rudiger | E320: Lotz | F320: Sailboard | G320: 24.3781592702138 | H320: Master | I320: No | J320: Gold Fleet
A321: 113 | B321: 40097.572099861114 | C321: Mr | D321: Rudiger | E321: Lotz | F321: Sailboard | G321: 23.684713525990432 | H321: Master | I321: No | J321: Gold Fleet
A322: 113 | B322: 40097.576570844911 | C322: Mr | D322: Rudiger | E322: Lotz | F322: Sailboard | G322: 23.504143222891003 | H322: Master | I322: No | J322: Gold Fleet
A323: 113 | B323: 40097.435188113428 | C323: Mr | D323: Rudiger | E323: Lotz | F323: Sailboard | G323: 23.491611410299889 | H323: Master | I323: No | J323: Gold Fleet
A324: 113 | B324: 40097.48601552083 | C324: Mr | D324: Rudiger | E324: Lotz | F324: Sailboard | G324: 22.352013639877185 | H324: Master | I324: No | J324: Gold Fleet
A325: 115 | B325: 40097.456523796296 | C325: Mr | D325: stephen | E325: corps | F325: Sailboard | G325: 29.544350831960099 | H325: Neither | I325: No | J325: Gold Fleet
A326: 115 | B326: 40097.46875615741 | C326: Mr | D326: stephen | E326: corps | F326: Sailboard | G326: 28.870028099265838 | H326: Neither | I326: No | J326: Gold Fleet
A327: 115 | B327: 40097.460631493057 | C327: Mr | D327: stephen | E327: corps | F327: Sailboard | G327: 28.754626546210631 | H327: Neither | I327: No | J327: Gold Fleet
A328: 115 | B328: 40097.500145208331 | C328: Mr | D328: stephen | E328: corps | F328: Sailboard | G328: 28.614569396300141 | H328: Neither | I328: No | J328: Gold Fleet
A329: 115 | B329: 40097.466251909726 | C329: Mr | D329: stephen | E329: corps | F329: Sailboard | G329: 28.055061928941104 | H329: Neither | I329: No | J329: Gold Fleet
A330: 115 | B330: 40097.597646620372 | C330: Mr | D330: stephen | E330: corps | F330: Sailboard | G330: 27.934997488511282 | H330: Neither | I330: No | J330: Gold Fleet
A331: 115 | B331: 40097.559932638891 | C331: Mr | D331: stephen | E331: corps | F331: Sailboard | G331: 27.839390008675064 | H331: Neither | I331: No | J331: Gold Fleet
A332: 115 | B332: 40097.483536203705 | C332: Mr | D332: stephen | E332: corps | F332: Sailboard | G332: 27.721887417355966 | H332: Neither | I332: No | J332: Gold Fleet
A333: 115 | B333: 40097.554702511574 | C333: Mr | D333: stephen | E333: corps | F333: Sailboard | G333: 27.063481139746138 | H333: Neither | I333: No | J333: Gold Fleet
A334: 115 | B334: 40097.489026354167 | C334: Mr | D334: stephen | E334: corps | F334: Sailboard | G334: 26.338175266634096 | H334: Neither | I334: No | J334: Gold Fleet
A335: 115 | B335: 40097.496815902778 | C335: Mr | D335: stephen | E335: corps | F335: Sailboard | G335: 26.182316558127113 | H335: Neither | I335: No | J335: Gold Fleet
A336: 115 | B336: 40097.475259502316 | C336: Mr | D336: stephen | E336: corps | F336: Sailboard | G336: 26.04495959218994 | H336: Neither | I336: No | J336: Gold Fleet
A337: 129 | B337: 40097.455160763886 | C337: Mr | D337: Tim | E337: Fricke | F337: Sailboard | G337: 28.069956981552238 | H337: Neither | I337: No | J337: Neither
A338: 129 | B338: 40097.476996550926 | C338: Mr | D338: Tim | E338: Fricke | F338: Sailboard | G338: 27.756087161776318 | H338: Neither | I338: No | J338: Neither
A339: 129 | B339: 40097.601735254633 | C339: Mr | D339: Tim | E339: Fricke | F339: Sailboard | G339: 27.53421177620287 | H339: Neither | I339: No | J339: Neither
A340: 129 | B340: 40097.482970254627 | C340: Mr | D340: Tim | E340: Fricke | F340: Sailboard | G340: 26.892790377591677 | H340: Neither | I340: No | J340: Neither
A341: 129 | B341: 40097.582717500001 | C341: Mr | D341: Tim | E341: Fricke | F341: Sailboard | G341: 26.877751926415307 | H341: Neither | I341: No | J341: Neither
A342: 129 | B342: 40097.460088703701 | C342: Mr | D342: Tim | E342: Fricke | F342: Sailboard | G342: 26.813008129805318 | H342: Neither | I342: No | J342: Neither
A343: 129 | B343: 40097.450747407405 | C343: Mr | D343: Tim | E343: Fricke | F343: Sailboard | G343: 26.716811662520321 | H343: Neither | I343: No | J343: Neither
A344: 129 | B344: 40097.471627106483 | C344: Mr | D344: Tim | E344: Fricke | F344: Sailboard | G344: 26.52447908117205 | H344: Neither | I344: No | J344: Neither
A345: 129 | B345: 40097.564899375 | C345: Mr | D345: Tim | E345: Fricke | F345: Sailboard | G345: 25.94654417384994 | H345: Neither | I345: No | J345: Neither
A346: 129 | B346: 40097.467056331021 | C346: Mr | D346: Tim | E346: Fricke | F346: Sailboard | G346: 25.874801726955436 | H346: Neither | I346: No | J346: Neither
A347: 129 | B347: 40097.568039965277 | C347: Mr | D347: Tim | E347: Fricke | F347: Sailboard | G347: 25.784579750385973 | H347: Neither | I347: No | J347: Neither
A348: 129 | B348: 40097.586699293985 | C348: Mr | D348: Tim | E348: Fricke | F348: Sailboard | G348: 25.524424756235685 | H348: Neither | I348: No | J348: Neither
A349: 129 | B349: 40097.49400810185 | C349: Mr | D349: Tim | E349: Fricke | F349: Sailboard | G349: 25.440909677575721 | H349: Neither | I349: No | J349: Neither
A350: 129 | B350: 40097.606640983795 | C350: Mr | D350: Tim | E350: Fricke | F350: Sailboard | G350: 25.290620162854385 | H350: Neither | I350: No | J350: Neither
A351: 129 | B351: 40097.496790069446 | C351: Mr | D351: Tim | E351: Fricke | F351: Sailboard | G351: 25.218845378887373 | H351: Neither | I351: No | J351: Neither
A352: 129 | B352: 40097.571052719904 | C352: Mr | D352: Tim | E352: Fricke | F352: Sailboard | G352: 24.850804028626065 | H352: Neither | I352: No | J352: Neither
A353: 129 | B353: 40097.491249444443 | C353: Mr | D353: Tim | E353: Fricke | F353: Sailboard | G353: 24.759451253127988 | H353: Neither | I353: No | J353: Neither
A354: 129 | B354: 40097.488408194447 | C354: Mr | D354: Tim | E354: Fricke | F354: Sailboard | G354: 23.691080849590289 | H354: Neither | I354: No | J354: Neither
A355: 133 | B355: 40097.443742256946 | C355: Mr | D355: Mark | E355: Briggs | F355: Sailboard | G355: 26.068716227958788 | H355: Neither | I355: Yes | J355: Neither
A356: 133 | B356: 40097.554081493057 | C356: Mr | D356: Mark | E356: Briggs | F356: Sailboard | G356: 25.811643106035799 | H356: Neither | I356: Yes | J356: Neither
A357: 133 | B357: 40097.549967210645 | C357: Mr | D357: Mark | E357: Briggs | F357: Sailboard | G357: 25.471550134861726 | H357: Neither | I357: Yes | J357: Neither
A358: 133 | B358: 40097.45880547454 | C358: Mr | D358: Mark | E358: Briggs | F358: Sailboard | G358: 25.42072684930115 | H358: Neither | I358: Yes | J358: Neither
A359: 133 | B359: 40097.604899861108 | C359: Mr | D359: Mark | E359: Briggs | F359: Sailboard | G359: 25.232686108013908 | H359: Neither | I359: Yes | J359: Neither
A360: 133 | B360: 40097.45434733796 | C360: Mr | D360: Mark | E360: Briggs | F360: Sailboard | G360: 25.06937739851918 | H360: Neither | I360: Yes | J360: Neither
A361: 133 | B361: 40097.477764768519 | C361: Mr | D361: Mark | E361: Briggs | F361: Sailboard | G361: 25.019553087880755 | H361: Neither | I361: Yes | J361: Neither
A362: 133 | B362: 40097.439577245372 | C362: Mr | D362: Mark | E362: Briggs | F362: Sailboard | G362: 24.792539512353478 | H362: Neither | I362: Yes | J362: Neither
A363: 133 | B363: 40097.608959895835 | C363: Mr | D363: Mark | E363: Briggs | F363: Sailboard | G363: 24.722982373320292 | H363: Neither | I363: Yes | J363: Neither
A364: 133 | B364: 40097.431172627315 | C364: Mr | D364: Mark | E364: Briggs | F364: Sailboard | G364: 24.721248508721963 | H364: Neither | I364: Yes | J364: Neither
A365: 133 | B365: 40097.451304328701 | C365: Mr | D365: Mark | E365: Briggs | F365: Sailboard | G365: 24.582174722166737 | H365: Neither | I365: Yes | J365: Neither
A366: 133 | B366: 40097.471050243053 | C366: Mr | D366: Mark | E366: Briggs | F366: Sailboard | G366: 24.270172341023677 | H366: Neither | I366: Yes | J366: Neither
A367: 133 | B367: 40097.620094675927 | C367: Mr | D367: Mark | E367: Briggs | F367: Sailboard | G367: 24.256810594901271 | H367: Neither | I367: Yes | J367: Neither
A368: 133 | B368: 40097.467833379633 | C368: Mr | D368: Mark | E368: Briggs | F368: Sailboard | G368: 24.240685029922918 | H368: Neither | I368: Yes | J368: Neither
A369: 133 | B369: 40097.463942199072 | C369: Mr | D369: Mark | E369: Briggs | F369: Sailboard | G369: 24.170317970367012 | H369: Neither | I369: Yes | J369: Neither
A370: 133 | B370: 40097.435050173612 | C370: Mr | D370: Mark | E370: Briggs | F370: Sailboard | G370: 24.06470824285222 | H370: Neither | I370: Yes | J370: Neither
A371: 133 | B371: 40097.474342060188 | C371: Mr | D371: Mark | E371: Briggs | F371: Sailboard | G371: 23.602772283879425 | H371: Neither | I371: Yes | J371: Neither
A372: 133 | B372: 40097.615676550929 | C372: Mr | D372: Mark | E372: Briggs | F372: Sailboard | G372: 23.573306900566902 | H372: Neither | I372: Yes | J372: Neither
A373: 133 | B373: 40097.575187349539 | C373: Mr | D373: Mark | E373: Briggs | F373: Sailboard | G373: 22.849980466671894 | H373: Neither | I373: Yes | J373: Neither
A374: 133 | B374: 40097.499211365743 | C374: Mr | D374: Mark | E374: Briggs | F374: Sailboard | G374: 22.69501222489253 | H374: Neither | I374: Yes | J374: Neither
A375: 133 | B375: 40097.545939212963 | C375: Mr | D375: Mark | E375: Briggs | F375: Sailboard | G375: 22.396039532643705 | H375: Neither | I375: Yes | J375: Neither
A376: 133 | B376: 40097.562197222222 | C376: Mr | D376: Mark | E376: Briggs | F376: Sailboard | G376: 21.72607250593688 | H376: Neither | I376: Yes | J376: Neither
A377: 133 | B377: 40097.579690243052 | C377: Mr | D377: Mark | E377: Briggs | F377: Sailboard | G377: 21.593861882421045 | H377: Neither | I377: Yes | J377: Neither
A378: 140 | B378: 40097.595178842595 | C378: Mr | D378: Steve | E378: Jones | F378: Sailboard | G378: 27.6197929005865 | H378: Neither | I378: No | J378: Gold Fleet
A379: 140 | B379: 40097.598150520833 | C379: Mr | D379: Steve | E379: Jones | F379: Sailboard | G379: 27.36038188764611 | H379: Neither | I379: No | J379: Gold Fleet
A380: 140 | B380: 40097.554888657411 | C380: Mr | D380: Steve | E380: Jones | F380: Sailboard | G380: 27.244071814919259 | H380: Neither | I380: No | J380: Gold Fleet
A381: 140 | B381: 40097.560513750002 | C381: Mr | D381: Steve | E381: Jones | F381: Sailboard | G381: 27.108577533206709 | H381: Neither | I381: No | J381: Gold Fleet
A382: 140 | B382: 40097.451839791669 | C382: Mr | D382: Steve | E382: Jones | F382: Sailboard | G382: 26.93663295062191 | H382: Neither | I382: No | J382: Gold Fleet
A383: 140 | B383: 40097.551906921297 | C383: Mr | D383: Steve | E383: Jones | F383: Sailboard | G383: 26.684450518998243 | H383: Neither | I383: No | J383: Gold Fleet
A384: 140 | B384: 40097.446797337965 | C384: Mr | D384: Steve | E384: Jones | F384: Sailboard | G384: 26.636726383207158 | H384: Neither | I384: No | J384: Gold Fleet
A385: 140 | B385: 40097.608270648147 | C385: Mr | D385: Steve | E385: Jones | F385: Sailboard | G385: 26.593184959369857 | H385: Neither | I385: No | J385: Gold Fleet
A386: 140 | B386: 40097.573011099536 | C386: Mr | D386: Steve | E386: Jones | F386: Sailboard | G386: 26.581152497357586 | H386: Neither | I386: No | J386: Gold Fleet
A387: 140 | B387: 40097.614219641204 | C387: Mr | D387: Steve | E387: Jones | F387: Sailboard | G387: 26.572468898883582 | H387: Neither | I387: No | J387: Gold Fleet
A388: 140 | B388: 40097.603468043984 | C388: Mr | D388: Steve | E388: Jones | F388: Sailboard | G388: 26.528471471605581 | H388: Neither | I388: No | J388: Gold Fleet
A389: 140 | B389: 40097.442412638891 | C389: Mr | D389: Steve | E389: Jones | F389: Sailboard | G389: 26.511843878210261 | H389: Neither | I389: No | J389: Gold Fleet
A390: 140 | B390: 40097.463266550927 | C390: Mr | D390: Steve | E390: Jones | F390: Sailboard | G390: 26.485282957009687 | H390: Neither | I390: No | J390: Gold Fleet
A391: 140 | B391: 40097.619658564814 | C391: Mr | D391: Steve | E391: Jones | F391: Sailboard | G391: 26.260992833681975 | H391: Neither | I391: No | J391: Gold Fleet
A392: 140 | B392: 40097.457213043985 | C392: Mr | D392: Steve | E392: Jones | F392: Sailboard | G392: 26.200480538485721 | H392: Neither | I392: No | J392: Gold Fleet
A393: 140 | B393: 40097.623390243054 | C393: Mr | D393: Steve | E393: Jones | F393: Sailboard | G393: 25.097341913369181 | H393: Neither | I393: No | J393: Gold Fleet
A394: 143 | B394: 40097.450629803243 | C394: Mr | D394: Charles | E394: Wilson | F394: Sailboard | G394: 25.306356081706177 | H394: Neither | I394: No | J394: Neither
A395: 143 | B395: 40097.457367083334 | C395: Mr | D395: Charles | E395: Wilson | F395: Sailboard | G395: 25.217041267914823 | H395: Neither | I395: No | J395: Neither
A396: 143 | B396: 40097.436874155093 | C396: Mr | D396: Charles | E396: Wilson | F396: Sailboard | G396: 24.707963017152537 | H396: Neither | I396: No | J396: Neither
A397: 143 | B397: 40097.483855671293 | C397: Mr | D397: Charles | E397: Wilson | F397: Sailboard | G397: 24.420382540032229 | H397: Neither | I397: No | J397: Neither
A398: 143 | B398: 40097.476284351855 | C398: Mr | D398: Charles | E398: Wilson | F398: Sailboard | G398: 24.2351291954907 | H398: Neither | I398: No | J398: Neither
A399: 143 | B399: 40097.467272037036 | C399: Mr | D399: Charles | E399: Wilson | F399: Sailboard | G399: 24.23401854367987 | H399: Neither | I399: No | J399: Neither
A400: 143 | B400: 40097.595900763888 | C400: Mr | D400: Charles | E400: Wilson | F400: Sailboard | G400: 24.100907290105155 | H400: Neither | I400: No | J400: Neither
A401: 143 | B401: 40097.57185119213 | C401: Mr | D401: Charles | E401: Wilson | F401: Sailboard | G401: 22.790883277183184 | H401: Neither | I401: No | J401: Neither
A402: 143 | B402: 40097.497725393521 | C402: Mr | D402: Charles | E402: Wilson | F402: Sailboard | G402: 22.376135193646476 | H402: Neither | I402: No | J402: Neither
A403: 143 | B403: 40097.617433043983 | C403: Mr | D403: Charles | E403: Wilson | F403: Sailboard | G403: 22.319460574688858 | H403: Neither | I403: No | J403: Neither
A404: 143 | B404: 40097.578223923614 | C404: Mr | D404: Charles | E404: Wilson | F404: Sailboard | G404: 21.480253487992165 | H404: Neither | I404: No | J404: Neither
A405: 146 | B405: 40097.549393402776 | C405: Mr | D405: Will | E405: Giles | F405: Sailboard | G405: 24.227910905506768 | H405: Junior | I405: No | J405: Neither
A406: 146 | B406: 40097.482763993059 | C406: Mr | D406: Will | E406: Giles | F406: Sailboard | G406: 23.989913378819075 | H406: Junior | I406: No | J406: Neither
A407: 146 | B407: 40097.576747106483 | C407: Mr | D407: Will | E407: Giles | F407: Sailboard | G407: 23.821838273146259 | H407: Junior | I407: No | J407: Neither
A408: 146 | B408: 40097.447340578707 | C408: Mr | D408: Will | E408: Giles | F408: Sailboard | G408: 23.615950167720381 | H408: Junior | I408: No | J408: Neither
A409: 146 | B409: 40097.555172245367 | C409: Mr | D409: Will | E409: Giles | F409: Sailboard | G409: 23.514073645342371 | H409: Junior | I409: No | J409: Neither
A410: 146 | B410: 40097.562684074073 | C410: Mr | D410: Will | E410: Giles | F410: Sailboard | G410: 23.376841188272181 | H410: Junior | I410: No | J410: Neither
A411: 146 | B411: 40097.474315300926 | C411: Mr | D411: Will | E411: Giles | F411: Sailboard | G411: 23.348967774562055 | H411: Junior | I411: No | J411: Neither
A412: 146 | B412: 40097.440483402781 | C412: Mr | D412: Will | E412: Giles | F412: Sailboard | G412: 22.481745905370058 | H412: Junior | I412: No | J412: Neither
A413: 146 | B413: 40097.491720208331 | C413: Mr | D413: Will | E413: Giles | F413: Sailboard | G413: 21.947932919978292 | H413: Junior | I413: No | J413: Neither
A414: 146 | B414: 40097.571904050928 | C414: Mr | D414: Will | E414: Giles | F414: Sailboard | G414: 21.698877423098551 | H414: Junior | I414: No | J414: Neither
A415: 146 | B415: 40097.432914386576 | C415: Mr | D415: Will | E415: Giles | F415: Sailboard | G415: 19.901970646911948 | H415: Junior | I415: No | J415: Neither
A416: 146 | B416: 40097.501414942133 | C416: Mr | D416: Will | E416: Giles | F416: Sailboard | G416: 2.3623705740505709 | H416: Junior | I416: No | J416: Neither
A417: 151 | B417: 40097.583871944444 | C417: Mr | D417: sam | E417: latham | F417: Sailboard | G417: 27.614023225202153 | H417: Neither | I417: No | J417: Neither
A418: 151 | B418: 40097.553738020833 | C418: Mr | D418: sam | E418: latham | F418: Sailboard | G418: 26.959295303411743 | H418: Neither | I418: No | J418: Neither
A419: 151 | B419: 40097.575550717593 | C419: Mr | D419: sam | E419: latham | F419: Sailboard | G419: 26.698598735384785 | H419: Neither | I419: No | J419: Neither
A420: 151 | B420: 40097.566272870368 | C420: Mr | D420: sam | E420: latham | F420: Sailboard | G420: 25.872902945019945 | H420: Neither | I420: No | J420: Neither
A421: 151 | B421: 40097.450007395833 | C421: Mr | D421: sam | E421: latham | F421: Sailboard | G421: 25.760710645474955 | H421: Neither | I421: No | J421: Neither
A422: 151 | B422: 40097.500592731485 | C422: Mr | D422: sam | E422: latham | F422: Sailboard | G422: 25.734379515423207 | H422: Neither | I422: No | J422: Neither
A423: 151 | B423: 40097.603073009261 | C423: Mr | D423: sam | E423: latham | F423: Sailboard | G423: 25.668788155922819 | H423: Neither | I423: No | J423: Neither
A424: 151 | B424: 40097.572182800926 | C424: Mr | D424: sam | E424: latham | F424: Sailboard | G424: 25.299091034450246 | H424: Neither | I424: No | J424: Neither
A425: 151 | B425: 40097.580270092592 | C425: Mr | D425: sam | E425: latham | F425: Sailboard | G425: 25.265241169962152 | H425: Neither | I425: No | J425: Neither
A426: 151 | B426: 40097.606062650462 | C426: Mr | D426: sam | E426: latham | F426: Sailboard | G426: 25.131937448039739 | H426: Neither | I426: No | J426: Neither
A427: 151 | B427: 40097.461059143519 | C427: Mr | D427: sam | E427: latham | F427: Sailboard | G427: 25.076511094094421 | H427: Neither | I427: No | J427: Neither
A428: 151 | B428: 40097.497907592595 | C428: Mr | D428: sam | E428: latham | F428: Sailboard | G428: 25.013042761082822 | H428: Neither | I428: No | J428: Neither
A429: 151 | B429: 40097.458060868055 | C429: Mr | D429: sam | E429: latham | F429: Sailboard | G429: 24.724138660445316 | H429: Neither | I429: No | J429: Neither
A430: 151 | B430: 40097.475236539351 | C430: Mr | D430: sam | E430: latham | F430: Sailboard | G430: 24.702191311304976 | H430: Neither | I430: No | J430: Neither
A431: 151 | B431: 40097.591286655093 | C431: Mr | D431: sam | E431: latham | F431: Sailboard | G431: 24.667041383423982 | H431: Neither | I431: No | J431: Neither
A432: 151 | B432: 40097.490164699077 | C432: Mr | D432: sam | E432: latham | F432: Sailboard | G432: 24.653239563997751 | H432: Neither | I432: No | J432: Neither
A433: 151 | B433: 40097.469973009262 | C433: Mr | D433: sam | E433: latham | F433: Sailboard | G433: 24.312581118416002 | H433: Neither | I433: No | J433: Neither
A434: 151 | B434: 40097.609090833335 | C434: Mr | D434: sam | E434: latham | F434: Sailboard | G434: 23.458259136549852 | H434: Neither | I434: No | J434: Neither
A435: 151 | B435: 40097.569510416666 | C435: Mr | D435: sam | E435: latham | F435: Sailboard | G435: 23.367542442547521 | H435: Neither | I435: No | J435: Neither
A436: 157 | B436: 40097.463157488426 | C436: Mr | D436: nigel | E436: spriggs | F436: Sailboard | G436: 28.348383706116696 | H436: Neither | I436: No | J436: Gold Fleet
A437: 157 | B437: 40097.5823308912 | C437: Mr | D437: nigel | E437: spriggs | F437: Sailboard | G437: 27.869472888447579 | H437: Neither | I437: No | J437: Gold Fleet
A438: 157 | B438: 40097.620731064817 | C438: Mr | D438: nigel | E438: spriggs | F438: Sailboard | G438: 26.924287758016977 | H438: Neither | I438: No | J438: Gold Fleet
A439: 157 | B439: 40097.482221018516 | C439: Mr | D439: nigel | E439: spriggs | F439: Sailboard | G439: 26.63941055846449 | H439: Neither | I439: No | J439: Gold Fleet
A440: 157 | B440: 40097.466763599536 | C440: Mr | D440: nigel | E440: spriggs | F440: Sailboard | G440: 26.625324986415183 | H440: Neither | I440: No | J440: Gold Fleet
A441: 157 | B441: 40097.552544131948 | C441: Mr | D441: nigel | E441: spriggs | F441: Sailboard | G441: 26.127975007872351 | H441: Neither | I441: No | J441: Gold Fleet
A442: 157 | B442: 40097.563926284725 | C442: Mr | D442: nigel | E442: spriggs | F442: Sailboard | G442: 26.066788072328933 | H442: Neither | I442: No | J442: Gold Fleet
A443: 157 | B443: 40097.475920324076 | C443: Mr | D443: nigel | E443: spriggs | F443: Sailboard | G443: 25.912210471842467 | H443: Neither | I443: No | J443: Gold Fleet
A444: 157 | B444: 40097.491185752318 | C444: Mr | D444: nigel | E444: spriggs | F444: Sailboard | G444: 25.668164975427388 | H444: Neither | I444: No | J444: Gold Fleet
A445: 157 | B445: 40097.578040451386 | C445: Mr | D445: nigel | E445: spriggs | F445: Sailboard | G445: 25.5176498433778 | H445: Neither | I445: No | J445: Gold Fleet
A446: 157 | B446: 40097.470471446759 | C446: Mr | D446: nigel | E446: spriggs | F446: Sailboard | G446: 25.451931761775356 | H446: Neither | I446: No | J446: Gold Fleet
A447: 157 | B447: 40097.495965289352 | C447: Mr | D447: nigel | E447: spriggs | F447: Sailboard | G447: 24.663589570404202 | H447: Neither | I447: No | J447: Gold Fleet
A448: 157 | B448: 40097.590055081018 | C448: Mr | D448: nigel | E448: spriggs | F448: Sailboard | G448: 24.41643552816625 | H448: Neither | I448: No | J448: Gold Fleet
A449: 157 | B449: 40097.488038738426 | C449: Mr | D449: nigel | E449: spriggs | F449: Sailboard | G449: 24.232907993662671 | H449: Neither | I449: No | J449: Gold Fleet
A450: 175 | B450: 40097.446929814818 | C450: Mr | D450: Robin | E450: Penna | F450: Sailboard | G450: 29.467783212304585 | H450: Master | I450: No | J450: Gold Fleet
A451: 175 | B451: 40097.454102777781 | C451: Mr | D451: Robin | E451: Penna | F451: Sailboard | G451: 28.753844527190306 | H451: Master | I451: No | J451: Gold Fleet
A452: 175 | B452: 40097.483594502315 | C452: Mr | D452: Robin | E452: Penna | F452: Sailboard | G452: 28.506574854599094 | H452: Master | I452: No | J452: Gold Fleet
A453: 175 | B453: 40097.476536805552 | C453: Mr | D453: Robin | E453: Penna | F453: Sailboard | G453: 28.485841449527292 | H453: Master | I453: No | J453: Gold Fleet
A454: 175 | B454: 40097.461916747685 | C454: Mr | D454: Robin | E454: Penna | F454: Sailboard | G454: 28.391768009708777 | H454: Master | I454: No | J454: Gold Fleet
A455: 175 | B455: 40097.479986921295 | C455: Mr | D455: Robin | E455: Penna | F455: Sailboard | G455: 28.203969059764482 | H455: Master | I455: No | J455: Gold Fleet
A456: 175 | B456: 40097.573663877316 | C456: Mr | D456: Robin | E456: Penna | F456: Sailboard | G456: 27.987491718973367 | H456: Master | I456: No | J456: Gold Fleet
A457: 175 | B457: 40097.550386215276 | C457: Mr | D457: Robin | E457: Penna | F457: Sailboard | G457: 27.951242650990647 | H457: Master | I457: No | J457: Gold Fleet
A458: 175 | B458: 40097.468917824073 | C458: Mr | D458: Robin | E458: Penna | F458: Sailboard | G458: 27.87828990279359 | H458: Master | I458: No | J458: Gold Fleet
A459: 175 | B459: 40097.450307754632 | C459: Mr | D459: Robin | E459: Penna | F459: Sailboard | G459: 27.870941772624668 | H459: Master | I459: No | J459: Gold Fleet
A460: 175 | B460: 40097.620354456019 | C460: Mr | D460: Robin | E460: Penna | F460: Sailboard | G460: 27.604651792769815 | H460: Master | I460: No | J460: Gold Fleet
A461: 175 | B461: 40097.465282800928 | C461: Mr | D461: Robin | E461: Penna | F461: Sailboard | G461: 27.483402605423127 | H461: Master | I461: No | J461: Gold Fleet
A462: 175 | B462: 40097.609621365744 | C462: Mr | D462: Robin | E462: Penna | F462: Sailboard | G462: 27.386600027794906 | H462: Master | I462: No | J462: Gold Fleet
A463: 175 | B463: 40097.472810335646 | C463: Mr | D463: Robin | E463: Penna | F463: Sailboard | G463: 27.190830800920867 | H463: Master | I463: No | J463: Gold Fleet
A464: 175 | B464: 40097.614243344906 | C464: Mr | D464: Robin | E464: Penna | F464: Sailboard | G464: 26.913323988457279 | H464: Master | I464: No | J464: Gold Fleet
A465: 175 | B465: 40097.558885196762 | C465: Mr | D465: Robin | E465: Penna | F465: Sailboard | G465: 26.800775540170093 | H465: Master | I465: No | J465: Gold Fleet
A466: 175 | B466: 40097.565003715281 | C466: Mr | D466: Robin | E466: Penna | F466: Sailboard | G466: 26.216719746435693 | H466: Master | I466: No | J466: Gold Fleet
A467: 181 | B467: 40097.553996134258 | C467: Mr | D467: Peter | E467: Martin | F467: Sailboard | G467: 28.486608958517195 | H467: Neither | I467: No | J467: Neither
A468: 181 | B468: 40097.599217025461 | C468: Mr | D468: Peter | E468: Martin | F468: Sailboard | G468: 27.09954640995711 | H468: Neither | I468: No | J468: Neither
A469: 181 | B469: 40097.558016354167 | C469: Mr | D469: Peter | E469: Martin | F469: Sailboard | G469: 26.537126333426013 | H469: Neither | I469: No | J469: Neither
A470: 181 | B470: 40097.60615078704 | C470: Mr | D470: Peter | E470: Martin | F470: Sailboard | G470: 25.368280157965366 | H470: Neither | I470: No | J470: Neither
A471: 181 | B471: 40097.624093321756 | C471: Mr | D471: Peter | E471: Martin | F471: Sailboard | G471: 24.960495906745546 | H471: Neither | I471: No | J471: Neither
A472: 181 | B472: 40097.619286006942 | C472: Mr | D472: Peter | E472: Martin | F472: Sailboard | G472: 24.886479632315481 | H472: Neither | I472: No | J472: Neither
A473: 181 | B473: 40097.611925821759 | C473: Mr | D473: Peter | E473: Martin | F473: Sailboard | G473: 24.110798634564645 | H473: Neither | I473: No | J473: Neither
A474: 181 | B474: 40097.477890856484 | C474: Mr | D474: Peter | E474: Martin | F474: Sailboard | G474: 21.994038975765879 | H474: Neither | I474: No | J474: Neither
A475: 181 | B475: 40097.594044942132 | C475: Mr | D475: Peter | E475: Martin | F475: Sailboard | G475: 1.9441554128306966 | H475: Neither | I475: No | J475: Neither
A476: 203 | B476: 40097.447481400464 | C476: Mr | D476: Dave | E476: Standing | F476: Sailboard | G476: 27.6913977539607 | H476: Master | I476: No | J476: Gold Fleet
A477: 203 | B477: 40097.454843865744 | C477: Mr | D477: Dave | E477: Standing | F477: Sailboard | G477: 26.898946912112329 | H477: Master | I477: No | J477: Gold Fleet
A478: 203 | B478: 40097.574521805553 | C478: Mr | D478: Dave | E478: Standing | F478: Sailboard | G478: 26.623314037898311 | H478: Master | I478: No | J478: Gold Fleet
A479: 203 | B479: 40097.442884791664 | C479: Mr | D479: Dave | E479: Standing | F479: Sailboard | G479: 26.440251448289469 | H479: Master | I479: No | J479: Gold Fleet
A480: 203 | B480: 40097.561781053242 | C480: Mr | D480: Dave | E480: Standing | F480: Sailboard | G480: 26.431659650768299 | H480: Master | I480: No | J480: Gold Fleet
A481: 203 | B481: 40097.48558226852 | C481: Mr | D481: Dave | E481: Standing | F481: Sailboard | G481: 25.995019584365401 | H481: Master | I481: No | J481: Gold Fleet
A482: 203 | B482: 40097.451392164352 | C482: Mr | D482: Dave | E482: Standing | F482: Sailboard | G482: 25.987992182761857 | H482: Master | I482: No | J482: Gold Fleet
A483: 203 | B483: 40097.433711493053 | C483: Mr | D483: Dave | E483: Standing | F483: Sailboard | G483: 25.898249220329603 | H483: Master | I483: No | J483: Gold Fleet
A484: 203 | B484: 40097.431027557868 | C484: Mr | D484: Dave | E484: Standing | F484: Sailboard | G484: 25.862145526544516 | H484: Master | I484: No | J484: Gold Fleet
A485: 203 | B485: 40097.584522245372 | C485: Mr | D485: Dave | E485: Standing | F485: Sailboard | G485: 25.862145526544516 | H485: Master | I485: No | J485: Gold Fleet
A486: 203 | B486: 40097.549000231484 | C486: Mr | D486: Dave | E486: Standing | F486: Sailboard | G486: 25.829927273435814 | H486: Master | I486: No | J486: Gold Fleet
A487: 203 | B487: 40097.578308356482 | C487: Mr | D487: Dave | E487: Standing | F487: Sailboard | G487: 25.716855837228035 | H487: Master | I487: No | J487: Gold Fleet
A488: 203 | B488: 40097.436201574077 | C488: Mr | D488: Dave | E488: Standing | F488: Sailboard | G488: 25.577519740665171 | H488: Master | I488: No | J488: Gold Fleet
A489: 203 | B489: 40097.496890798611 | C489: Mr | D489: Dave | E489: Standing | F489: Sailboard | G489: 25.39264728982954 | H489: Master | I489: No | J489: Gold Fleet
A490: 203 | B490: 40097.440309178244 | C490: Mr | D490: Dave | E490: Standing | F490: Sailboard | G490: 25.09317268187597 | H490: Master | I490: No | J490: Gold Fleet
A491: 203 | B491: 40097.491881388887 | C491: Mr | D491: Dave | E491: Standing | F491: Sailboard | G491: 25.021921218255176 | H491: Master | I491: No | J491: Gold Fleet
A492: 203 | B492: 40097.622782881946 | C492: Mr | D492: Dave | E492: Standing | F492: Sailboard | G492: 24.55876707301411 | H492: Master | I492: No | J492: Gold Fleet
A493: 203 | B493: 40097.571372650462 | C493: Mr | D493: Dave | E493: Standing | F493: Sailboard | G493: 24.312581118416002 | H493: Master | I493: No | J493: Gold Fleet
A494: 203 | B494: 40097.588967476855 | C494: Mr | D494: Dave | E494: Standing | F494: Sailboard | G494: 23.533959355701665 | H494: Master | I494: No | J494: Gold Fleet
A495: 206 | B495: 40097.585763055555 | C495: Mr | D495: martin | E495: allman | F495: Sailboard | G495: 22.14233317006283 | H495: Master | I495: No | J495: Neither
A496: 206 | B496: 40097.566431736108 | C496: Mr | D496: martin | E496: allman | F496: Sailboard | G496: 21.449753798355584 | H496: Master | I496: No | J496: Neither
A497: 206 | B497: 40097.622574479166 | C497: Mr | D497: martin | E497: allman | F497: Sailboard | G497: 21.14226257113091 | H497: Master | I497: No | J497: Neither
A498: 206 | B498: 40097.591777048612 | C498: Mr | D498: martin | E498: allman | F498: Sailboard | G498: 21.133389201458854 | H498: Master | I498: No | J498: Neither
A499: 206 | B499: 40097.597437569442 | C499: Mr | D499: martin | E499: allman | F499: Sailboard | G499: 21.04674103909888 | H499: Master | I499: No | J499: Neither
A500: 206 | B500: 40097.60327871528 | C500: Mr | D500: martin | E500: allman | F500: Sailboard | G500: 20.37243105033934 | H500: Master | I500: No | J500: Neither
A501: 206 | B501: 40097.485837314816 | C501: Mr | D501: martin | E501: allman | F501: Sailboard | G501: 20.358703138631437 | H501: Master | I501: No | J501: Neither
A502: 206 | B502: 40097.580201400466 | C502: Mr | D502: martin | E502: allman | F502: Sailboard | G502: 20.343036909309227 | H502: Master | I502: No | J502: Neither
A503: 206 | B503: 40097.469918946757 | C503: Mr | D503: martin | E503: allman | F503: Sailboard | G503: 20.056357755279421 | H503: Master | I503: No | J503: Neither
A504: 206 | B504: 40097.574959606478 | C504: Mr | D504: martin | E504: allman | F504: Sailboard | G504: 19.815448456691755 | H504: Master | I504: No | J504: Neither
A505: 206 | B505: 40097.496617048608 | C505: Mr | D505: martin | E505: allman | F505: Sailboard | G505: 19.372209262457584 | H505: Master | I505: No | J505: Neither
A506: 206 | B506: 40097.489971030096 | C506: Mr | D506: martin | E506: allman | F506: Sailboard | G506: 19.150136606352682 | H506: Master | I506: No | J506: Neither
A507: 210 | B507: 40097.610305150461 | C507: Mr | D507: Gavin | E507: Nicholson | F507: Sailboard | G507: 25.242925766412181 | H507: Neither | I507: Yes | J507: Neither
A508: 210 | B508: 40097.621531863428 | C508: Mr | D508: Gavin | E508: Nicholson | F508: Sailboard | G508: 25.047406494895874 | H508: Neither | I508: Yes | J508: Neither
A509: 210 | B509: 40097.550055347223 | C509: Mr | D509: Gavin | E509: Nicholson | F509: Sailboard | G509: 24.963441902668219 | H509: Neither | I509: Yes | J509: Neither
A510: 210 | B510: 40097.60581400463 | C510: Mr | D510: Gavin | E510: Nicholson | F510: Sailboard | G510: 24.538251176419912 | H510: Neither | I510: Yes | J510: Neither
A511: 210 | B511: 40097.447174872686 | C511: Mr | D511: Gavin | E511: Nicholson | F511: Sailboard | G511: 23.931820177098626 | H511: Neither | I511: Yes | J511: Neither
A512: 210 | B512: 40097.441617488425 | C512: Mr | D512: Gavin | E512: Nicholson | F512: Sailboard | G512: 23.733086458475864 | H512: Neither | I512: Yes | J512: Neither
A513: 210 | B513: 40097.597274525462 | C513: Mr | D513: Gavin | E513: Nicholson | F513: Sailboard | G513: 22.910378108256008 | H513: Neither | I513: Yes | J513: Neither
A514: 210 | B514: 40097.553540370369 | C514: Mr | D514: Gavin | E514: Nicholson | F514: Sailboard | G514: 22.541651498661153 | H514: Neither | I514: Yes | J514: Neither
A515: 248 | B515: 40097.583388969906 | C515: Mr | D515: MArcus | E515: Partridge | F515: Sailboard | G515: 23.009583132994138 | H515: Neither | I515: No | J515: Neither
A516: 248 | B516: 40097.619394965281 | C516: Mr | D516: MArcus | E516: Partridge | F516: Sailboard | G516: 22.487004788801798 | H516: Neither | I516: No | J516: Neither
A517: 248 | B517: 40097.560228159724 | C517: Mr | D517: MArcus | E517: Partridge | F517: Sailboard | G517: 22.373294731954136 | H517: Neither | I517: No | J517: Neither
A518: 248 | B518: 40097.572855659724 | C518: Mr | D518: MArcus | E518: Partridge | F518: Sailboard | G518: 22.263540834269232 | H518: Neither | I518: No | J518: Neither
A519: 248 | B519: 40097.596602951387 | C519: Mr | D519: MArcus | E519: Partridge | F519: Sailboard | G519: 22.158572820521243 | H519: Neither | I519: No | J519: Neither
A520: 248 | B520: 40097.613545300926 | C520: Mr | D520: MArcus | E520: Partridge | F520: Sailboard | G520: 22.014643853153547 | H520: Neither | I520: No | J520: Neither
A521: 248 | B521: 40097.441772743055 | C521: Mr | D521: MArcus | E521: Partridge | F521: Sailboard | G521: 21.908372173217256 | H521: Neither | I521: No | J521: Neither
A522: 248 | B522: 40097.467590138891 | C522: Mr | D522: MArcus | E522: Partridge | F522: Sailboard | G522: 21.087452659546354 | H522: Neither | I522: No | J522: Neither
A523: 248 | B523: 40097.607259317127 | C523: Mr | D523: MArcus | E523: Partridge | F523: Sailboard | G523: 20.867731193182344 | H523: Neither | I523: No | J523: Neither
A524: 248 | B524: 40097.478743136577 | C524: Mr | D524: MArcus | E524: Partridge | F524: Sailboard | G524: 20.806552245676258 | H524: Neither | I524: No | J524: Neither
A525: 248 | B525: 40097.459837442133 | C525: Mr | D525: MArcus | E525: Partridge | F525: Sailboard | G525: 20.642058894031262 | H525: Neither | I525: No | J525: Neither
A526: 248 | B526: 40097.493065000002 | C526: Mr | D526: MArcus | E526: Partridge | F526: Sailboard | G526: 19.555273205105212 | H526: Neither | I526: No | J526: Neither
A527: 292 | B527: 40097.547228611111 | C527: Mr | D527: Nic | E527: Dodd | F527: Sailboard | G527: 25.934453457080959 | H527: Neither | I527: No | J527: Neither
A528: 292 | B528: 40097.601865138888 | C528: Mr | D528: Nic | E528: Dodd | F528: Sailboard | G528: 25.824250310216136 | H528: Neither | I528: No | J528: Neither
A529: 292 | B529: 40097.594567824075 | C529: Mr | D529: Nic | E529: Dodd | F529: Sailboard | G529: 25.140900149254961 | H529: Neither | I529: No | J529: Neither
A530: 292 | B530: 40097.554480405095 | C530: Mr | D530: Nic | E530: Dodd | F530: Sailboard | G530: 24.935774821401864 | H530: Neither | I530: No | J530: Neither
A531: 292 | B531: 40097.620639918983 | C531: Mr | D531: Nic | E531: Dodd | F531: Sailboard | G531: 24.917559649135598 | H531: Neither | I531: No | J531: Neither
A532: 292 | B532: 40097.612612662037 | C532: Mr | D532: Nic | E532: Dodd | F532: Sailboard | G532: 24.512654636213568 | H532: Neither | I532: No | J532: Neither
A533: 292 | B533: 40097.580662997687 | C533: Mr | D533: Nic | E533: Dodd | F533: Sailboard | G533: 24.301964947957025 | H533: Neither | I533: No | J533: Neither
A534: 292 | B534: 40097.442078252316 | C534: Mr | D534: Nic | E534: Dodd | F534: Sailboard | G534: 23.939405128231503 | H534: Neither | I534: No | J534: Neither
A535: 292 | B535: 40097.480864097219 | C535: Mr | D535: Nic | E535: Dodd | F535: Sailboard | G535: 23.25551253489235 | H535: Neither | I535: No | J535: Neither
A536: 292 | B536: 40097.451769803243 | C536: Mr | D536: Nic | E536: Dodd | F536: Sailboard | G536: 23.255000701258997 | H536: Neither | I536: No | J536: Neither
A537: 292 | B537: 40097.465796608798 | C537: Mr | D537: Nic | E537: Dodd | F537: Sailboard | G537: 23.180065181284402 | H537: Neither | I537: No | J537: Neither
A538: 292 | B538: 40097.459321041664 | C538: Mr | D538: Nic | E538: Dodd | F538: Sailboard | G538: 23.085938558603186 | H538: Neither | I538: No | J538: Neither
A539: 292 | B539: 40097.498388067128 | C539: Mr | D539: Nic | E539: Dodd | F539: Sailboard | G539: 22.263072323106602 | H539: Neither | I539: No | J539: Neither
A540: 292 | B540: 40097.490919305557 | C540: Mr | D540: Nic | E540: Dodd | F540: Sailboard | G540: 22.10992546586554 | H540: Neither | I540: No | J540: Neither
A541: 328 | B541: 40097.556147569441 | C541: Mr | D541: Adrian | E541: Wallis | F541: Sailboard | G541: 28.048364872568939 | H541: Master | I541: No | J541: Gold Fleet
A542: 328 | B542: 40097.60051827546 | C542: Mr | D542: Adrian | E542: Wallis | F542: Sailboard | G542: 27.079421759423052 | H542: Master | I542: No | J542: Gold Fleet
A543: 328 | B543: 40097.621825798611 | C543: Mr | D543: Adrian | E543: Wallis | F543: Sailboard | G543: 26.924973424895661 | H543: Master | I543: No | J543: Gold Fleet
A544: 328 | B544: 40097.456044606479 | C544: Mr | D544: Adrian | E544: Wallis | F544: Sailboard | G544: 26.74181034037256 | H544: Master | I544: No | J544: Gold Fleet
A545: 328 | B545: 40097.604831631943 | C545: Mr | D545: Adrian | E545: Wallis | F545: Sailboard | G545: 26.218670147523536 | H545: Master | I545: No | J545: Gold Fleet
A546: 328 | B546: 40097.466179895833 | C546: Mr | D546: Adrian | E546: Wallis | F546: Sailboard | G546: 26.021246216233685 | H546: Master | I546: No | J546: Gold Fleet
A547: 328 | B547: 40097.610340416664 | C547: Mr | D547: Adrian | E547: Wallis | F547: Sailboard | G547: 25.997575982036114 | H547: Master | I547: No | J547: Gold Fleet
A548: 328 | B548: 40097.461567175924 | C548: Mr | D548: Adrian | E548: Wallis | F548: Sailboard | G548: 25.931909457680046 | H548: Master | I548: No | J548: Gold Fleet
A549: 328 | B549: 40097.486240034719 | C549: Mr | D549: Adrian | E549: Wallis | F549: Sailboard | G549: 25.913480677005371 | H549: Master | I549: No | J549: Gold Fleet
A550: 328 | B550: 40097.481588888892 | C550: Mr | D550: Adrian | E550: Wallis | F550: Sailboard | G550: 25.827403738375192 | H550: Master | I550: No | J550: Gold Fleet
A551: 328 | B551: 40097.47310909722 | C551: Mr | D551: Adrian | E551: Wallis | F551: Sailboard | G551: 25.283363766525909 | H551: Master | I551: No | J551: Gold Fleet
A552: 328 | B552: 40097.56083195602 | C552: Mr | D552: Adrian | E552: Wallis | F552: Sailboard | G552: 25.133729401907345 | H552: Master | I552: No | J552: Gold Fleet
A553: 328 | B553: 40097.443140312498 | C553: Mr | D553: Adrian | E553: Wallis | F553: Sailboard | G553: 24.825134142815848 | H553: Master | I553: No | J553: Gold Fleet
A554: 328 | B554: 40097.494380636577 | C554: Mr | D554: Adrian | E554: Wallis | F554: Sailboard | G554: 24.480308388288105 | H554: Master | I554: No | J554: Gold Fleet
A555: 328 | B555: 40097.574287951385 | C555: Mr | D555: Adrian | E555: Wallis | F555: Sailboard | G555: 24.20960679697529 | H555: Master | I555: No | J555: Gold Fleet
A556: 328 | B556: 40097.552061423608 | C556: Mr | D556: Adrian | E556: Wallis | F556: Sailboard | G556: 2.0269843890087071 | H556: Master | I556: No | J556: Gold Fleet
A557: 329 | B557: 40097.482491435185 | C557: Mr | D557: Mark | E557: Collins | F557: Sailboard | G557: 25.303934189477808 | H557: Master | I557: No | J557: Neither
A558: 329 | B558: 40097.600241122687 | C558: Mr | D558: Mark | E558: Collins | F558: Sailboard | G558: 24.53939024804891 | H558: Master | I558: No | J558: Neither
A559: 329 | B559: 40097.5932393287 | C559: Mr | D559: Mark | E559: Collins | F559: Sailboard | G559: 23.986104623223415 | H559: Master | I559: No | J559: Neither
A560: 329 | B560: 40097.607378275461 | C560: Mr | D560: Mark | E560: Collins | F560: Sailboard | G560: 23.497875973985863 | H560: Master | I560: No | J560: Neither
A561: 329 | B561: 40097.465138020831 | C561: Mr | D561: Mark | E561: Collins | F561: Sailboard | G561: 23.33505630275106 | H561: Master | I561: No | J561: Neither
A562: 329 | B562: 40097.477615439813 | C562: Mr | D562: Mark | E562: Collins | F562: Sailboard | G562: 23.07636638896486 | H562: Master | I562: No | J562: Neither
A563: 329 | B563: 40097.619174814812 | C563: Mr | D563: Mark | E563: Collins | F563: Sailboard | G563: 22.319460574688858 | H563: Master | I563: No | J563: Neither
A564: 329 | B564: 40097.557055949073 | C564: Mr | D564: Mark | E564: Collins | F564: Sailboard | G564: 21.921088909983045 | H564: Master | I564: No | J564: Neither
A565: 329 | B565: 40097.579152303239 | C565: Mr | D565: Mark | E565: Collins | F565: Sailboard | G565: 4.141054535033474 | H565: Master | I565: No | J565: Neither
A566: 330 | B566: 40097.483101064812 | C566: Mr | D566: ALISTAIR | E566: WILLIAMS | F566: Sailboard | G566: 23.710736114313193 | H566: Master | I566: No | J566: Neither
A567: 330 | B567: 40097.621386886574 | C567: Mr | D567: ALISTAIR | E567: WILLIAMS | F567: Sailboard | G567: 22.769781163935352 | H567: Master | I567: No | J567: Neither
A568: 330 | B568: 40097.609349745369 | C568: Mr | D568: ALISTAIR | E568: WILLIAMS | F568: Sailboard | G568: 22.651744996869333 | H568: Master | I568: No | J568: Neither
A569: 330 | B569: 40097.597216215276 | C569: Mr | D569: ALISTAIR | E569: WILLIAMS | F569: Sailboard | G569: 22.600910589296632 | H569: Master | I569: No | J569: Neither
A570: 330 | B570: 40097.489521006944 | C570: Mr | D570: ALISTAIR | E570: WILLIAMS | F570: Sailboard | G570: 19.256148579153479 | H570: Master | I570: No | J570: Neither
A571: 330 | B571: 40097.581013124996 | C571: Mr | D571: ALISTAIR | E571: WILLIAMS | F571: Sailboard | G571: 19.083437031699862 | H571: Master | I571: No | J571: Neither
A572: 343 | B572: 40097.499604641205 | C572: Mr | D572: andrew | E572: robinson | F572: Sailboard | G572: 21.489420315587349 | H572: Junior | I572: No | J572: Neither
A573: 343 | B573: 40097.481913842596 | C573: Mr | D573: andrew | E573: robinson | F573: Sailboard | G573: 20.849627314805655 | H573: Junior | I573: No | J573: Neither
A574: 343 | B574: 40097.472105636574 | C574: Mr | D574: andrew | E574: robinson | F574: Sailboard | G574: 20.55059483119712 | H574: Junior | I574: No | J574: Neither
A575: 343 | B575: 40097.457679259256 | C575: Mr | D575: andrew | E575: robinson | F575: Sailboard | G575: 20.324269427268831 | H575: Junior | I575: No | J575: Neither
A576: 343 | B576: 40097.492568969908 | C576: Mr | D576: andrew | E576: robinson | F576: Sailboard | G576: 20.219729268434016 | H576: Junior | I576: No | J576: Neither
A577: 343 | B577: 40097.574208518519 | C577: Mr | D577: andrew | E577: robinson | F577: Sailboard | G577: 20.031661865871236 | H577: Junior | I577: No | J577: Neither
A578: 343 | B578: 40097.567857800925 | C578: Mr | D578: andrew | E578: robinson | F578: Sailboard | G578: 18.770771403835695 | H578: Junior | I578: No | J578: Neither
A579: 349 | B579: 40097.463558993055 | C579: Mr | D579: Bruno | E579: Warner | F579: Sailboard | G579: 21.912004020786345 | H579: Master | I579: No | J579: Neither
A580: 349 | B580: 40097.475460486108 | C580: Mr | D580: Bruno | E580: Warner | F580: Sailboard | G580: 21.344113387995421 | H580: Master | I580: No | J580: Neither
A581: 353 | B581: 40097.452532094911 | C581: Mr | D581: paul | E581: robinson | F581: Sailboard | G581: 24.054854327270647 | H581: Master | I581: No | J581: Neither
A582: 353 | B582: 40097.48878028935 | C582: Mr | D582: paul | E582: robinson | F582: Sailboard | G582: 22.988073964513649 | H582: Master | I582: No | J582: Neither
A583: 353 | B583: 40097.562545381945 | C583: Mr | D583: paul | E583: robinson | F583: Sailboard | G583: 22.642529430521943 | H583: Master | I583: No | J583: Neither
A584: 353 | B584: 40097.439166111108 | C584: Mr | D584: paul | E584: robinson | F584: Sailboard | G584: 22.620249354176039 | H584: Master | I584: No | J584: Neither
A585: 353 | B585: 40097.434462766207 | C585: Mr | D585: paul | E585: robinson | F585: Sailboard | G585: 22.212565745657781 | H585: Master | I585: No | J585: Neither
A586: 353 | B586: 40097.467224178239 | C586: Mr | D586: paul | E586: robinson | F586: Sailboard | G586: 22.202771728037707 | H586: Master | I586: No | J586: Neither
A587: 353 | B587: 40097.485291747682 | C587: Mr | D587: paul | E587: robinson | F587: Sailboard | G587: 22.097912450251457 | H587: Master | I587: No | J587: Neither
A588: 353 | B588: 40097.494534224534 | C588: Mr | D588: paul | E588: robinson | F588: Sailboard | G588: 21.6199099700662 | H588: Master | I588: No | J588: Neither
A589: 358 | B589: 40097.478261724536 | C589: Mr | D589: Gerard | E589: Northwood | F589: Sailboard | G589: 26.779057056263156 | H589: Master | I589: No | J589: Gold Fleet
A590: 358 | B590: 40097.447656747689 | C590: Mr | D590: Gerard | E590: Northwood | F590: Sailboard | G590: 26.481966427093035 | H590: Master | I590: No | J590: Gold Fleet
A591: 358 | B591: 40097.441257847226 | C591: Mr | D591: Gerard | E591: Northwood | F591: Sailboard | G591: 26.087366545855858 | H591: Master | I591: No | J591: Gold Fleet
A592: 358 | B592: 40097.466380879632 | C592: Mr | D592: Gerard | E592: Northwood | F592: Sailboard | G592: 25.966295015681517 | H592: Master | I592: No | J592: Gold Fleet
A593: 358 | B593: 40097.559266805554 | C593: Mr | D593: Gerard | E593: Northwood | F593: Sailboard | G593: 25.746911732482317 | H593: Master | I593: No | J593: Gold Fleet
A594: 358 | B594: 40097.488999513887 | C594: Mr | D594: Gerard | E594: Northwood | F594: Sailboard | G594: 25.544155475034472 | H594: Master | I594: No | J594: Gold Fleet
A595: 358 | B595: 40097.547661817131 | C595: Mr | D595: Gerard | E595: Northwood | F595: Sailboard | G595: 25.429285500443729 | H595: Master | I595: No | J595: Gold Fleet
A596: 358 | B596: 40097.485883506946 | C596: Mr | D596: Gerard | E596: Northwood | F596: Sailboard | G596: 25.381676481627384 | H596: Master | I596: No | J596: Gold Fleet
A597: 358 | B597: 40097.581430937498 | C597: Mr | D597: Gerard | E597: Northwood | F597: Sailboard | G597: 25.007127660927015 | H597: Master | I597: No | J597: Gold Fleet
A598: 358 | B598: 40097.556234768519 | C598: Mr | D598: Gerard | E598: Northwood | F598: Sailboard | G598: 24.615363625822908 | H598: Master | I598: No | J598: Gold Fleet
A599: 358 | B599: 40097.56418912037 | C599: Mr | D599: Gerard | E599: Northwood | F599: Sailboard | G599: 24.347848417933097 | H599: Master | I599: No | J599: Gold Fleet
A600: 358 | B600: 40097.573279675926 | C600: Mr | D600: Gerard | E600: Northwood | F600: Sailboard | G600: 24.007887350343882 | H600: Master | I600: No | J600: Gold Fleet
A601: 358 | B601: 40097.611600416669 | C601: Mr | D601: Gerard | E601: Northwood | F601: Sailboard | G601: 23.046692647583164 | H601: Master | I601: No | J601: Gold Fleet
A602: 358 | B602: 40097.615967800928 | C602: Mr | D602: Gerard | E602: Northwood | F602: Sailboard | G602: 22.663881743158967 | H602: Master | I602: No | J602: Gold Fleet
A603: 358 | B603: 40097.6202131713 | C603: Mr | D603: Gerard | E603: Northwood | F603: Sailboard | G603: 22.533005197599721 | H603: Master | I603: No | J603: Gold Fleet
A604: 420 | B604: 40097.545346435189 | C604: Mr | D604: Chris | E604: Etchells | F604: Sailboard | G604: 24.428280393301318 | H604: Neither | I604: Yes | J604: Neither
A605: 420 | B605: 40097.583589398149 | C605: Mr | D605: Chris | E605: Etchells | F605: Sailboard | G605: 24.357943539353123 | H605: Neither | I605: Yes | J605: Neither
A606: 420 | B606: 40097.550997372688 | C606: Mr | D606: Chris | E606: Etchells | F606: Sailboard | G606: 24.171422790888617 | H606: Neither | I606: Yes | J606: Neither
A607: 420 | B607: 40097.480418796295 | C607: Mr | D607: Chris | E607: Etchells | F607: Sailboard | G607: 23.744277774178073 | H607: Neither | I607: Yes | J607: Neither
A608: 420 | B608: 40097.495328263889 | C608: Mr | D608: Chris | E608: Etchells | F608: Sailboard | G608: 23.614895541398457 | H608: Neither | I608: Yes | J608: Neither
A609: 420 | B609: 40097.460446331017 | C609: Mr | D609: Chris | E609: Etchells | F609: Sailboard | G609: 23.445256602349502 | H609: Neither | I609: Yes | J609: Neither
A610: 420 | B610: 40097.47450582176 | C610: Mr | D610: Chris | E610: Etchells | F610: Sailboard | G610: 23.402708970071679 | H610: Neither | I610: Yes | J610: Neither
A611: 420 | B611: 40097.576160069446 | C611: Mr | D611: Chris | E611: Etchells | F611: Sailboard | G611: 23.346390168784854 | H611: Neither | I611: Yes | J611: Neither
A612: 420 | B612: 40097.591414421295 | C612: Mr | D612: Chris | E612: Etchells | F612: Sailboard | G612: 23.292394187779042 | H612: Neither | I612: Yes | J612: Neither
A613: 420 | B613: 40097.558770497686 | C613: Mr | D613: Chris | E613: Etchells | F613: Sailboard | G613: 23.222826509177409 | H613: Neither | I613: Yes | J613: Neither
A614: 420 | B614: 40097.489755416667 | C614: Mr | D614: Chris | E614: Etchells | F614: Sailboard | G614: 23.171430430832093 | H614: Neither | I614: Yes | J614: Neither
A615: 420 | B615: 40097.615412245374 | C615: Mr | D615: Chris | E615: Etchells | F615: Sailboard | G615: 23.078884394640625 | H615: Neither | I615: Yes | J615: Neither
A616: 420 | B616: 40097.565258055554 | C616: Mr | D616: Chris | E616: Etchells | F616: Sailboard | G616: 23.071834856768838 | H616: Neither | I616: Yes | J616: Neither
A617: 420 | B617: 40097.62259540509 | C617: Mr | D617: Chris | E617: Etchells | F617: Sailboard | G617: 22.452627698348508 | H617: Neither | I617: Yes | J617: Neither
A618: 425 | B618: 40097.457848495367 | C618: Mr | D618: Sam | E618: Jenkins | F618: Sailboard | G618: 23.00507778889197 | H618: Junior | I618: No | J618: Gold Fleet
A619: 425 | B619: 40097.604253564816 | C619: Mr | D619: Sam | E619: Jenkins | F619: Sailboard | G619: 22.659511053159004 | H619: Junior | I619: No | J619: Gold Fleet
A620: 425 | B620: 40097.623294282406 | C620: Mr | D620: Sam | E620: Jenkins | F620: Sailboard | G620: 22.525325598837238 | H620: Junior | I620: No | J620: Gold Fleet
A621: 425 | B621: 40097.609603194447 | C621: Mr | D621: Sam | E621: Jenkins | F621: Sailboard | G621: 22.521487309814209 | H621: Junior | I621: No | J621: Gold Fleet
A622: 425 | B622: 40097.446370729165 | C622: Mr | D622: Sam | E622: Jenkins | F622: Sailboard | G622: 22.425962376327366 | H622: Junior | I622: No | J622: Gold Fleet
A623: 425 | B623: 40097.616827025464 | C623: Mr | D623: Sam | E623: Jenkins | F623: Sailboard | G623: 22.414078743700522 | H623: Junior | I623: No | J623: Gold Fleet
A624: 425 | B624: 40097.561165960651 | C624: Mr | D624: Sam | E624: Jenkins | F624: Sailboard | G624: 22.347761803626145 | H624: Junior | I624: No | J624: Gold Fleet
A625: 425 | B625: 40097.613653437496 | C625: Mr | D625: Sam | E625: Jenkins | F625: Sailboard | G625: 22.331715743552273 | H625: Junior | I625: No | J625: Gold Fleet
A626: 425 | B626: 40097.555769004626 | C626: Mr | D626: Sam | E626: Jenkins | F626: Sailboard | G626: 22.287002486278215 | H626: Junior | I626: No | J626: Gold Fleet
A627: 425 | B627: 40097.4718278125 | C627: Mr | D627: Sam | E627: Jenkins | F627: Sailboard | G627: 22.172976116197379 | H627: Junior | I627: No | J627: Gold Fleet
A628: 425 | B628: 40097.451161469908 | C628: Mr | D628: Sam | E628: Jenkins | F628: Sailboard | G628: 22.13352735747371 | H628: Junior | I628: No | J628: Gold Fleet
A629: 425 | B629: 40097.567664884256 | C629: Mr | D629: Sam | E629: Jenkins | F629: Sailboard | G629: 21.917908413369187 | H629: Junior | I629: No | J629: Gold Fleet
A630: 425 | B630: 40097.577179178239 | C630: Mr | D630: Sam | E630: Jenkins | F630: Sailboard | G630: 21.856298015374485 | H630: Junior | I630: No | J630: Gold Fleet
A631: 425 | B631: 40097.464188564816 | C631: Mr | D631: Sam | E631: Jenkins | F631: Sailboard | G631: 21.762737280478277 | H631: Junior | I631: No | J631: Gold Fleet
A632: 425 | B632: 40097.584062291666 | C632: Mr | D632: Sam | E632: Jenkins | F632: Sailboard | G632: 21.642033742443196 | H632: Junior | I632: No | J632: Gold Fleet
A633: 425 | B633: 40097.571428101852 | C633: Mr | D633: Sam | E633: Jenkins | F633: Sailboard | G633: 20.574185415099439 | H633: Junior | I633: No | J633: Gold Fleet
A634: 425 | B634: 40097.620412037038 | C634: Mr | D634: Sam | E634: Jenkins | F634: Sailboard | G634: 19.651942998832482 | H634: Junior | I634: No | J634: Gold Fleet
A635: 444 | B635: 40097.481811273145 | C635: Mr | D635: Richard | E635: Haynes | F635: Sailboard | G635: 23.842786175920562 | H635: Master | I635: No | J635: Neither
A636: 444 | B636: 40097.500090497684 | C636: Mr | D636: Richard | E636: Haynes | F636: Sailboard | G636: 22.942189595981748 | H636: Master | I636: No | J636: Neither
A637: 444 | B637: 40097.491767604166 | C637: Mr | D637: Richard | E637: Haynes | F637: Sailboard | G637: 22.554632794075442 | H637: Master | I637: No | J637: Neither
A638: 444 | B638: 40097.470140289355 | C638: Mr | D638: Richard | E638: Haynes | F638: Sailboard | G638: 22.494658275789504 | H638: Master | I638: No | J638: Neither
A639: 444 | B639: 40097.568812951387 | C639: Mr | D639: Richard | E639: Haynes | F639: Sailboard | G639: 22.164145918738917 | H639: Master | I639: No | J639: Neither
A640: 444 | B640: 40097.444053495368 | C640: Mr | D640: Richard | E640: Haynes | F640: Sailboard | G640: 21.807618196335653 | H640: Master | I640: No | J640: Neither
A641: 444 | B641: 40097.574249988429 | C641: Mr | D641: Richard | E641: Haynes | F641: Sailboard | G641: 21.242068293571787 | H641: Master | I641: No | J641: Neither
A642: 496 | B642: 40097.489151712965 | C642: Mr | D642: Tim | E642: Tarrington | F642: Sailboard | G642: 25.675643963308708 | H642: Neither | I642: No | J642: Neither
A643: 496 | B643: 40097.500427754632 | C643: Mr | D643: Tim | E643: Tarrington | F643: Sailboard | G643: 25.605390140946195 | H643: Neither | I643: No | J643: Neither
A644: 496 | B644: 40097.463675833336 | C644: Mr | D644: Tim | E644: Tarrington | F644: Sailboard | G644: 25.045626455631499 | H644: Neither | I644: No | J644: Neither
A645: 496 | B645: 40097.495500266203 | C645: Mr | D645: Tim | E645: Tarrington | F645: Sailboard | G645: 24.856061028003939 | H645: Neither | I645: No | J645: Neither
A646: 496 | B646: 40097.455259317132 | C646: Mr | D646: Tim | E646: Tarrington | F646: Sailboard | G646: 24.607916732656406 | H646: Neither | I646: No | J646: Neither
A647: 496 | B647: 40097.480628576392 | C647: Mr | D647: Tim | E647: Tarrington | F647: Sailboard | G647: 24.555915810771349 | H647: Neither | I647: No | J647: Neither
A648: 496 | B648: 40097.473077615738 | C648: Mr | D648: Tim | E648: Tarrington | F648: Sailboard | G648: 23.768828316135259 | H648: Neither | I648: No | J648: Neither
A649: 555 | B649: 40097.438852268519 | C649: Mr | D649: claude | E649: Van-martyn | F649: Sailboard | G649: 25.36280428366651 | H649: Master | I649: No | J649: Neither
A650: 555 | B650: 40097.479819907407 | C650: Mr | D650: claude | E650: Van-martyn | F650: Sailboard | G650: 24.533127735858169 | H650: Master | I650: No | J650: Neither
A651: 555 | B651: 40097.558439895831 | C651: Mr | D651: claude | E651: Van-martyn | F651: Sailboard | G651: 23.149618073142186 | H651: Master | I651: No | J651: Neither
A652: 555 | B652: 40097.470454768518 | C652: Mr | D652: claude | E652: Van-martyn | F652: Sailboard | G652: 22.274796330234903 | H652: Master | I652: No | J652: Neither
A653: 555 | B653: 40097.570946793981 | C653: Mr | D653: claude | E653: Van-martyn | F653: Sailboard | G653: 20.87926796224545 | H653: Master | I653: No | J653: Neither
A654: 555 | B654: 40097.589033113429 | C654: Mr | D654: claude | E654: Van-martyn | F654: Sailboard | G654: 19.552018954403582 | H654: Master | I654: No | J654: Neither
A655: 559 | B655: 40097.461242696758 | C655: Mr | D655: TONY | E655: ATTFIELD | F655: Sailboard | G655: 27.305275747744659 | H655: Neither | I655: No | J655: Neither
A656: 559 | B656: 40097.48171861111 | C656: Mr | D656: TONY | E656: ATTFIELD | F656: Sailboard | G656: 27.024749219913573 | H656: Neither | I656: No | J656: Neither
A657: 559 | B657: 40097.555700960649 | C657: Mr | D657: TONY | E657: ATTFIELD | F657: Sailboard | G657: 26.719512003200474 | H657: Neither | I657: No | J657: Neither
A658: 559 | B658: 40097.478997164355 | C658: Mr | D658: TONY | E658: ATTFIELD | F658: Sailboard | G658: 25.801566202059902 | H658: Neither | I658: No | J658: Neither
A659: 559 | B659: 40097.465991493053 | C659: Mr | D659: TONY | E659: ATTFIELD | F659: Sailboard | G659: 25.794014477055395 | H659: Neither | I659: No | J659: Neither
A660: 559 | B660: 40097.456994733795 | C660: Mr | D660: TONY | E660: ATTFIELD | F660: Sailboard | G660: 25.642023381131718 | H660: Neither | I660: No | J660: Neither
A661: 559 | B661: 40097.476369236108 | C661: Mr | D661: TONY | E661: ATTFIELD | F661: Sailboard | G661: 25.365846399175272 | H661: Neither | I661: No | J661: Neither
A662: 559 | B662: 40097.495265682868 | C662: Mr | D662: TONY | E662: ATTFIELD | F662: Sailboard | G662: 24.984675623220568 | H662: Neither | I662: No | J662: Neither
A663: 559 | B663: 40097.485148622683 | C663: Mr | D663: TONY | E663: ATTFIELD | F663: Sailboard | G663: 24.974054434944449 | H663: Neither | I663: No | J663: Neither
A664: 559 | B664: 40097.468960081016 | C664: Mr | D664: TONY | E664: ATTFIELD | F664: Sailboard | G664: 24.076762503618909 | H664: Neither | I664: No | J664: Neither
A665: 559 | B665: 40097.60874113426 | C665: Mr | D665: TONY | E665: ATTFIELD | F665: Sailboard | G665: 23.212630860663126 | H665: Neither | I665: No | J665: Neither
A666: 559 | B666: 40097.488203611108 | C666: Mr | D666: TONY | E666: ATTFIELD | F666: Sailboard | G666: 20.719715639051223 | H666: Neither | I666: No | J666: Neither
A667: 559 | B667: 40097.576419571757 | C667: Mr | D667: TONY | E667: ATTFIELD | F667: Sailboard | G667: 18.750135806757925 | H667: Neither | I667: No | J667: Neither
A668: 568 | B668: 40097.548118784725 | C668: Mr | D668: alex | E668: burges | F668: Sailboard | G668: 26.681083924536299 | H668: Neither | I668: Yes | J668: Neither
A669: 568 | B669: 40097.448788692127 | C669: Mr | D669: alex | E669: burges | F669: Sailboard | G669: 26.044318416137326 | H669: Neither | I669: Yes | J669: Neither
A670: 568 | B670: 40097.452916018519 | C670: Mr | D670: alex | E670: burges | F670: Sailboard | G670: 25.606630053275353 | H670: Neither | I670: Yes | J670: Neither
A671: 568 | B671: 40097.604302361113 | C671: Mr | D671: alex | E671: burges | F671: Sailboard | G671: 25.155852073581062 | H671: Neither | I671: Yes | J671: Neither
A672: 568 | B672: 40097.557536886576 | C672: Mr | D672: alex | E672: burges | F672: Sailboard | G672: 24.958728198530338 | H672: Neither | I672: Yes | J672: Neither
A673: 568 | B673: 40097.458469699071 | C673: Mr | D673: alex | E673: burges | F673: Sailboard | G673: 24.935774821401864 | H673: Neither | I673: Yes | J673: Neither
A674: 568 | B674: 40097.552900740739 | C674: Mr | D674: alex | E674: burges | F674: Sailboard | G674: 24.231797545425113 | H674: Neither | I674: Yes | J674: Neither
A675: 568 | B675: 40097.473939618052 | C675: Mr | D675: alex | E675: burges | F675: Sailboard | G675: 24.204065197709742 | H675: Neither | I675: Yes | J675: Neither
A676: 568 | B676: 40097.578904189817 | C676: Mr | D676: alex | E676: burges | F676: Sailboard | G676: 24.188009661979166 | H676: Neither | I676: Yes | J676: Neither
A677: 568 | B677: 40097.566525057868 | C677: Mr | D677: alex | E677: burges | F677: Sailboard | G677: 24.029163884145014 | H677: Neither | I677: Yes | J677: Neither
A678: 568 | B678: 40097.48652017361 | C678: Mr | D678: alex | E678: burges | F678: Sailboard | G678: 23.828279886111048 | H678: Neither | I678: Yes | J678: Neither
A679: 568 | B679: 40097.464857314815 | C679: Mr | D679: alex | E679: burges | F679: Sailboard | G679: 23.77844890451178 | H679: Neither | I679: Yes | J679: Neither
A680: 568 | B680: 40097.438063229165 | C680: Mr | D680: alex | E680: burges | F680: Sailboard | G680: 23.729358475463378 | H680: Neither | I680: Yes | J680: Neither
A681: 568 | B681: 40097.480305023149 | C681: Mr | D681: alex | E681: burges | F681: Sailboard | G681: 23.646051154194772 | H681: Neither | I681: Yes | J681: Neither
A682: 568 | B682: 40097.563286562501 | C682: Mr | D682: alex | E682: burges | F682: Sailboard | G682: 23.272401848551041 | H682: Neither | I682: Yes | J682: Neither
A683: 568 | B683: 40097.587669803244 | C683: Mr | D683: alex | E683: burges | F683: Sailboard | G683: 22.767819819090533 | H683: Neither | I683: Yes | J683: Neither
A684: 568 | B684: 40097.591974895833 | C684: Mr | D684: alex | E684: burges | F684: Sailboard | G684: 22.287941839179776 | H684: Neither | I684: Yes | J684: Neither
A685: 568 | B685: 40097.574092141207 | C685: Mr | D685: alex | E685: burges | F685: Sailboard | G685: 20.965787050929283 | H685: Neither | I685: Yes | J685: Neither
A686: 571 | B686: 40097.457160636572 | C686: Mr | D686: Ryan | E686: Dunkling | F686: Sailboard | G686: 24.997078371457565 | H686: Junior | I686: Yes | J686: Neither
A687: 571 | B687: 40097.450902349534 | C687: Mr | D687: Ryan | E687: Dunkling | F687: Sailboard | G687: 24.418690857911553 | H687: Junior | I687: Yes | J687: Neither
A688: 571 | B688: 40097.445300902778 | C688: Mr | D688: Ryan | E688: Dunkling | F688: Sailboard | G688: 24.23401854367987 | H688: Junior | I688: Yes | J688: Neither
A689: 571 | B689: 40097.462448888888 | C689: Mr | D689: Ryan | E689: Dunkling | F689: Sailboard | G689: 23.952419385868055 | H689: Junior | I689: Yes | J689: Neither
A690: 571 | B690: 40097.555507106481 | C690: Mr | D690: Ryan | E690: Dunkling | F690: Sailboard | G690: 23.932903301327581 | H690: Junior | I690: Yes | J690: Neither
A691: 571 | B691: 40097.488596689815 | C691: Mr | D691: Ryan | E691: Dunkling | F691: Sailboard | G691: 23.556502687207495 | H691: Junior | I691: Yes | J691: Neither
A692: 571 | B692: 40097.47681453704 | C692: Mr | D692: Ryan | E692: Dunkling | F692: Sailboard | G692: 23.161279851935703 | H692: Junior | I692: Yes | J692: Neither
A693: 571 | B693: 40097.495559062503 | C693: Mr | D693: Ryan | E693: Dunkling | F693: Sailboard | G693: 22.895000576548654 | H693: Junior | I693: Yes | J693: Neither
A694: 571 | B694: 40097.484594502312 | C694: Mr | D694: Ryan | E694: Dunkling | F694: Sailboard | G694: 22.80071172583397 | H694: Junior | I694: Yes | J694: Neither
A695: 571 | B695: 40097.587899212966 | C695: Mr | D695: Ryan | E695: Dunkling | F695: Sailboard | G695: 21.936550093698436 | H695: Junior | I695: Yes | J695: Neither
A696: 609 | B696: 40097.499336076391 | C696: Mr | D696: philip | E696: ladbrook | F696: Kite Board | G696: 29.066833276682857 | H696: Master | I696: Yes | J696: Gold Fleet
A697: 609 | B697: 40097.574059004626 | C697: Mr | D697: philip | E697: ladbrook | F697: Kite Board | G697: 28.999078887787242 | H697: Master | I697: Yes | J697: Gold Fleet
A698: 609 | B698: 40097.454447349533 | C698: Mr | D698: philip | E698: ladbrook | F698: Kite Board | G698: 28.722604493364628 | H698: Master | I698: Yes | J698: Gold Fleet
A699: 609 | B699: 40097.472439386576 | C699: Mr | D699: philip | E699: ladbrook | F699: Kite Board | G699: 28.485073981893958 | H699: Master | I699: Yes | J699: Gold Fleet
A700: 609 | B700: 40097.549631145834 | C700: Mr | D700: philip | E700: ladbrook | F700: Kite Board | G700: 28.223540587944576 | H700: Master | I700: Yes | J700: Gold Fleet
A701: 609 | B701: 40097.554140555556 | C701: Mr | D701: philip | E701: ladbrook | F701: Kite Board | G701: 28.171659209845465 | H701: Master | I701: Yes | J701: Gold Fleet
A702: 609 | B702: 40097.476841574076 | C702: Mr | D702: philip | E702: ladbrook | F702: Kite Board | G702: 28.116977411361514 | H702: Master | I702: Yes | J702: Gold Fleet
A703: 609 | B703: 40097.556491863426 | C703: Mr | D703: philip | E703: ladbrook | F703: Kite Board | G703: 28.116977411361514 | H703: Master | I703: Yes | J703: Gold Fleet
A704: 609 | B704: 40097.463070740741 | C704: Mr | D704: philip | E704: ladbrook | F704: Kite Board | G704: 27.91803490895936 | H704: Master | I704: Yes | J704: Gold Fleet
A705: 609 | B705: 40097.62518427083 | C705: Mr | D705: philip | E705: ladbrook | F705: Kite Board | G705: 27.847454963542706 | H705: Master | I705: Yes | J705: Gold Fleet
A706: 609 | B706: 40097.486059224539 | C706: Mr | D706: philip | E706: ladbrook | F706: Kite Board | G706: 27.764103458673894 | H706: Master | I706: Yes | J706: Gold Fleet
A707: 609 | B707: 40097.459388530093 | C707: Mr | D707: philip | E707: ladbrook | F707: Kite Board | G707: 27.573700181798181 | H707: Master | I707: Yes | J707: Gold Fleet
A708: 609 | B708: 40097.619095381946 | C708: Mr | D708: philip | E708: ladbrook | F708: Kite Board | G708: 27.413579241165223 | H708: Master | I708: Yes | J708: Gold Fleet
A709: 609 | B709: 40097.560653819448 | C709: Mr | D709: philip | E709: ladbrook | F709: Kite Board | G709: 26.687143898256288 | H709: Master | I709: Yes | J709: Gold Fleet
A710: 609 | B710: 40097.490794212965 | C710: Mr | D710: philip | E710: ladbrook | F710: Kite Board | G710: 26.663592078749598 | H710: Master | I710: Yes | J710: Gold Fleet
A711: 609 | B711: 40097.56926491898 | C711: Mr | D711: philip | E711: ladbrook | F711: Kite Board | G711: 26.521152728204104 | H711: Master | I711: Yes | J711: Gold Fleet
A712: 622 | B712: 40097.54950552083 | C712: Mr | D712: Richard | E712: Fabbri | F712: Kite Board | G712: 30.398764014563866 | H712: Neither | I712: Yes | J712: Neither
A713: 622 | B713: 40097.545140578703 | C713: Mr | D713: Richard | E713: Fabbri | F713: Kite Board | G713: 30.037820011810656 | H713: Neither | I713: Yes | J713: Neither
A714: 622 | B714: 40097.560199444444 | C714: Mr | D714: Richard | E714: Fabbri | F714: Kite Board | G714: 28.898431438094768 | H714: Neither | I714: Yes | J714: Neither
A715: 622 | B715: 40097.569934444444 | C715: Mr | D715: Richard | E715: Fabbri | F715: Kite Board | G715: 26.785162047831669 | H715: Neither | I715: Yes | J715: Neither
A716: 622 | B716: 40097.55564337963 | C716: Mr | D716: Richard | E716: Fabbri | F716: Kite Board | G716: 3.3732013656165791 | H716: Neither | I716: Yes | J716: Neither
A717: 624 | B717: 40097.621177569446 | C717: Mrs | D717: Jenny | E717: Cooper | F717: Kite Board | G717: 24.010067490804939 | H717: Master | I717: Yes | J717: Gold Fleet
A718: 624 | B718: 40097.605293969908 | C718: Mrs | D718: Jenny | E718: Cooper | F718: Kite Board | G718: 22.52388597404698 | H718: Master | I718: Yes | J718: Gold Fleet
A719: 624 | B719: 40097.499031030093 | C719: Mrs | D719: Jenny | E719: Cooper | F719: Kite Board | G719: 21.811216713110749 | H719: Master | I719: Yes | J719: Gold Fleet
A720: 624 | B720: 40097.479483761577 | C720: Mrs | D720: Jenny | E720: Cooper | F720: Kite Board | G720: 21.457152587219674 | H720: Master | I720: Yes | J720: Gold Fleet
A721: 624 | B721: 40097.61012878472 | C721: Mrs | D721: Jenny | E721: Cooper | F721: Kite Board | G721: 20.834838914657936 | H721: Master | I721: Yes | J721: Gold Fleet
A722: 624 | B722: 40097.493687870374 | C722: Mrs | D722: Jenny | E722: Cooper | F722: Kite Board | G722: 19.986984670746445 | H722: Master | I722: Yes | J722: Gold Fleet
A723: 625 | B723: 40097.583567372683 | C723: Mr | D723: Jason | E723: McCaffrey | F723: Kite Board | G723: 31.562887157222601 | H723: Neither | I723: No | J723: Gold Fleet
A724: 625 | B724: 40097.624700729168 | C724: Mr | D724: Jason | E724: McCaffrey | F724: Kite Board | G724: 30.691687666545384 | H724: Neither | I724: No | J724: Gold Fleet
A725: 625 | B725: 40097.617410729166 | C725: Mr | D725: Jason | E725: McCaffrey | F725: Kite Board | G725: 30.54452356823932 | H725: Neither | I725: No | J725: Gold Fleet
A726: 625 | B726: 40097.613703148148 | C726: Mr | D726: Jason | E726: McCaffrey | F726: Kite Board | G726: 30.41800150848935 | H726: Neither | I726: No | J726: Gold Fleet
A727: 625 | B727: 40097.58800520833 | C727: Mr | D727: Jason | E727: McCaffrey | F727: Kite Board | G727: 30.214624090384536 | H727: Neither | I727: No | J727: Gold Fleet
A728: 625 | B728: 40097.545400219904 | C728: Mr | D728: Jason | E728: McCaffrey | F728: Kite Board | G728: 29.925611812811994 | H728: Neither | I728: No | J728: Gold Fleet
A729: 625 | B729: 40097.559353368059 | C729: Mr | D729: Jason | E729: McCaffrey | F729: Kite Board | G729: 29.684512882254275 | H729: Neither | I729: No | J729: Gold Fleet
A730: 625 | B730: 40097.554906087964 | C730: Mr | D730: Jason | E730: McCaffrey | F730: Kite Board | G730: 29.642906692619423 | H730: Neither | I730: No | J730: Gold Fleet
A731: 625 | B731: 40097.548506747684 | C731: Mr | D731: Jason | E731: McCaffrey | F731: Kite Board | G731: 29.54600209719008 | H731: Neither | I731: No | J731: Gold Fleet
A732: 625 | B732: 40097.575305844905 | C732: Mr | D732: Jason | E732: McCaffrey | F732: Kite Board | G732: 29.289848934371005 | H732: Neither | I732: No | J732: Gold Fleet
A733: 625 | B733: 40097.572150312502 | C733: Mr | D733: Jason | E733: McCaffrey | F733: Kite Board | G733: 29.159811475819033 | H733: Neither | I733: No | J733: Gold Fleet
A734: 625 | B734: 40097.499939768517 | C734: Mr | D734: Jason | E734: McCaffrey | F734: Kite Board | G734: 28.115482479746269 | H734: Neither | I734: No | J734: Gold Fleet
A735: 625 | B735: 40097.562232557873 | C735: Mr | D735: Jason | E735: McCaffrey | F735: Kite Board | G735: 28.052084908720424 | H735: Neither | I735: No | J735: Gold Fleet
A736: 625 | B736: 40097.486929733794 | C736: Mr | D736: Jason | E736: McCaffrey | F736: Kite Board | G736: 27.283435853228625 | H736: Neither | I736: No | J736: Gold Fleet
A737: 625 | B737: 40097.492690243052 | C737: Mr | D737: Jason | E737: McCaffrey | F737: Kite Board | G737: 27.144066707739167 | H737: Neither | I737: No | J737: Gold Fleet
A738: 625 | B738: 40097.578072881945 | C738: Mr | D738: Jason | E738: McCaffrey | F738: Kite Board | G738: 27.084276335644773 | H738: Neither | I738: No | J738: Gold Fleet
A739: 625 | B739: 40097.490183402777 | C739: Mr | D739: Jason | E739: McCaffrey | F739: Kite Board | G739: 26.830015756017215 | H739: Neither | I739: No | J739: Gold Fleet
A740: 625 | B740: 40097.48251115741 | C740: Mr | D740: Jason | E740: McCaffrey | F740: Kite Board | G740: 26.347362537748666 | H740: Neither | I740: No | J740: Gold Fleet
A741: 625 | B741: 40097.475945694445 | C741: Mr | D741: Jason | E741: McCaffrey | F741: Kite Board | G741: 25.585565137344471 | H741: Neither | I741: No | J741: Gold Fleet
A742: 625 | B742: 40097.473312488422 | C742: Mr | D742: Jason | E742: McCaffrey | F742: Kite Board | G742: 25.291830157353246 | H742: Neither | I742: No | J742: Gold Fleet
A743: 625 | B743: 40097.479316469908 | C743: Mr | D743: Jason | E743: McCaffrey | F743: Kite Board | G743: 24.591893117395578 | H743: Neither | I743: No | J743: Gold Fleet
A744: 626 | B744: 40097.448415879633 | C744: Mr | D744: martin | E744: hayes | F744: Kite Board | G744: 27.342695435851137 | H744: Neither | I744: No | J744: Neither
A745: 626 | B745: 40097.45212707176 | C745: Mr | D745: martin | E745: hayes | F745: Kite Board | G745: 27.152430635816433 | H745: Neither | I745: No | J745: Neither
A746: 626 | B746: 40097.553471400461 | C746: Mr | D746: martin | E746: hayes | F746: Kite Board | G746: 26.96342010375373 | H746: Neither | I746: No | J746: Neither
A747: 626 | B747: 40097.45465028935 | C747: Mr | D747: martin | E747: hayes | F747: Kite Board | G747: 26.691859679355815 | H747: Neither | I747: No | J747: Neither
A748: 626 | B748: 40097.548089166667 | C748: Mr | D748: martin | E748: hayes | F748: Kite Board | G748: 26.579148215544159 | H748: Neither | I748: No | J748: Neither
A749: 626 | B749: 40097.562137025459 | C749: Mr | D749: martin | E749: hayes | F749: Kite Board | G749: 26.553119191946504 | H749: Neither | I749: No | J749: Neither
A750: 626 | B750: 40097.457098611114 | C750: Mr | D750: martin | E750: hayes | F750: Kite Board | G750: 25.989908296983963 | H750: Neither | I750: No | J750: Neither
A751: 626 | B751: 40097.481462152777 | C751: Mr | D751: martin | E751: hayes | F751: Kite Board | G751: 25.966932756632083 | H751: Neither | I751: No | J751: Neither
A752: 626 | B752: 40097.459516111114 | C752: Mr | D752: martin | E752: hayes | F752: Kite Board | G752: 25.767615255322987 | H752: Neither | I752: No | J752: Neither
A753: 626 | B753: 40097.545089710649 | C753: Mr | D753: martin | E753: hayes | F753: Kite Board | G753: 25.746911338393815 | H753: Neither | I753: No | J753: Neither
A754: 626 | B754: 40097.555917418984 | C754: Mr | D754: martin | E754: hayes | F754: Kite Board | G754: 25.615934590083725 | H754: Neither | I754: No | J754: Neither
A755: 626 | B755: 40097.465709131946 | C755: Mr | D755: martin | E755: hayes | F755: Kite Board | G755: 25.295459694466711 | H755: Neither | I755: No | J755: Neither
A756: 626 | B756: 40097.55898814815 | C756: Mr | D756: martin | E756: hayes | F756: Kite Board | G756: 25.139107172775631 | H756: Neither | I756: No | J756: Neither
A757: 626 | B757: 40097.444476307872 | C757: Mr | D757: martin | E757: hayes | F757: Kite Board | G757: 25.080079838501554 | H757: Neither | I757: No | J757: Neither
A758: 626 | B758: 40097.438697291669 | C758: Mr | D758: martin | E758: hayes | F758: Kite Board | G758: 25.045626455631499 | H758: Neither | I758: No | J758: Neither
A759: 626 | B759: 40097.479121597222 | C759: Mr | D759: martin | E759: hayes | F759: Kite Board | G759: 25.03910329989057 | H759: Neither | I759: No | J759: Neither
A760: 626 | B760: 40097.468594050923 | C760: Mr | D760: martin | E760: hayes | F760: Kite Board | G760: 25.037324813217445 | H760: Neither | I760: No | J760: Neither
A761: 626 | B761: 40097.48408934028 | C761: Mr | D761: martin | E761: hayes | F761: Kite Board | G761: 24.874185997562748 | H761: Neither | I761: No | J761: Neither
A762: 626 | B762: 40097.462375636576 | C762: Mr | D762: martin | E762: hayes | F762: Kite Board | G762: 24.863073821283376 | H762: Neither | I762: No | J762: Neither
A763: 626 | B763: 40097.474145601853 | C763: Mr | D763: martin | E763: hayes | F763: Kite Board | G763: 24.817559804486734 | H763: Neither | I763: No | J763: Neither
A764: 626 | B764: 40097.567185416665 | C764: Mr | D764: martin | E764: hayes | F764: Kite Board | G764: 24.637731012141721 | H764: Neither | I764: No | J764: Neither
A765: 626 | B765: 40097.564677835646 | C765: Mr | D765: martin | E765: hayes | F765: Kite Board | G765: 24.496754801887125 | H765: Neither | I765: No | J765: Neither
A766: 626 | B766: 40097.491697430552 | C766: Mr | D766: martin | E766: hayes | F766: Kite Board | G766: 24.466714683795491 | H766: Neither | I766: No | J766: Neither
A767: 626 | B767: 40097.497061747687 | C767: Mr | D767: martin | E767: hayes | F767: Kite Board | G767: 24.267387342599065 | H767: Neither | I767: No | J767: Neither
A768: 626 | B768: 40097.43278265046 | C768: Mr | D768: martin | E768: hayes | F768: Kite Board | G768: 24.152100401460917 | H768: Neither | I768: No | J768: Neither
A769: 626 | B769: 40097.435836354169 | C769: Mr | D769: martin | E769: hayes | F769: Kite Board | G769: 24.145482196672731 | H769: Neither | I769: No | J769: Neither
A770: 626 | B770: 40097.486692268518 | C770: Mr | D770: martin | E770: hayes | F770: Kite Board | G770: 24.052118866191265 | H770: Neither | I770: No | J770: Neither
A771: 626 | B771: 40097.47139269676 | C771: Mr | D771: martin | E771: hayes | F771: Kite Board | G771: 24.045008821976818 | H771: Neither | I771: No | J771: Neither
A772: 626 | B772: 40097.572364814812 | C772: Mr | D772: martin | E772: hayes | F772: Kite Board | G772: 23.719245756736871 | H772: Neither | I772: No | J772: Neither
A773: 626 | B773: 40097.616666307869 | C773: Mr | D773: martin | E773: hayes | F773: Kite Board | G773: 23.649224003422525 | H773: Neither | I773: No | J773: Neither
A774: 626 | B774: 40097.494440347225 | C774: Mr | D774: martin | E774: hayes | F774: Kite Board | G774: 23.496831210398984 | H774: Neither | I774: No | J774: Neither
A775: 626 | B775: 40097.489177546297 | C775: Mr | D775: martin | E775: hayes | F775: Kite Board | G775: 23.130375996333786 | H775: Neither | I775: No | J775: Neither
A776: 626 | B776: 40097.569783263891 | C776: Mr | D776: martin | E776: hayes | F776: Kite Board | G776: 22.658054531081572 | H776: Neither | I776: No | J776: Neither
A777: 656 | B777: 40097.454772766207 | C777: Mr | D777: william | E777: robinson | F777: Sailboard | G777: 24.735126602591166 | H777: Master | I777: No | J777: Neither
A778: 656 | B778: 40097.4443040162 | C778: Mr | D778: william | E778: robinson | F778: Sailboard | G778: 24.581032034426645 | H778: Master | I778: No | J778: Neither
A779: 656 | B779: 40097.450508518516 | C779: Mr | D779: william | E779: robinson | F779: Sailboard | G779: 24.244019823348129 | H779: Master | I779: No | J779: Neither
A780: 656 | B780: 40097.55684902778 | C780: Mr | D780: william | E780: robinson | F780: Sailboard | G780: 23.304713974547123 | H780: Master | I780: No | J780: Neither
A781: 656 | B781: 40097.551630752314 | C781: Mr | D781: william | E781: robinson | F781: Sailboard | G781: 23.263698181777904 | H781: Master | I781: No | J781: Neither
A782: 656 | B782: 40097.547532858793 | C782: Mr | D782: william | E782: robinson | F782: Sailboard | G782: 23.222316754486002 | H782: Master | I782: No | J782: Neither
A783: 656 | B783: 40097.435388831022 | C783: Mr | D783: william | E783: robinson | F783: Sailboard | G783: 23.001074589370067 | H783: Master | I783: No | J783: Neither
A784: 656 | B784: 40097.5969974537 | C784: Mr | D784: william | E784: robinson | F784: Sailboard | G784: 22.581605165959061 | H784: Master | I784: No | J784: Neither
A785: 656 | B785: 40097.605773518517 | C785: Mr | D785: william | E785: robinson | F785: Sailboard | G785: 22.501359765671587 | H785: Master | I785: No | J785: Neither
A786: 656 | B786: 40097.586293993052 | C786: Mr | D786: william | E786: robinson | F786: Sailboard | G786: 21.547220759377741 | H786: Master | I786: No | J786: Neither
A787: 656 | B787: 40097.497472002316 | C787: Mr | D787: william | E787: robinson | F787: Sailboard | G787: 21.060573515230274 | H787: Master | I787: No | J787: Neither
A788: 656 | B788: 40097.609848645836 | C788: Mr | D788: william | E788: robinson | F788: Sailboard | G788: 21.047159754527748 | H788: Master | I788: No | J788: Neither
A789: 656 | B789: 40097.492528136572 | C789: Mr | D789: william | E789: robinson | F789: Sailboard | G789: 20.684455380716656 | H789: Master | I789: No | J789: Neither
A790: 670 | B790: 40097.448385046293 | C790: Mr | D790: Eddie | E790: Murrell | F790: Sailboard | G790: 25.15345890167465 | H790: Master | I790: No | J790: Gold Fleet
A791: 670 | B791: 40097.49503460648 | C791: Mr | D791: Eddie | E791: Murrell | F791: Sailboard | G791: 23.62967087852941 | H791: Master | I791: No | J791: Gold Fleet
A792: 670 | B792: 40097.475053796297 | C792: Mr | D792: Eddie | E792: Murrell | F792: Sailboard | G792: 23.390285059835179 | H792: Master | I792: No | J792: Gold Fleet
A793: 670 | B793: 40097.500543159724 | C793: Mr | D793: Eddie | E793: Murrell | F793: Sailboard | G793: 23.371157597946151 | H793: Master | I793: No | J793: Gold Fleet
A794: 670 | B794: 40097.443893252312 | C794: Mr | D794: Eddie | E794: Murrell | F794: Sailboard | G794: 23.04669296334578 | H794: Master | I794: No | J794: Gold Fleet
A795: 670 | B795: 40097.464612268515 | C795: Mr | D795: Eddie | E795: Murrell | F795: Sailboard | G795: 23.038156957541123 | H795: Master | I795: No | J795: Gold Fleet
A796: 670 | B796: 40097.557723622682 | C796: Mr | D796: Eddie | E796: Murrell | F796: Sailboard | G796: 23.036149738467646 | H796: Master | I796: No | J796: Gold Fleet
A797: 670 | B797: 40097.552312685184 | C797: Mr | D797: Eddie | E797: Murrell | F797: Sailboard | G797: 22.861342546843353 | H797: Master | I797: No | J797: Gold Fleet
A798: 670 | B798: 40097.608700856479 | C798: Mr | D798: Eddie | E798: Murrell | F798: Sailboard | G798: 22.690629520889289 | H798: Master | I798: No | J798: Gold Fleet
A799: 670 | B799: 40097.481103506943 | C799: Mr | D799: Eddie | E799: Murrell | F799: Sailboard | G799: 22.611059088056528 | H799: Master | I799: No | J799: Gold Fleet
A800: 670 | B800: 40097.604119328702 | C800: Mr | D800: Eddie | E800: Murrell | F800: Sailboard | G800: 22.3718747715203 | H800: Master | I800: No | J800: Gold Fleet
A801: 670 | B801: 40097.440027638891 | C801: Mr | D801: Eddie | E801: Murrell | F801: Sailboard | G801: 22.154394252194784 | H801: Master | I801: No | J801: Gold Fleet
A802: 670 | B802: 40097.485124212966 | C802: Mr | D802: Eddie | E802: Murrell | F802: Sailboard | G802: 21.312709583978751 | H802: Master | I802: No | J802: Gold Fleet
A803: 670 | B803: 40097.571258229167 | C803: Mr | D803: Eddie | E803: Murrell | F803: Sailboard | G803: 19.17444387493379 | H803: Master | I803: No | J803: Gold Fleet
A804: 670 | B804: 40097.625742152777 | C804: Mr | D804: Eddie | E804: Murrell | F804: Sailboard | G804: 2.3572466170067128 | H804: Master | I804: No | J804: Gold Fleet
A805: 681 | B805: 40097.446680960646 | C805: Mr | D805: Alan | E805: Cross | F805: Sailboard | G805: 26.924973424895661 | H805: Master | I805: No | J805: Gold Fleet
A806: 681 | B806: 40097.442716018515 | C806: Mr | D806: Alan | E806: Cross | F806: Sailboard | G806: 26.391419962246868 | H806: Master | I806: No | J806: Gold Fleet
A807: 681 | B807: 40097.453281979164 | C807: Mr | D807: Alan | E807: Cross | F807: Sailboard | G807: 26.01996582713517 | H807: Master | I807: No | J807: Gold Fleet
A808: 681 | B808: 40097.449837233798 | C808: Mr | D808: Alan | E808: Cross | F808: Sailboard | G808: 25.770755261086848 | H808: Master | I808: No | J808: Gold Fleet
A809: 681 | B809: 40097.585660960649 | C809: Mr | D809: Alan | E809: Cross | F809: Sailboard | G809: 25.596712947144582 | H809: Master | I809: No | J809: Gold Fleet
A810: 681 | B810: 40097.460246828705 | C810: Mr | D810: Alan | E810: Cross | F810: Sailboard | G810: 25.563298234285277 | H810: Master | I810: No | J810: Gold Fleet
A811: 681 | B811: 40097.602384224534 | C811: Mr | D811: Alan | E811: Cross | F811: Sailboard | G811: 25.354291081587128 | H811: Master | I811: No | J811: Gold Fleet
A812: 681 | B812: 40097.557590682867 | C812: Mr | D812: Alan | E812: Cross | F812: Sailboard | G812: 24.996487750502844 | H812: Master | I812: No | J812: Gold Fleet
A813: 681 | B813: 40097.594773310186 | C813: Mr | D813: Alan | E813: Cross | F813: Sailboard | G813: 24.770470976807541 | H813: Master | I813: No | J813: Gold Fleet
A814: 681 | B814: 40097.471251423609 | C814: Mr | D814: Alan | E814: Cross | F814: Sailboard | G814: 24.663589570404202 | H814: Master | I814: No | J814: Gold Fleet
A815: 681 | B815: 40097.482912581021 | C815: Mr | D815: Alan | E815: Cross | F815: Sailboard | G815: 24.191883161583227 | H815: Master | I815: No | J815: Gold Fleet
A816: 681 | B816: 40097.478811365741 | C816: Mr | D816: Alan | E816: Cross | F816: Sailboard | G816: 23.967620240278549 | H816: Master | I816: No | J816: Gold Fleet
A817: 681 | B817: 40097.564527222225 | C817: Mr | D817: Alan | E817: Cross | F817: Sailboard | G817: 23.704889025647265 | H817: Master | I817: No | J817: Gold Fleet
A818: 681 | B818: 40097.590215798613 | C818: Mr | D818: Alan | E818: Cross | F818: Sailboard | G818: 23.408925550021987 | H818: Master | I818: No | J818: Gold Fleet
A819: 681 | B819: 40097.56921159722 | C819: Mr | D819: Alan | E819: Cross | F819: Sailboard | G819: 22.335961179051335 | H819: Master | I819: No | J819: Gold Fleet
A820: 681 | B820: 40097.552169560186 | C820: Mr | D820: Alan | E820: Cross | F820: Sailboard | G820: 0.18357913011758081 | H820: Master | I820: No | J820: Gold Fleet
A821: 714 | B821: 40097.463800543985 | C821: Miss | D821: Emily | E821: Hall | F821: Sailboard | G821: 16.7228293977177 | H821: Junior | I821: Yes | J821: Gold Fleet
A822: 714 | B822: 40097.443184560187 | C822: Miss | D822: Emily | E822: Hall | F822: Sailboard | G822: 15.620819836114542 | H822: Junior | I822: Yes | J822: Gold Fleet
A823: 714 | B823: 40097.43945189815 | C823: Miss | D823: Emily | E823: Hall | F823: Sailboard | G823: 15.533395099076213 | H823: Junior | I823: Yes | J823: Gold Fleet
A824: 714 | B824: 40097.434941388892 | C824: Miss | D824: Emily | E824: Hall | F824: Sailboard | G824: 2.6394581647911335 | H824: Junior | I824: Yes | J824: Gold Fleet
A825: 760 | B825: 40097.58322630787 | C825: Mr | D825: Antony | E825: Todd | F825: Sailboard | G825: 24.506405760838323 | H825: Neither | I825: Yes | J825: Neither
A826: 760 | B826: 40097.599495034723 | C826: Mr | D826: Antony | E826: Todd | F826: Sailboard | G826: 23.63600896969302 | H826: Neither | I826: Yes | J826: Neither
A827: 760 | B827: 40097.614013194441 | C827: Mr | D827: Antony | E827: Todd | F827: Sailboard | G827: 22.986574898459253 | H827: Neither | I827: Yes | J827: Neither
A828: 760 | B828: 40097.572669583336 | C828: Mr | D828: Antony | E828: Todd | F828: Sailboard | G828: 21.553808389444214 | H828: Neither | I828: Yes | J828: Neither
A829: 760 | B829: 40097.56723753472 | C829: Mr | D829: Antony | E829: Todd | F829: Sailboard | G829: 21.096287487921241 | H829: Neither | I829: Yes | J829: Neither
A830: 760 | B830: 40097.561403981483 | C830: Mr | D830: Antony | E830: Todd | F830: Sailboard | G830: 20.737594261455325 | H830: Neither | I830: Yes | J830: Neither
A831: 773 | B831: 40097.620616354165 | C831: Mr | D831: Adrian | E831: Nisbet | F831: Sailboard | G831: 23.274451095562895 | H831: Neither | I831: Yes | J831: Neither
A832: 773 | B832: 40097.549833634257 | C832: Mr | D832: Adrian | E832: Nisbet | F832: Sailboard | G832: 22.785481318465973 | H832: Neither | I832: Yes | J832: Neither
A833: 773 | B833: 40097.565781840276 | C833: Mr | D833: Adrian | E833: Nisbet | F833: Sailboard | G833: 21.23140594712233 | H833: Neither | I833: Yes | J833: Neither
A834: 773 | B834: 40097.604184467593 | C834: Mr | D834: Adrian | E834: Nisbet | F834: Sailboard | G834: 21.230979600868178 | H834: Neither | I834: Yes | J834: Neither
A835: 852 | B835: 40097.581340393517 | C835: Mr | D835: Henry | E835: Bloodworth | F835: Sailboard | G835: 19.391392404358211 | H835: Junior | I835: No | J835: Neither
A836: 852 | B836: 40097.553810138888 | C836: Mr | D836: Henry | E836: Bloodworth | F836: Sailboard | G836: 19.356606321600491 | H836: Junior | I836: No | J836: Neither
A837: 852 | B837: 40097.452503402776 | C837: Mr | D837: Henry | E837: Bloodworth | F837: Sailboard | G837: 19.063139526238537 | H837: Junior | I837: No | J837: Neither
A838: 852 | B838: 40097.573800891201 | C838: Mr | D838: Henry | E838: Bloodworth | F838: Sailboard | G838: 18.885758822878781 | H838: Junior | I838: No | J838: Neither
A839: 852 | B839: 40097.46507820602 | C839: Mr | D839: Henry | E839: Bloodworth | F839: Sailboard | G839: 18.79379027807008 | H839: Junior | I839: No | J839: Neither
A840: 852 | B840: 40097.478142025466 | C840: Mr | D840: Henry | E840: Bloodworth | F840: Sailboard | G840: 18.787112225735221 | H840: Junior | I840: No | J840: Neither
A841: 852 | B841: 40097.492806423608 | C841: Mr | D841: Henry | E841: Bloodworth | F841: Sailboard | G841: 18.371608351954361 | H841: Junior | I841: No | J841: Neither
A842: 863 | B842: 40097.432374942131 | C842: Mr | D842: Duncan | E842: Adam | F842: Sailboard | G842: 24.749020651203033 | H842: Master | I842: No | J842: Neither
A843: 863 | B843: 40097.474105057867 | C843: Mr | D843: Duncan | E843: Adam | F843: Sailboard | G843: 24.589034158574101 | H843: Master | I843: No | J843: Neither
A844: 863 | B844: 40097.554680381945 | C844: Mr | D844: Duncan | E844: Adam | F844: Sailboard | G844: 24.464450474700559 | H844: Master | I844: No | J844: Neither
A845: 863 | B845: 40097.442287395832 | C845: Mr | D845: Duncan | E845: Adam | F845: Sailboard | G845: 24.149342433056098 | H845: Master | I845: No | J845: Neither
A846: 863 | B846: 40097.462648842593 | C846: Mr | D846: Duncan | E846: Adam | F846: Sailboard | G846: 23.922616046891129 | H846: Master | I846: No | J846: Neither
A847: 863 | B847: 40097.621246261573 | C847: Mr | D847: Duncan | E847: Adam | F847: Sailboard | G847: 23.813791237234121 | H847: Master | I847: No | J847: Neither
A848: 863 | B848: 40097.598466284719 | C848: Mr | D848: Duncan | E848: Adam | F848: Sailboard | G848: 23.168384482642214 | H848: Master | I848: No | J848: Neither
A849: 863 | B849: 40097.435626562503 | C849: Mr | D849: Duncan | E849: Adam | F849: Sailboard | G849: 23.06579568700479 | H849: Master | I849: No | J849: Neither
A850: 863 | B850: 40097.495823090278 | C850: Mr | D850: Duncan | E850: Adam | F850: Sailboard | G850: 22.902934979659918 | H850: Master | I850: No | J850: Neither
A851: 863 | B851: 40097.486211331016 | C851: Mr | D851: Duncan | E851: Adam | F851: Sailboard | G851: 22.612026260793954 | H851: Master | I851: No | J851: Neither
A852: 863 | B852: 40097.499846087965 | C852: Mr | D852: Duncan | E852: Adam | F852: Sailboard | G852: 21.92199767040535 | H852: Master | I852: No | J852: Neither
A853: 863 | B853: 40097.579128877318 | C853: Mr | D853: Duncan | E853: Adam | F853: Sailboard | G853: 21.882077667299221 | H853: Master | I853: No | J853: Neither
A854: 863 | B854: 40097.573981238427 | C854: Mr | D854: Duncan | E854: Adam | F854: Sailboard | G854: 21.525290035644076 | H854: Master | I854: No | J854: Neither
A855: 863 | B855: 40097.604563518522 | C855: Mr | D855: Duncan | E855: Adam | F855: Sailboard | G855: 20.594620666948689 | H855: Master | I855: No | J855: Neither
A856: 873 | B856: 40097.457648715281 | C856: Mr | D856: Lance | E856: Newbery | F856: Sailboard | G856: 28.548903695439922 | H856: Neither | I856: No | J856: Gold Fleet
A857: 873 | B857: 40097.555003483794 | C857: Mr | D857: Lance | E857: Newbery | F857: Sailboard | G857: 26.794663856763385 | H857: Neither | I857: No | J857: Gold Fleet
A858: 873 | B858: 40097.465589664353 | C858: Mr | D858: Lance | E858: Newbery | F858: Sailboard | G858: 26.643437624811604 | H858: Neither | I858: No | J858: Gold Fleet
A859: 873 | B859: 40097.474539247683 | C859: Mr | D859: Lance | E859: Newbery | F859: Sailboard | G859: 26.541122532312126 | H859: Neither | I859: No | J859: Gold Fleet
A860: 873 | B860: 40097.498150983796 | C860: Mr | D860: Lance | E860: Newbery | F860: Sailboard | G860: 25.529971036289119 | H860: Neither | I860: No | J860: Gold Fleet
A861: 873 | B861: 40097.493960416665 | C861: Mr | D861: Lance | E861: Newbery | F861: Sailboard | G861: 25.155852449783456 | H861: Neither | I861: No | J861: Gold Fleet
A862: 873 | B862: 40097.430495694447 | C862: Mr | D862: Lance | E862: Newbery | F862: Sailboard | G862: 25.072349153796839 | H862: Neither | I862: No | J862: Gold Fleet
A863: 873 | B863: 40097.615151990743 | C863: Mr | D863: Lance | E863: Newbery | F863: Sailboard | G863: 23.713394470864852 | H863: Neither | I863: No | J863: Gold Fleet
A864: 888 | B864: 40097.551231458332 | C864: Mr | D864: Michael | E864: George | F864: Sailboard | G864: 27.991937175324409 | H864: Neither | I864: No | J864: Neither
A865: 888 | B865: 40097.45571678241 | C865: Mr | D865: Michael | E865: George | F865: Sailboard | G865: 25.77201124076506 | H865: Neither | I865: No | J865: Neither
A866: 888 | B866: 40097.501073125 | C866: Mr | D866: Michael | E866: George | F866: Sailboard | G866: 25.491198774999045 | H866: Neither | I866: No | J866: Neither
A867: 888 | B867: 40097.4386050463 | C867: Mr | D867: Michael | E867: George | F867: Sailboard | G867: 25.459284868370322 | H867: Neither | I867: No | J867: Neither
A868: 888 | B868: 40097.444875879628 | C868: Mr | D868: Michael | E868: George | F868: Sailboard | G868: 25.442133711122921 | H868: Neither | I868: No | J868: Neither
A869: 888 | B869: 40097.556692199076 | C869: Mr | D869: Michael | E869: George | F869: Sailboard | G869: 25.053934351354123 | H869: Neither | I869: No | J869: Neither
A870: 888 | B870: 40097.451028993055 | C870: Mr | D870: Michael | E870: George | F870: Sailboard | G870: 24.834462275192077 | H870: Neither | I870: No | J870: Neither
A871: 888 | B871: 40097.620113842589 | C871: Mr | D871: Michael | E871: George | F871: Sailboard | G871: 24.58160318540569 | H871: Neither | I871: No | J871: Neither
A872: 888 | B872: 40097.434635335645 | C872: Mr | D872: Michael | E872: George | F872: Sailboard | G872: 24.487678235998985 | H872: Neither | I872: No | J872: Neither
A873: 888 | B873: 40097.578249849539 | C873: Mr | D873: Michael | E873: George | F873: Sailboard | G873: 24.285779311252259 | H873: Neither | I873: No | J873: Neither
A874: 888 | B874: 40097.583744930555 | C874: Mr | D874: Michael | E874: George | F874: Sailboard | G874: 24.131156457754411 | H874: Neither | I874: No | J874: Neither
A875: 888 | B875: 40097.567387048613 | C875: Mr | D875: Michael | E875: George | F875: Sailboard | G875: 23.787542076060408 | H875: Neither | I875: No | J875: Neither
A876: 888 | B876: 40097.480520729165 | C876: Mr | D876: Michael | E876: George | F876: Sailboard | G876: 23.667220354962204 | H876: Neither | I876: No | J876: Neither
A877: 888 | B877: 40097.562387534723 | C877: Mr | D877: Michael | E877: George | F877: Sailboard | G877: 23.432787488144211 | H877: Neither | I877: No | J877: Neither
A878: 888 | B878: 40097.497451076386 | C878: Mr | D878: Michael | E878: George | F878: Sailboard | G878: 22.700371673427831 | H878: Neither | I878: No | J878: Neither
A879: 888 | B879: 40097.588512916664 | C879: Mr | D879: Michael | E879: George | F879: Sailboard | G879: 22.685761732648487 | H879: Neither | I879: No | J879: Neither
A880: 983 | B880: 40097.451901365741 | C880: Mr | D880: HAMISH | E880: GODDARD | F880: Sailboard | G880: 26.997150749545145 | H880: Master | I880: Yes | J880: Neither
A881: 983 | B881: 40097.583363321763 | C881: Mr | D881: HAMISH | E881: GODDARD | F881: Sailboard | G881: 26.522482918357863 | H881: Master | I881: Yes | J881: Neither
A882: 983 | B882: 40097.547090613429 | C882: Mr | D882: HAMISH | E882: GODDARD | F882: Sailboard | G882: 26.483292689210408 | H882: Master | I882: Yes | J882: Neither
A883: 983 | B883: 40097.448251643516 | C883: Mr | D883: HAMISH | E883: GODDARD | F883: Sailboard | G883: 26.334895886538781 | H883: Master | I883: Yes | J883: Neither
A884: 983 | B884: 40097.455936956016 | C884: Mr | D884: HAMISH | E884: GODDARD | F884: Sailboard | G884: 26.122166292235356 | H884: Master | I884: Yes | J884: Neither
A885: 983 | B885: 40097.459150150462 | C885: Mr | D885: HAMISH | E885: GODDARD | F885: Sailboard | G885: 25.979692151158329 | H885: Master | I885: Yes | J885: Neither
A886: 983 | B886: 40097.477276504629 | C886: Mr | D886: HAMISH | E886: GODDARD | F886: Sailboard | G886: 25.769499403821129 | H886: Master | I886: Yes | J886: Neither
A887: 983 | B887: 40097.445077881945 | C887: Mr | D887: HAMISH | E887: GODDARD | F887: Sailboard | G887: 25.476459551088727 | H887: Master | I887: Yes | J887: Neither
A888: 983 | B888: 40097.43646986111 | C888: Mr | D888: HAMISH | E888: GODDARD | F888: Sailboard | G888: 25.289410284125452 | H888: Master | I888: Yes | J888: Neither
A889: 983 | B889: 40097.555825856478 | C889: Mr | D889: HAMISH | E889: GODDARD | F889: Sailboard | G889: 25.09615083044886 | H889: Master | I889: Yes | J889: Neither
A890: 983 | B890: 40097.594064849538 | C890: Mr | D890: HAMISH | E890: GODDARD | F890: Sailboard | G890: 24.815230196785208 | H890: Master | I890: Yes | J890: Neither
A891: 983 | B891: 40097.551409398147 | C891: Mr | D891: HAMISH | E891: GODDARD | F891: Sailboard | G891: 24.619375219972223 | H891: Master | I891: Yes | J891: Neither
A892: 983 | B892: 40097.603363981485 | C892: Mr | D892: HAMISH | E892: GODDARD | F892: Sailboard | G892: 24.457094599581268 | H892: Master | I892: Yes | J892: Neither
A893: 983 | B893: 40097.612704687497 | C893: Mr | D893: HAMISH | E893: GODDARD | F893: Sailboard | G893: 24.440137111441253 | H893: Master | I893: Yes | J893: Neither
A894: 983 | B894: 40097.617013483796 | C894: Mr | D894: HAMISH | E894: GODDARD | F894: Sailboard | G894: 24.408545330877629 | H894: Master | I894: Yes | J894: Neither
A895: 983 | B895: 40097.433170891207 | C895: Mr | D895: HAMISH | E895: GODDARD | F895: Sailboard | G895: 24.404038480630057 | H895: Master | I895: Yes | J895: Neither
A896: 983 | B896: 40097.588996168983 | C896: Mr | D896: HAMISH | E896: GODDARD | F896: Sailboard | G896: 24.36692416783599 | H896: Master | I896: Yes | J896: Neither
A897: 983 | B897: 40097.489615069448 | C897: Mr | D897: HAMISH | E897: GODDARD | F897: Sailboard | G897: 24.034624988463573 | H897: Master | I897: Yes | J897: Neither
A898: 983 | B898: 40097.598721168979 | C898: Mr | D898: HAMISH | E898: GODDARD | F898: Sailboard | G898: 24.00025894829777 | H898: Master | I898: Yes | J898: Neither
A899: 983 | B899: 40097.471467002317 | C899: Mr | D899: HAMISH | E899: GODDARD | F899: Sailboard | G899: 23.959474429311712 | H899: Master | I899: Yes | J899: Neither
A900: 983 | B900: 40097.565216273149 | C900: Mr | D900: HAMISH | E900: GODDARD | F900: Sailboard | G900: 23.787007228544404 | H900: Master | I900: Yes | J900: Neither
A901: 983 | B901: 40097.608163530094 | C901: Mr | D901: HAMISH | E901: GODDARD | F901: Sailboard | G901: 23.389250491996222 | H901: Master | I901: Yes | J901: Neither
A902: 983 | B902: 40097.579900613426 | C902: Mr | D902: HAMISH | E902: GODDARD | F902: Sailboard | G902: 22.865791762787275 | H902: Master | I902: Yes | J902: Neither
A903: 983 | B903: 40097.574427002313 | C903: Mr | D903: HAMISH | E903: GODDARD | F903: Sailboard | G903: 22.59994467083461 | H903: Master | I903: Yes | J903: Neither
A904: 983 | B904: 40097.501217453704 | C904: Mr | D904: HAMISH | E904: GODDARD | F904: Sailboard | G904: 2.3605670169583268 | H904: Master | I904: Yes | J904: Neither
A905: 1966 | B905: 40097.552360601854 | C905: Mr | D905: Martin | E905: Schramm | F905: Sailboard | G905: 24.344485001835068 | H905: Neither | I905: Yes | J905: Neither
A906: 1966 | B906: 40097.495697465281 | C906: Mr | D906: Martin | E906: Schramm | F906: Sailboard | G906: 24.206835331834064 | H906: Neither | I906: Yes | J906: Neither
A907: 1966 | B907: 40097.604535844905 | C907: Mr | D907: Martin | E907: Schramm | F907: Sailboard | G907: 23.263186631212807 | H907: Neither | I907: Yes | J907: Neither
A908: 1966 | B908: 40097.570679884258 | C908: Mr | D908: Martin | E908: Schramm | F908: Sailboard | G908: 22.049531079147847 | H908: Neither | I908: Yes | J908: Neither
A909: 2811 | B909: 40097.556903842589 | C909: Mr | D909: Henry | E909: Luce | F909: Sailboard | G909: 23.998080246274284 | H909: Master | I909: No | J909: Neither
A910: 2811 | B910: 40097.582408842594 | C910: Mr | D910: Henry | E910: Luce | F910: Sailboard | G910: 3.2244582286237859 | H910: Master | I910: No | J910: Neither